Session,Type,Title,Speaker,Institute,Country,Raw_Speaker_Data
,poster,Lévy walk of pions in heavy-ion collisions,"Kincses, Dániel",Eötvös Loránd University,Unknown,"{'_type': 'ContributionParticipation', '_fossil': 'contributionParticipationMetadata', 'first_name': 'Dániel', 'last_name': 'Kincses', 'fullName': 'Kincses, Dániel', 'id': '9360797', 'affiliation': 'Eötvös Loránd University', 'emailHash': '860850e0dfd37bbb5e331a3d2c534a1a', 'db_id': 9360797, 'person_id': 8866555}"
,poster,Understanding the chiral transition in 2+1 flavor QCD with Mobius domain wall fermions,"Sharma, Sayantan",IMSc,United States,"{'_type': 'ContributionParticipation', '_fossil': 'contributionParticipationMetadata', 'first_name': 'Sayantan', 'last_name': 'Sharma', 'fullName': 'Sharma, Sayantan', 'id': '9360794', 'affiliation': 'IMSc', 'emailHash': 'b31b74e4ff5ebc2b24b33ae76cb1441b', 'db_id': 9360794, 'person_id': 8930551}"
,poster,Towards Causal Relativistic Spin Hydrodynamics,"Bhadury, Samapan",Jagiellonian University,Unknown,"{'_type': 'ContributionParticipation', '_fossil': 'contributionParticipationMetadata', 'first_name': 'Samapan', 'last_name': 'Bhadury', 'fullName': 'Bhadury, Samapan', 'id': '9360793', 'affiliation': 'Jagiellonian University', 'emailHash': '1291664b495d21b5ca07af5420c4688e', 'db_id': 9360793, 'person_id': 8891055}"
,poster,Nonextensivity and temperature fluctuations of the Higgs boson production,"Rosales Herrera, Diana",Autonomous University of Puebla (MX),Unknown,"{'_type': 'ContributionParticipation', '_fossil': 'contributionParticipationMetadata', 'first_name': 'Diana', 'last_name': 'Rosales Herrera', 'fullName': 'Rosales Herrera, Diana', 'id': '9360784', 'affiliation': 'Autonomous University of Puebla (MX)', 'emailHash': '41aee98fc93ba8aaed92ad4211c3f5a5', 'db_id': 9360784, 'person_id': 8889193}"
,poster,Target jet substructure and correlation,"Kuo, Meng-Hsiu",Unknown,Unknown,"{'_type': 'ContributionParticipation', '_fossil': 'contributionParticipationMetadata', 'first_name': 'Meng-Hsiu', 'last_name': 'Kuo', 'fullName': 'Kuo, Meng-Hsiu', 'id': '9316048', 'affiliation': '', 'emailHash': 'efa48d9b0b088a27d93299f8424b9b47', 'db_id': 9316048, 'person_id': 8877806}"
,poster,Spectral sum rule and deconfinement transition in strongly-coupled QCD,"Tywoniuk, Konrad",University of Bergen (NO),Unknown,"{'_type': 'ContributionParticipation', '_fossil': 'contributionParticipationMetadata', 'first_name': 'Konrad', 'last_name': 'Tywoniuk', 'fullName': 'Tywoniuk, Konrad', 'id': '9316044', 'affiliation': 'University of Bergen (NO)', 'emailHash': 'df738629582fef56010a3f70f0094d9f', 'db_id': 9316044, 'person_id': 8877311}"
,poster,Going against the flow: Revealing the QCD degrees of freedom in hadronic collisions,"Törnkvist, ROBIN",Universidade de Santiago de Compostela - IGFAE,Unknown,"{'_type': 'ContributionParticipation', '_fossil': 'contributionParticipationMetadata', 'first_name': 'ROBIN', 'last_name': 'Törnkvist', 'fullName': 'Törnkvist, ROBIN', 'id': '9316040', 'affiliation': 'Universidade de Santiago de Compostela - IGFAE', 'emailHash': 'e1f128ec4cfc640fb771e52e237680e5', 'db_id': 9316040, 'person_id': 8902414}"
,poster,Quenching through the chiral phase transition,"Florio, Adrien",Unknown,Unknown,"{'_type': 'ContributionParticipation', '_fossil': 'contributionParticipationMetadata', 'first_name': 'Adrien', 'last_name': 'Florio', 'fullName': 'Florio, Adrien', 'id': '9316033', 'affiliation': '', 'emailHash': 'd6e5e877b39e7247f802ba41057c0ac9', 'db_id': 9316033, 'person_id': 8932889}"
,poster,Charm and Beauty diffusion in proton-nucleus collisions: anisotropic diffusion in the early stage in a fully consistent 3+1D framework,"Parisi, Gabriele",Università degli Studi di Catania,Unknown,"{'_type': 'ContributionParticipation', '_fossil': 'contributionParticipationMetadata', 'first_name': 'Gabriele', 'last_name': 'Parisi', 'fullName': 'Parisi, Gabriele', 'id': '9316023', 'affiliation': 'Università degli Studi di Catania', 'emailHash': '5cee0d0ee7461cc26076a5fd74ef509b', 'db_id': 9316023, 'person_id': 8934361}"
,poster,Effects of temperature and energy scale on jet thermalization,"Garcia Montero, Oscar Jesús",Unknown,Unknown,"{'_type': 'ContributionParticipation', '_fossil': 'contributionParticipationMetadata', 'first_name': 'Oscar Jesús', 'last_name': 'Garcia Montero', 'fullName': 'Garcia Montero, Oscar Jesús', 'id': '9316018', 'affiliation': '', 'emailHash': 'ff2d08ade59941a09862dc3658c2287a', 'db_id': 9316018, 'person_id': 8928269}"
,poster,Relaxation rate of scalar field next to a second order phase transition,"Grossi, Eduardo",University of Florence & INFN Florence,Unknown,"{'_type': 'ContributionParticipation', '_fossil': 'contributionParticipationMetadata', 'first_name': 'Eduardo', 'last_name': 'Grossi', 'fullName': 'Grossi, Eduardo', 'id': '9316016', 'affiliation': '', 'emailHash': 'ea7643689ddbe2d8de22f66c0206ef12', 'db_id': 9316016, 'person_id': 8876647}"
,poster,Combinants and correlation functions in nuclear collisions: some intriguing properties of multiplicity distributions,"Rybczynski, Maciej",Jan Kochanowski University (PL),Poland,"{'_type': 'ContributionParticipation', '_fossil': 'contributionParticipationMetadata', 'first_name': 'Maciej', 'last_name': 'Rybczynski', 'fullName': 'Rybczynski, Maciej', 'id': '9316014', 'affiliation': 'Jan Kochanowski University (PL)', 'emailHash': 'b74af7605d1c53ba11db0cf41f144aba', 'db_id': 9316014, 'person_id': 8896548}"
,poster,Baryon-Strangeness correlation in p+p and Au+Au collisions at $\sqrt{s_{NN}}$ = 200 GeV in UrQMD and PYTHIA model,"Pandav, Ashish","National Institute of Science Education and Research, Bhubaneswar",Unknown,"{'_type': 'ContributionParticipation', '_fossil': 'contributionParticipationMetadata', 'first_name': 'Ashish', 'last_name': 'Pandav', 'fullName': 'Pandav, Ashish', 'id': '9316010', 'affiliation': '', 'emailHash': 'ddd2f890fc6fd0214f8fa85814d6ff41', 'db_id': 9316010, 'person_id': 8940175}"
,poster,Mapping the longitudinal structure of QGP via nuclear deformations in heavy ion collisions,"Lumeng, Liu",Fudan University,Unknown,"{'_type': 'ContributionParticipation', '_fossil': 'contributionParticipationMetadata', 'first_name': 'Liu', 'last_name': 'Lumeng', 'fullName': 'Lumeng, Liu', 'id': '9316008', 'affiliation': 'Fudan University', 'emailHash': '64c61224357daee92d3abd1518028145', 'db_id': 9316008, 'person_id': 8841428}"
,poster,Study of the effect of mass on the baryon correlation puzzle using the ALICE experiment,"Chochulska, Zuzanna Anna",Warsaw University of Technology (PL),Poland,"{'_type': 'ContributionParticipation', '_fossil': 'contributionParticipationMetadata', 'first_name': 'Zuzanna Anna', 'last_name': 'Chochulska', 'fullName': 'Chochulska, Zuzanna Anna', 'id': '9294164', 'affiliation': 'Warsaw University of Technology (PL)', 'emailHash': 'e8cb9eed564b41266da30fdfbe0fc0e6', 'db_id': 9294164, 'person_id': 8940144}"
,poster,Dijet invariant mass in pp and p--Pb collisions at $\sqrt{s_\mathrm{NN}}=5.02$ TeV with ALICE,"Huhta, Laura",University of Jyvaskyla (FI),FI,"{'_type': 'ContributionParticipation', '_fossil': 'contributionParticipationMetadata', 'first_name': 'Laura', 'last_name': 'Huhta', 'fullName': 'Huhta, Laura', 'id': '9294163', 'affiliation': 'University of Jyvaskyla (FI)', 'emailHash': 'ec321bb18e3ea21420d784a6f0a88602', 'db_id': 9294163, 'person_id': 8939457}"
,poster,Performance evaluation of p-type silicon sensors for the ALICE FoCal-E  in irradiation tests,"Takamura, Mai",Nara Women's University (JP),Unknown,"{'_type': 'ContributionParticipation', '_fossil': 'contributionParticipationMetadata', 'first_name': 'Mai', 'last_name': 'Takamura', 'fullName': 'Takamura, Mai', 'id': '9294162', 'affiliation': ""Nara Women's University (JP)"", 'emailHash': '4bd6f4fee1f62bcc8a8882ff9cf536b8', 'db_id': 9294162, 'person_id': 8938900}"
,poster,Performance study of non-prompt $J/\psi$ production in Pb--Pb collisions at $\sqrt{s_{\rm NN}}=5.36$ TeV from ALICE,"Ji, Yuanjing",GSI - Helmholtzzentrum fur Schwerionenforschung GmbH (DE),Germany,"{'_type': 'ContributionParticipation', '_fossil': 'contributionParticipationMetadata', 'first_name': 'Yuanjing', 'last_name': 'Ji', 'fullName': 'Ji, Yuanjing', 'id': '9294161', 'affiliation': 'GSI - Helmholtzzentrum fur Schwerionenforschung GmbH (DE)', 'emailHash': 'b066e5a8c9fea8a2767567f5856dafd6', 'db_id': 9294161, 'person_id': 8938840}"
,poster,Light-flavor particle production as a function of transverse spherocity in high-multiplicity pp collisions,"Nassirpour, Adrian Fereydon",Sejong University (KR),SE,"{'_type': 'ContributionParticipation', '_fossil': 'contributionParticipationMetadata', 'first_name': 'Adrian Fereydon', 'last_name': 'Nassirpour', 'fullName': 'Nassirpour, Adrian Fereydon', 'id': '9294160', 'affiliation': 'Sejong University (KR)', 'emailHash': '45dceafc80ec6bce1a62e5115d0b16d4', 'db_id': 9294160, 'person_id': 8937808}"
,poster,Probing the $\Xi^-$ interaction with nucleons in two- and three-body systems with ALICE,"Mantzaridis, Georgios",Technische Universitaet Muenchen (DE),Unknown,"{'_type': 'ContributionParticipation', '_fossil': 'contributionParticipationMetadata', 'first_name': 'Georgios', 'last_name': 'Mantzaridis', 'fullName': 'Mantzaridis, Georgios', 'id': '9294159', 'affiliation': 'Technische Universitaet Muenchen (DE)', 'emailHash': '8097efc3b74254ba1f70d7b435cf89f0', 'db_id': 9294159, 'person_id': 8937568}"
,poster,Hadron-photon correlations in pp collisions in ALICE using POWHEG and PYTHIA,"Stratmann, Peter",Universität Münster (DE),Germany,"{'_type': 'ContributionParticipation', '_fossil': 'contributionParticipationMetadata', 'first_name': 'Peter', 'last_name': 'Stratmann', 'fullName': 'Stratmann, Peter', 'id': '9294157', 'affiliation': 'Universität Münster (DE)', 'emailHash': '7b2f889b7f08393d07c55d3cde404d81', 'db_id': 9294157, 'person_id': 8937376}"
,poster,Characterising the modification of charged jets using using event shape engineering in Pb--Pb Collisions at $\sqrt{s_{\mathrm{NN}}} = 5.36$ TeV with the ALICE Detector,"Hansen, Joachim",Lund University (SE),SE,"{'_type': 'ContributionParticipation', '_fossil': 'contributionParticipationMetadata', 'first_name': 'Joachim', 'last_name': 'Hansen', 'fullName': 'Hansen, Joachim', 'id': '9294155', 'affiliation': 'Lund University (SE)', 'emailHash': '8242c6dca027478044e9a5f3d39e1a39', 'db_id': 9294155, 'person_id': 8937097}"
,poster,Sensor Prototypes for the ALICE ITS3 Upgrade,"Tiltmann, Nicolas","CERN, Universität Münster (DE)",Switzerland,"{'_type': 'ContributionParticipation', '_fossil': 'contributionParticipationMetadata', 'first_name': 'Nicolas', 'last_name': 'Tiltmann', 'fullName': 'Tiltmann, Nicolas', 'id': '9294154', 'affiliation': 'CERN, Universität Münster (DE)', 'emailHash': 'd1c02987beb313db0d5f489871c14101', 'db_id': 9294154, 'person_id': 8937049}"
,poster,Measurements of the beauty-jet cross section in pp collisions with a variety of techniques using the ALICE detector,"Park, Hanseo",University of Tsukuba (JP),UK,"{'_type': 'ContributionParticipation', '_fossil': 'contributionParticipationMetadata', 'first_name': 'Hanseo', 'last_name': 'Park', 'fullName': 'Park, Hanseo', 'id': '9294152', 'affiliation': 'University of Tsukuba (JP)', 'emailHash': 'd91dfd0916cd00a68cf6c86b76ab33f2', 'db_id': 9294152, 'person_id': 8937024}"
,poster,Flow of heavy-flavor hadrons in small systems with LHC-ALICE in Run 3 data,"Lejeune, Alexian Marc",Czech Technical University  in Prague (CZ),CZ,"{'_type': 'ContributionParticipation', '_fossil': 'contributionParticipationMetadata', 'first_name': 'Alexian Marc', 'last_name': 'Lejeune', 'fullName': 'Lejeune, Alexian Marc', 'id': '9294149', 'affiliation': 'Czech Technical University  in Prague (CZ)', 'emailHash': '918e91a7e72ae4c5ebc150dc453d0573', 'db_id': 9294149, 'person_id': 8935874}"
,poster,Unraveling the Hadronic Phase with Resonances in pp Collisions at LHC Run 3 with ALICE,"Koley, Hirak Kumar",Jadavpur University (IN),Unknown,"{'_type': 'ContributionParticipation', '_fossil': 'contributionParticipationMetadata', 'first_name': 'Hirak Kumar', 'last_name': 'Koley', 'fullName': 'Koley, Hirak Kumar', 'id': '9294148', 'affiliation': 'Jadavpur University (IN)', 'emailHash': '41cc6bd08bec67e246101732d4f17ff5', 'db_id': 9294148, 'person_id': 8934023}"
,poster,Open heavy-flavour decay lepton production by ALICE at the LHC,"Islam, Md Samsul",Indian Institute of Technology Bombay,Unknown,"{'_type': 'ContributionParticipation', '_fossil': 'contributionParticipationMetadata', 'first_name': 'Md Samsul', 'last_name': 'Islam', 'fullName': 'Islam, Md Samsul', 'id': '9294147', 'affiliation': 'Indian Institute of Technology Bombay', 'emailHash': '95f95fdfb4c932c01fd3a27f9e8840ee', 'db_id': 9294147, 'person_id': 8921085}"
,poster,Imaging Jet Modification with Energy Correlators in Pb-Pb collisions at $\sqrt{s_{NN}}$ = 5.02 TeV with ALICE,"Rai, Ananya",Yale University (US),USA,"{'_type': 'ContributionParticipation', '_fossil': 'contributionParticipationMetadata', 'first_name': 'Ananya', 'last_name': 'Rai', 'fullName': 'Rai, Ananya', 'id': '9294145', 'affiliation': 'Yale University (US)', 'emailHash': '099985cd574a51532994d0e8b4fa44f5', 'db_id': 9294145, 'person_id': 8899137}"
,poster,Studying Lambda-Hadron correlations in Pb-Pb collisions using the ALICE detector,"Staa, Joey",Lund University (SE),SE,"{'_type': 'ContributionParticipation', '_fossil': 'contributionParticipationMetadata', 'first_name': 'Joey', 'last_name': 'Staa', 'fullName': 'Staa, Joey', 'id': '9294144', 'affiliation': 'Lund University (SE)', 'emailHash': 'af5901c7be0258ed92926727cbe4f4c9', 'db_id': 9294144, 'person_id': 8932085}"
,poster,Measurement of $\Xi_{\mathrm{c}}^{+}$ baryon via hadronic decay channel in pp collisions at $\sqrt{\it{s}}$ = 13.6 TeV with ALICE,"Cho, Jaeyoon",Inha University (KR),KR,"{'_type': 'ContributionParticipation', '_fossil': 'contributionParticipationMetadata', 'first_name': 'Jaeyoon', 'last_name': 'Cho', 'fullName': 'Cho, Jaeyoon', 'id': '9294142', 'affiliation': 'Inha University (KR)', 'emailHash': 'ab8c591dbde0f324141ff92cf8e71c75', 'db_id': 9294142, 'person_id': 8932017}"
,poster,Performance of the Silicon pad sensors for the ALICE Forward Calorimeter upgrade at the LHC,"INABA, Motoi",Tsukuba University of Technology (JP),UK,"{'_type': 'ContributionParticipation', '_fossil': 'contributionParticipationMetadata', 'first_name': 'Motoi', 'last_name': 'INABA', 'fullName': 'INABA, Motoi', 'id': '9294140', 'affiliation': 'Tsukuba University of Technology (JP)', 'emailHash': 'bcc0255b5e674cfcd7acc4df91184cf7', 'db_id': 9294140, 'person_id': 8895211}"
,poster,Kaon isospin fluctuation in pp collisions at √s = 13.6 TeV with ALICE at the LHC,"Dash, Sadhana",IIT- Indian Institute of Technology (IN),India,"{'_type': 'ContributionParticipation', '_fossil': 'contributionParticipationMetadata', 'first_name': 'Sadhana', 'last_name': 'Dash', 'fullName': 'Dash, Sadhana', 'id': '9294139', 'affiliation': 'IIT- Indian Institute of Technology (IN)', 'emailHash': '6067bd5ecee5cd7702e5f7d0804d498d', 'db_id': 9294139, 'person_id': 8889740}"
,poster,"Comprehensive study of centrality-dependent charged Pion, Kaon, and Proton production in Pb-Pb collisions at √sNN = 5.36 TeV with ALICE","Deb, Rohaan",University of Brescia,Unknown,"{'_type': 'ContributionParticipation', '_fossil': 'contributionParticipationMetadata', 'first_name': 'Rohaan', 'last_name': 'Deb', 'fullName': 'Deb, Rohaan', 'id': '9294138', 'affiliation': 'University of Brescia', 'emailHash': 'fe73a086b17608a63e520623cd48bbd0', 'db_id': 9294138, 'person_id': 8931804}"
,poster,First ALICE measurement of $\text{B}^\pm \rightarrow \text{J}/\psi + \text{K}^\pm$ in pp collisions,"Storehaug, Ida",University of Oslo (NO),NO,"{'_type': 'ContributionParticipation', '_fossil': 'contributionParticipationMetadata', 'first_name': 'Ida', 'last_name': 'Storehaug', 'fullName': 'Storehaug, Ida', 'id': '9294137', 'affiliation': 'University of Oslo (NO)', 'emailHash': '7a09c7ad589194b3417069047ab3e1f5', 'db_id': 9294137, 'person_id': 8931179}"
,poster,Upsilon polarization measurements in pp collision at 13.6 TeV with ALICE,"Pradhan, Kshitish Kumar",IIT Indore,Unknown,"{'_type': 'ContributionParticipation', '_fossil': 'contributionParticipationMetadata', 'first_name': 'Kshitish Kumar', 'last_name': 'Pradhan', 'fullName': 'Pradhan, Kshitish Kumar', 'id': '9294135', 'affiliation': 'IIT Indore', 'emailHash': '281c26de010f50e43e1224d78d5f61ec', 'db_id': 9294135, 'person_id': 8881685}"
,poster,Multiplicity dependence of inclusive charged-particle jet spectrum in pp collisions in Run 3 at \sqrt{s}=13.6 TeV with ALICE,"Bae, Joonsuk",Sungkyunkwan University (KR),KR,"{'_type': 'ContributionParticipation', '_fossil': 'contributionParticipationMetadata', 'first_name': 'Joonsuk', 'last_name': 'Bae', 'fullName': 'Bae, Joonsuk', 'id': '9294134', 'affiliation': 'Sungkyunkwan University (KR)', 'emailHash': 'f57dcc4f5ff613afece7fe2038dcb160', 'db_id': 9294134, 'person_id': 8930518}"
,poster,Measurements of weak boson production via electrons in pp collisions at 13 TeV with ALICE,"Ito, Subaru",University of Tsukuba (JP),UK,"{'_type': 'ContributionParticipation', '_fossil': 'contributionParticipationMetadata', 'first_name': 'Subaru', 'last_name': 'Ito', 'fullName': 'Ito, Subaru', 'id': '9294133', 'affiliation': 'University of Tsukuba (JP)', 'emailHash': 'a836da701ea78dcc68d8e5f77f7b0599', 'db_id': 9294133, 'person_id': 8930517}"
,poster,Low-mass Drell-Yan measurements with the upgraded ALICE detector,"Upadhyaya, Sahil","Institute of Nuclear Physics Polish Academy of Sciences, Kraków",UK,"{'_type': 'ContributionParticipation', '_fossil': 'contributionParticipationMetadata', 'first_name': 'Sahil', 'last_name': 'Upadhyaya', 'fullName': 'Upadhyaya, Sahil', 'id': '9294132', 'affiliation': 'Institute of Nuclear Physics Polish Academy of Sciences, Kraków', 'emailHash': '9d031f002c2c9db80ceeaaf015fac14f', 'db_id': 9294132, 'person_id': 8927751}"
,poster,Exploring the transverse momentum fraction of leading strange hadrons in mini-jets in pp collisions at $\sqrt{s} = 13$ TeV with ALICE,"Xu, Lang",Central China Normal University  CCNU (CN),France,"{'_type': 'ContributionParticipation', '_fossil': 'contributionParticipationMetadata', 'first_name': 'Lang', 'last_name': 'Xu', 'fullName': 'Xu, Lang', 'id': '9294131', 'affiliation': 'Central China Normal University  CCNU (CN)', 'emailHash': 'a7305a3204bd2ffa3524c104b763a7f3', 'db_id': 9294131, 'person_id': 8927138}"
,poster,Measurement of charged jet $v_2$ in Pb-Pb collisions at $\sqrt{s_{\rm(NN)}}$ = 5.36 TeV with ALICE,"Wang, Yubiao",Central China Normal University  CCNU (CN),Unknown,"{'_type': 'ContributionParticipation', '_fossil': 'contributionParticipationMetadata', 'first_name': 'Yubiao', 'last_name': 'Wang', 'fullName': 'Wang, Yubiao', 'id': '9294130', 'affiliation': 'Central China Normal University  CCNU (CN)', 'emailHash': '6a3e474cb12fe2337a1595e9c61beeb6', 'db_id': 9294130, 'person_id': 8926806}"
,poster,"Multiplicity dependent π, k and p production in pp collisions at √s= 13.6 TeV using ALICE TPC and TOF detectors","Barman, Banajit",Unknown,Unknown,"{'_type': 'ContributionParticipation', '_fossil': 'contributionParticipationMetadata', 'first_name': 'Banajit', 'last_name': 'Barman', 'fullName': 'Barman, Banajit', 'id': '9294127', 'affiliation': '', 'emailHash': '2a26f0191045439d7ea4fef3620968b3', 'db_id': 9294127, 'person_id': 8926092}"
,poster,Charged energy correlators in small systems with ALICE,"Hwang, Tucker",University of California Berkeley (US),USA,"{'_type': 'ContributionParticipation', '_fossil': 'contributionParticipationMetadata', 'first_name': 'Tucker', 'last_name': 'Hwang', 'fullName': 'Hwang, Tucker', 'id': '9294125', 'affiliation': 'University of California Berkeley (US)', 'emailHash': '6ad7c63b6347eef34844001cb854d5ac', 'db_id': 9294125, 'person_id': 8926044}"
,poster,J/ψ polarization measurement at forward rapidity in pp collisions at √s = 13.6 TeV with ALICE at the LHC,"Sahoo, Bhagyarathi",Indian Institute of Technology  Indore (IN),India,"{'_type': 'ContributionParticipation', '_fossil': 'contributionParticipationMetadata', 'first_name': 'Bhagyarathi', 'last_name': 'Sahoo', 'fullName': 'Sahoo, Bhagyarathi', 'id': '9294124', 'affiliation': 'Indian Institute of Technology  Indore (IN)', 'emailHash': '3d9f41160da742feb24a9b4e42d1a94d', 'db_id': 9294124, 'person_id': 8900512}"
,poster,Fast simulations with ALICE 3,"Karlsson Gumprecht, Jesper",Austrian Academy of Sciences (AT),Unknown,"{'_type': 'ContributionParticipation', '_fossil': 'contributionParticipationMetadata', 'first_name': 'Jesper', 'last_name': 'Karlsson Gumprecht', 'fullName': 'Karlsson Gumprecht, Jesper', 'id': '9294122', 'affiliation': 'Austrian Academy of Sciences (AT)', 'emailHash': 'fcaaf45bab6854985df91907c09c731f', 'db_id': 9294122, 'person_id': 8923873}"
,poster,Multiplicity dependence of W boson and associated hadron production in pp collisions at $\sqrt{s}=$ 13 TeV with ALICE,"Sakai, Shingo",University of Tsukuba (JP),UK,"{'_type': 'ContributionParticipation', '_fossil': 'contributionParticipationMetadata', 'first_name': 'Shingo', 'last_name': 'Sakai', 'fullName': 'Sakai, Shingo', 'id': '9294121', 'affiliation': 'University of Tsukuba (JP)', 'emailHash': '053c2ce3fdd8c87400a25d85e2a8b235', 'db_id': 9294121, 'person_id': 8922825}"
,poster,Local multiplicity fluctuations in the charged particles produced in Xe--Xe collisions at $\sqrt{s_{NN}} = 5.44 $ TeV with ALICE,"Gupta, Ramni",University of Jammu (IN),Unknown,"{'_type': 'ContributionParticipation', '_fossil': 'contributionParticipationMetadata', 'first_name': 'Ramni', 'last_name': 'Gupta', 'fullName': 'Gupta, Ramni', 'id': '9294119', 'affiliation': 'University of Jammu (IN)', 'emailHash': 'a2ed4fae7ac72b0459524b843589b84e', 'db_id': 9294119, 'person_id': 8894063}"
,poster,Status of luminosity determination for the LHC Run 3 in ALICE,"Kim, Minjae",Pusan National University (KR),USA,"{'_type': 'ContributionParticipation', '_fossil': 'contributionParticipationMetadata', 'first_name': 'Minjae', 'last_name': 'Kim', 'fullName': 'Kim, Minjae', 'id': '9294118', 'affiliation': 'Pusan National University (KR)', 'emailHash': 'bf530889eeb3328fdc208533a091417c', 'db_id': 9294118, 'person_id': 8922042}"
,poster,Event-by-event mean transverse momentum fluctuations of identified particles in pp collisions at √s = 13.6 TeV with ALICE at the LHC in Run 3 data,"Gahlaut, Tanu",IIT- Indian Institute of Technology (IN),India,"{'_type': 'ContributionParticipation', '_fossil': 'contributionParticipationMetadata', 'first_name': 'Tanu', 'last_name': 'Gahlaut', 'fullName': 'Gahlaut, Tanu', 'id': '9294117', 'affiliation': 'IIT- Indian Institute of Technology (IN)', 'emailHash': '2de53a2589324b87e16a2c9d83947c37', 'db_id': 9294117, 'person_id': 8883139}"
,poster,Investigating the strangeness enhancement through h-$\phi(1020)$ correlations  in pp collisions at $\sqrt{s}$ = 13.6 TeV with ALICE at the LHC,"Verma, Rahul",IIT- Indian Institute of Technology (IN),India,"{'_type': 'ContributionParticipation', '_fossil': 'contributionParticipationMetadata', 'first_name': 'Rahul', 'last_name': 'Verma', 'fullName': 'Verma, Rahul', 'id': '9294116', 'affiliation': 'IIT- Indian Institute of Technology (IN)', 'emailHash': '29bc2f74d3c9b31ddbf32d753f462de4', 'db_id': 9294116, 'person_id': 8921382}"
,poster,Investigating the ψ(2S)/J/ψ production ratio in high-multiplicity pp collisions at $\sqrt{\rm{s}}$ = 13.6 TeV with ALICE,"Behera, Debadatta",Indian Institute of Technology  Indore (IN),India,"{'_type': 'ContributionParticipation', '_fossil': 'contributionParticipationMetadata', 'first_name': 'Debadatta', 'last_name': 'Behera', 'fullName': 'Behera, Debadatta', 'id': '9294114', 'affiliation': 'Indian Institute of Technology  Indore (IN)', 'emailHash': 'af61cb8a19570671d659fe0d7805e6f2', 'db_id': 9294114, 'person_id': 8919499}"
,poster,FoCal-H Development and Performance Evaluation with H2GCROC,"Jia, Shihai",University of Copenhagen (DK),DK,"{'_type': 'ContributionParticipation', '_fossil': 'contributionParticipationMetadata', 'first_name': 'Shihai', 'last_name': 'Jia', 'fullName': 'Jia, Shihai', 'id': '9294113', 'affiliation': 'University of Copenhagen (DK)', 'emailHash': 'b63b000237d5c34815f80c819eb498f5', 'db_id': 9294113, 'person_id': 8919393}"
,poster,The ALPIDE Pixel Layers in ALICE FoCal,"Rauch, Max Philip",University of Bergen (NO),NO,"{'_type': 'ContributionParticipation', '_fossil': 'contributionParticipationMetadata', 'first_name': 'Max Philip', 'last_name': 'Rauch', 'fullName': 'Rauch, Max Philip', 'id': '9294112', 'affiliation': 'University of Bergen (NO)', 'emailHash': 'fbb9e5fba57c9faf3886aff89188537b', 'db_id': 9294112, 'person_id': 8918435}"
,poster,Measurements of charged-particle jet spectrum and modifications in Pb--Pb collisions using Run 3 data with ALICE,"Feng, Wenhui",Central China Normal University  CCNU (CN),Unknown,"{'_type': 'ContributionParticipation', '_fossil': 'contributionParticipationMetadata', 'first_name': 'Wenhui', 'last_name': 'Feng', 'fullName': 'Feng, Wenhui', 'id': '9294111', 'affiliation': 'Central China Normal University  CCNU (CN)', 'emailHash': '1fdfad423f1e2357285c34ca92899a8e', 'db_id': 9294111, 'person_id': 8917316}"
,poster,Forward Detectors for the ALICE 3 upgrade,"Kurashvili, Podist",National Centre for Nuclear Research (PL),UK,"{'_type': 'ContributionParticipation', '_fossil': 'contributionParticipationMetadata', 'first_name': 'Podist', 'last_name': 'Kurashvili', 'fullName': 'Kurashvili, Podist', 'id': '9396511', 'affiliation': 'National Centre for Nuclear Research (PL)', 'emailHash': '5c546119d8f4f52407e8dd6f4b542212', 'db_id': 9396511, 'person_id': 9140565}"
