Session,Type,Title,Speaker,Institute,Country,Raw_Speaker_Data
Parallel session 9,parallel,Covariant Formulation of Semi-Classical Spin Hydrodynamics and Equilibration of Spin: Linear and Nonlinear Perspectives,"Shokri, Masoud","Goethe University, ITP",Unknown,"{'_type': 'ContributionParticipation', '_fossil': 'contributionParticipationMetadata', 'first_name': 'Masoud', 'last_name': 'Shokri', 'fullName': 'Shokri, Masoud', 'id': '9288758', 'affiliation': 'Goethe University, ITP', 'emailHash': '9931bbf824507435f6505164e4926e46', 'db_id': 9288758, 'person_id': 8883170}"
Parallel session 19,parallel,Resummed spin hydrodynamics from quantum kinetic theory,"Wagner, David",Florence University,Unknown,"{'_type': 'ContributionParticipation', '_fossil': 'contributionParticipationMetadata', 'first_name': 'David', 'last_name': 'Wagner', 'fullName': 'Wagner, David', 'id': '9288651', 'affiliation': 'Florence University', 'emailHash': 'db88d714ce22f10d52319aa4b07d7884', 'db_id': 9288651, 'person_id': 8872469}"
Parallel session 19,parallel,Nonlinear causality and strong hyperbolicity of baryon-rich Israel-Stewart hydrodynamics,"Cordeiro, Ian",University of Illinois at Urbana Champaign,USA,"{'_type': 'ContributionParticipation', '_fossil': 'contributionParticipationMetadata', 'first_name': 'Ian', 'last_name': 'Cordeiro', 'fullName': 'Cordeiro, Ian', 'id': '9288656', 'affiliation': 'University of Illinois at Urbana Champaign', 'emailHash': '282da3400e353d1c6bbc068fd0491d96', 'db_id': 9288656, 'person_id': 8874288}"
Parallel session 19,parallel,Exploring the impact of strong-force fields on $\phi$- meson spin alignment within a quantum relativistic transport approach,"Oliva, Lucia","Università di Catania, INFN Catania",Unknown,"{'_type': 'ContributionParticipation', '_fossil': 'contributionParticipationMetadata', 'first_name': 'Lucia', 'last_name': 'Oliva', 'fullName': 'Oliva, Lucia', 'id': '9288697', 'affiliation': 'Università di Catania, INFN Catania', 'emailHash': 'b67bf8cf7ee45403fbf5278cc130dfe0', 'db_id': 9288697, 'person_id': 8869672}"
Parallel session 19,parallel,An end-to-end generative model for heavy-ion collisions,"Sun, Jing-an",Fudan University,Unknown,"{'_type': 'ContributionParticipation', '_fossil': 'contributionParticipationMetadata', 'first_name': 'Jing-an', 'last_name': 'Sun', 'fullName': 'Sun, Jing-an', 'id': '9288736', 'affiliation': 'Fudan University', 'emailHash': 'd7ec17053fa1616a448b345688498645', 'db_id': 9288736, 'person_id': 8885671}"
Parallel session 19,parallel,Understanding quantum corrections to momentum broadening in a weakly coupled QGP,"Weitz, Eamonn",Universität Bielefeld,Unknown,"{'_type': 'ContributionParticipation', '_fossil': 'contributionParticipationMetadata', 'first_name': 'Eamonn', 'last_name': 'Weitz', 'fullName': 'Weitz, Eamonn', 'id': '9288754', 'affiliation': 'Universität Bielefeld', 'emailHash': 'a6921bc86d65b08824cc6e55815fa56b', 'db_id': 9288754, 'person_id': 8888995}"
Parallel session 25,parallel,Finite-temperature expansion of the dense-matter equation of state,"Mroczek, Débora",University of Illinois at Urbana-Champaign,USA,"{'_type': 'ContributionParticipation', '_fossil': 'contributionParticipationMetadata', 'first_name': 'Débora', 'last_name': 'Mroczek', 'fullName': 'Mroczek, Débora', 'id': '9288787', 'affiliation': 'University of Illinois at Urbana-Champaign', 'emailHash': 'daac40618a0e71f441dfb944016c60c4', 'db_id': 9288787, 'person_id': 8893579}"
Parallel session 25,parallel,"Lambda potential in dense matter from chiral EFT: Bridging heavy-ion collisions, hypernuclei, and neutron stars","Jinno, Asanosuke",Kyoto University,Unknown,"{'_type': 'ContributionParticipation', '_fossil': 'contributionParticipationMetadata', 'first_name': 'Asanosuke', 'last_name': 'Jinno', 'fullName': 'Jinno, Asanosuke', 'id': '9288841', 'affiliation': '', 'emailHash': 'ca785abda4ddbd6e21f354858fcccb47', 'db_id': 9288841, 'person_id': 8922840}"
Parallel session 25,parallel,Astrophysical Equation-of-State Constraints on the Color-Superconducting Gap,"Steinhorst, Rachel",Massachusetts Institute of Technology,USA,"{'_type': 'ContributionParticipation', '_fossil': 'contributionParticipationMetadata', 'first_name': 'Rachel', 'last_name': 'Steinhorst', 'fullName': 'Steinhorst, Rachel', 'id': '9288891', 'affiliation': 'Massachusetts Institute of Technology', 'emailHash': 'd911b39caa76918eeff76a01d5971dd2', 'db_id': 9288891, 'person_id': 8932301}"
Parallel session 25,parallel,Quark matter at four loops,"Paatelainen, Risto",University of Jyväskylä,Unknown,"{'_type': 'ContributionParticipation', '_fossil': 'contributionParticipationMetadata', 'first_name': 'Risto', 'last_name': 'Paatelainen', 'fullName': 'Paatelainen, Risto', 'id': '9289002', 'affiliation': '', 'emailHash': '75eabc525ad1d2e2e239b656e77af997', 'db_id': 9289002, 'person_id': 8940167}"
Parallel session 25,parallel,Listening to the long ringdown: a novel way to pinpoint the equation of state in neutron star cores,"Ecker, Christian",Goethe,Unknown,"{'_type': 'ContributionParticipation', '_fossil': 'contributionParticipationMetadata', 'first_name': 'Christian', 'last_name': 'Ecker', 'fullName': 'Ecker, Christian', 'id': '9288978', 'affiliation': 'Goethe', 'emailHash': 'b8b179020045474ca0d6d7a5db8da145', 'db_id': 9288978, 'person_id': 8938456}"
,poster,Measurement of a caloric curve and chiral symmetry restoration with the NA60+ experiment at the CERN SPS,"Usai, Gianluca","Universita e INFN, Cagliari (IT)",Italy,"{'_type': 'ContributionParticipation', '_fossil': 'contributionParticipationMetadata', 'first_name': 'Gianluca', 'last_name': 'Usai', 'fullName': 'Usai, Gianluca', 'id': '9433690', 'affiliation': 'Universita e INFN, Cagliari (IT)', 'emailHash': '241ca76612b9689badf72eb36c50c626', 'db_id': 9433690, 'person_id': 8939615}"
Parallel session 9,parallel,The space of transport coefficients allowed by causality,"Heller, Michal",Ghent University,Unknown,"{'_type': 'ContributionParticipation', '_fossil': 'contributionParticipationMetadata', 'first_name': 'Michal', 'last_name': 'Heller', 'fullName': 'Heller, Michal', 'id': '9288984', 'affiliation': '', 'emailHash': 'c6a9b04f2032b5d725ba02dec761835d', 'db_id': 9288984, 'person_id': 8939076}"
,poster,Study of Medium Response to Low- to High-Momentum Partons in Heavy Ion Collisions,"Rebello Teles, Patricia",Brazilian Center for Physics Research - CBPF (BR),Unknown,"{'_type': 'ContributionParticipation', '_fossil': 'contributionParticipationMetadata', 'first_name': 'Patricia', 'last_name': 'Rebello Teles', 'fullName': 'Rebello Teles, Patricia', 'id': '9430115', 'affiliation': 'Brazilian Center for Physics Research - CBPF (BR)', 'emailHash': '1c0d8ab91a2499ace0d6a6b8708fa5eb', 'db_id': 9430115, 'person_id': 9171937}"
,poster,Application of monolithic CMOS pixel sensors to a probe for radioguided surgery,"Terrevoli, Cristina","Universita e INFN, Bari (IT)",United States,"{'_type': 'ContributionParticipation', '_fossil': 'contributionParticipationMetadata', 'first_name': 'Cristina', 'last_name': 'Terrevoli', 'fullName': 'Terrevoli, Cristina', 'id': '9422635', 'affiliation': 'Universita e INFN, Bari (IT)', 'emailHash': 'd73b9fbc5d6ab794e2111564fe857bea', 'db_id': 9422635, 'person_id': 9165174}"
,poster,Azimuthal anisotropy measurements of heavy flavor probes at large rapidities at RHIC energies measured by the PHENIX experiment,"Velkovska, Julia",Vanderbilt University (US),USA,"{'_type': 'ContributionParticipation', '_fossil': 'contributionParticipationMetadata', 'first_name': 'Julia', 'last_name': 'Velkovska', 'fullName': 'Velkovska, Julia', 'id': '9422602', 'affiliation': 'Vanderbilt University (US)', 'emailHash': '6f8dcac38932897c936ddb727c7bce6f', 'db_id': 9422602, 'person_id': 9165142}"
,poster,PHENIX results on identified hadron spectra in small and large systems,"Mitrankova, Mariia",Stony Brook University,United States,"{'_type': 'ContributionParticipation', '_fossil': 'contributionParticipationMetadata', 'first_name': 'Mariia', 'last_name': 'Mitrankova', 'fullName': 'Mitrankova, Mariia', 'id': '9422600', 'affiliation': '', 'emailHash': '4df4aed8941b585aad62b367d9fcc153', 'db_id': 9422600, 'person_id': 9165136}"
,poster,Probing the QCD Phase Structure with Elliptic Flow in Au+Au Collisions at $\sqrt{s_{NN}}$ = 3.0-19.6 GeV at RHIC,"Wang, Guoping",Central China Normal University,Unknown,"{'_type': 'ContributionParticipation', '_fossil': 'contributionParticipationMetadata', 'first_name': 'Guoping', 'last_name': 'Wang', 'fullName': 'Wang, Guoping', 'id': '9294030', 'affiliation': '', 'emailHash': 'a9a4ac3f6bd80280d2f079d07fcb5864', 'db_id': 9294030, 'person_id': 8934089}"
,poster,(Anti-)Proton and Light Nuclei Production in 3 GeV Au+Au Collisions from RHIC-STAR,"Zhu, Chenghao",Unknown,Unknown,"{'_type': 'ContributionParticipation', '_fossil': 'contributionParticipationMetadata', 'first_name': 'Chenghao', 'last_name': 'Zhu', 'fullName': 'Zhu, Chenghao', 'id': '9361521', 'affiliation': '', 'emailHash': '1e21f45a73084fadce1848b6991d3d78', 'db_id': 9361521, 'person_id': 8935479}"
,poster,Exclusive $\Upsilon$(1S) and $J/\psi$ photoproduction in Ultraperipheral pPb Collisions at 8.16 TeV with the CMS experiment,"Singh, Man",Indian Institute of Technology Madras (IN),Unknown,"{'_type': 'ContributionParticipation', '_fossil': 'contributionParticipationMetadata', 'first_name': 'Man', 'last_name': 'Singh', 'fullName': 'Singh, Man', 'id': '9412538', 'affiliation': 'Indian Institute of Technology Madras (IN)', 'emailHash': '9d914229b8eaf880d8d5fb00cc74fe7d', 'db_id': 9412538, 'person_id': 9155632}"
,poster,Measuring flow harmonics up to order 12 and multiparticle correlations in PbPb collisions with the CMS experiment,"Tuo, Shengquan",Vanderbilt University (US),USA,"{'_type': 'ContributionParticipation', '_fossil': 'contributionParticipationMetadata', 'first_name': 'Shengquan', 'last_name': 'Tuo', 'fullName': 'Tuo, Shengquan', 'id': '9412537', 'affiliation': 'Vanderbilt University (US)', 'emailHash': 'a0e6de96706d08721cb3f4ef2d6d30e6', 'db_id': 9412537, 'person_id': 9155627}"
,poster,Light hypernuclei production in small collision systems with ALICE,"Reetz, Carolina Anna",Heidelberg University (DE),Germany,"{'_type': 'ContributionParticipation', '_fossil': 'contributionParticipationMetadata', 'first_name': 'Carolina Anna', 'last_name': 'Reetz', 'fullName': 'Reetz, Carolina Anna', 'id': '9406009', 'affiliation': 'Heidelberg University (DE)', 'emailHash': 'e20aa0cef13129ac78e2cf377966f40a', 'db_id': 9406009, 'person_id': 9149669}"
,poster,sPHENIX Novel Jet Background Subtraction and Full Detector Simulation Using Self-Supervised Generative AI Models,"Go, Yeonju",Brookhaven National Laboratory (US),USA,"{'_type': 'ContributionParticipation', '_fossil': 'contributionParticipationMetadata', 'first_name': 'Yeonju', 'last_name': 'Go', 'fullName': 'Go, Yeonju', 'id': '9396422', 'affiliation': 'Brookhaven National Laboratory (US)', 'emailHash': '733954850ea550f91deb6269af9e4da5', 'db_id': 9396422, 'person_id': 9140465}"
,poster,New results in central exclusive production at LHCb,"Da Silva, Cesar Luiz",Los Alamos National Laboratory (US),USA,"{'_type': 'ContributionParticipation', '_fossil': 'contributionParticipationMetadata', 'first_name': 'Cesar Luiz', 'last_name': 'Da Silva', 'fullName': 'Da Silva, Cesar Luiz', 'id': '9396956', 'affiliation': 'Los Alamos National Laboratory (US)', 'emailHash': '5a81535046477886b3377b5c36c537b5', 'db_id': 9396956, 'person_id': 9140966}"
,poster,Unraveling fragmentation using jet substructure at LHCb,"Ramirez Garcia, Manuel",University of Michigan (US),USA,"{'_type': 'ContributionParticipation', '_fossil': 'contributionParticipationMetadata', 'first_name': 'Manuel', 'last_name': 'Ramirez Garcia', 'fullName': 'Ramirez Garcia, Manuel', 'id': '9396951', 'affiliation': 'University of Michigan (US)', 'emailHash': '6214e5917df2a1260f4566e5dd68cf73', 'db_id': 9396951, 'person_id': 9140960}"
,poster,Hadronization studies using heavy-flavour jets at LHCb,"Lesser, Ezra",CERN,Switzerland,"{'_type': 'ContributionParticipation', '_fossil': 'contributionParticipationMetadata', 'first_name': 'Ezra', 'last_name': 'Lesser', 'fullName': 'Lesser, Ezra', 'id': '9396940', 'affiliation': 'CERN', 'emailHash': 'd9e506ca85227c37972300c2eefeb9af', 'db_id': 9396940, 'person_id': 9140854}"
,poster,Charm hadronization with LHCb fixed-target,"Authier, Juliette","Laboratoire Leprince-Ringuet, CNRS (FR)",France,"{'_type': 'ContributionParticipation', '_fossil': 'contributionParticipationMetadata', 'first_name': 'Juliette', 'last_name': 'Authier', 'fullName': 'Authier, Juliette', 'id': '9396932', 'affiliation': 'Laboratoire Leprince-Ringuet, CNRS (FR)', 'emailHash': 'db67b6f87d253e92dc2ec03611bb2515', 'db_id': 9396932, 'person_id': 9140943}"
,poster,Hadronization studies at LHCb,"Luo, Yiheng",Peking University (CN),China,"{'_type': 'ContributionParticipation', '_fossil': 'contributionParticipationMetadata', 'first_name': 'Yiheng', 'last_name': 'Luo', 'fullName': 'Luo, Yiheng', 'id': '9396895', 'affiliation': 'Peking University (CN)', 'emailHash': '1f64403ed7c5a80d51e23529a8e9d92a', 'db_id': 9396895, 'person_id': 9140908}"
,poster,Operations and prospects for fixed-target data-taking with LHCb,"De Angelis, Camilla","Universita e INFN, Cagliari (IT)",Unknown,"{'_type': 'ContributionParticipation', '_fossil': 'contributionParticipationMetadata', 'first_name': 'Camilla', 'last_name': 'De Angelis', 'fullName': 'De Angelis, Camilla', 'id': '9396850', 'affiliation': 'Universita e INFN, Cagliari (IT)', 'emailHash': '5deebf491dbcf9fd8902e18ec40d5516', 'db_id': 9396850, 'person_id': 9140842}"
,poster,sPHENIX track reconstruction in streaming-readout data,"Stewart, David",Wayne State University,Unknown,"{'_type': 'ContributionParticipation', '_fossil': 'contributionParticipationMetadata', 'first_name': 'David', 'last_name': 'Stewart', 'fullName': 'Stewart, David', 'id': '9396409', 'affiliation': 'Wayne State University', 'emailHash': '499b2291d1b8b27da17b6e99c03ede69', 'db_id': 9396409, 'person_id': 9140443}"
,poster,sPHENIX commissioning with proton and nuclear beams,"Bathe, Stefan",Brookhaven National Laboratory (US),USA,"{'_type': 'ContributionParticipation', '_fossil': 'contributionParticipationMetadata', 'first_name': 'Stefan', 'last_name': 'Bathe', 'fullName': 'Bathe, Stefan', 'id': '9395763', 'affiliation': 'Brookhaven National Laboratory (US)', 'emailHash': 'fb2fcf06f68e13011a16d8f2b1475add', 'db_id': 9395763, 'person_id': 9140234}"
,poster,sPHENIX measurement of the first full calorimeter jet spectrum in p+p collisions at RHIC,"Narde, Apurva",University of Illinois Urbana-Champaign,USA,"{'_type': 'ContributionParticipation', '_fossil': 'contributionParticipationMetadata', 'first_name': 'Apurva', 'last_name': 'Narde', 'fullName': 'Narde, Apurva', 'id': '9395756', 'affiliation': 'University of Illinois Urbana-Champaign', 'emailHash': '3f42b3bb2c40eb271cd42a0ab5c06b7b', 'db_id': 9395756, 'person_id': 9140229}"
,poster,Measurement of thermal radiations in Au+Au collisions at 200 GeV by PHENIX,"Guo, Tongzhou",Stony Brook University,USA,"{'_type': 'ContributionParticipation', '_fossil': 'contributionParticipationMetadata', 'first_name': 'Tongzhou', 'last_name': 'Guo', 'fullName': 'Guo, Tongzhou', 'id': '9395543', 'affiliation': 'Stony Brook University', 'emailHash': 'b23d4aeae7a1984517e0e2ccb832e55c', 'db_id': 9395543, 'person_id': 9139978}"
,poster,Measurement of charm production cross-section in p+p collisions at 200 GeV by PHENIX,"Drees, Axel",Stony Brook University,United States,"{'_type': 'ContributionParticipation', '_fossil': 'contributionParticipationMetadata', 'first_name': 'Axel', 'last_name': 'Drees', 'fullName': 'Drees, Axel', 'id': '9395535', 'affiliation': '', 'emailHash': 'c37408438f63cc57fcdb78d1b0074558', 'db_id': 9395535, 'person_id': 9139970}"
,poster,Fraction of B-meson decays in $J/\psi$ yields at $\sqrt{s}=200$ GeV measured by the PHENIX detector,"Nouicer, Rachid",BNL,Unknown,"{'_type': 'ContributionParticipation', '_fossil': 'contributionParticipationMetadata', 'first_name': 'Rachid', 'last_name': 'Nouicer', 'fullName': 'Nouicer, Rachid', 'id': '9395504', 'affiliation': '', 'emailHash': '3040e318e850403fd595cce07706c471', 'db_id': 9395504, 'person_id': 9139942}"
,poster,Multiplicity dependence of $J/\psi$ and $\psi$(2S) charmonium states in $p+p$ collisions at $\sqrt{s}=$200 GeV measured by the PHENIX collaboration,"Liu, Ming Xiong",Los Alamos National Laboratory,USA,"{'_type': 'ContributionParticipation', '_fossil': 'contributionParticipationMetadata', 'first_name': 'Ming Xiong', 'last_name': 'Liu', 'fullName': 'Liu, Ming Xiong', 'id': '9395463', 'affiliation': 'Los Alamos National Laboratory', 'emailHash': '80ce58c4982cb6cd47474aab23635102', 'db_id': 9395463, 'person_id': 8937648}"
,poster,L\'{e}vy-stable two-pion Bose-Einstein correlations in PHENIX,"Nagy, Marton",Eotvos Lorand University (HU),Unknown,"{'_type': 'ContributionParticipation', '_fossil': 'contributionParticipationMetadata', 'first_name': 'Marton', 'last_name': 'Nagy', 'fullName': 'Nagy, Marton', 'id': '9395447', 'affiliation': 'Eotvos Lorand University (HU)', 'emailHash': 'caca7ab970a1230acd02d2b4032c1aa3', 'db_id': 9395447, 'person_id': 9139880}"
,poster,Strangeness production in γ-Pb collisions as a new probe of cold nuclear matter effects with ALICE,"Nepeivoda, Roman",Lund University (SE),SE,"{'_type': 'ContributionParticipation', '_fossil': 'contributionParticipationMetadata', 'first_name': 'Roman', 'last_name': 'Nepeivoda', 'fullName': 'Nepeivoda, Roman', 'id': '9385709', 'affiliation': 'Lund University (SE)', 'emailHash': '3d207ad55482c1202b35b1157667d282', 'db_id': 9385709, 'person_id': 9129483}"
,poster,Particle production in inelastic photonuclear interactions in ultra-peripheral Pb–Pb collisions with ALICE,"Dudi, Sandeep",National Institute of Science  Education and Research (NISER) (IN),Unknown,"{'_type': 'ContributionParticipation', '_fossil': 'contributionParticipationMetadata', 'first_name': 'Sandeep', 'last_name': 'Dudi', 'fullName': 'Dudi, Sandeep', 'id': '9385683', 'affiliation': 'National Institute of Science  Education and Research (NISER) (IN)', 'emailHash': '33f17bb30e889716aeff65da7cd27f11', 'db_id': 9385683, 'person_id': 9129458}"
,poster,First measurement of the double-differential cross section of coherent J/ψ photoproduction to probe gluons in nuclei with ALICE,"Krupova, Diana",Czech Technical University  in Prague (CZ),CZ,"{'_type': 'ContributionParticipation', '_fossil': 'contributionParticipationMetadata', 'first_name': 'Diana', 'last_name': 'Krupova', 'fullName': 'Krupova, Diana', 'id': '9385680', 'affiliation': 'Czech Technical University  in Prague (CZ)', 'emailHash': '8b42bae70c94512787fa88ad4770ebd2', 'db_id': 9385680, 'person_id': 9129456}"
,poster,Direct photon production and correlation at low $p_{\rm T}$ in Pb--Pb collisions with ALICE,"Sas, Mike",Nikhef National institute  for subatomic physics (NL),Netherlands,"{'_type': 'ContributionParticipation', '_fossil': 'contributionParticipationMetadata', 'first_name': 'Mike', 'last_name': 'Sas', 'fullName': 'Sas, Mike', 'id': '9385678', 'affiliation': 'Nikhef National institute  for subatomic physics (NL)', 'emailHash': '981f787a435e5c09106b8225c495d3ca', 'db_id': 9385678, 'person_id': 9129455}"
,poster,Light neutral meson production at the LHC energies with ALICE,"Marin, Ana",GSI - Helmholtzzentrum fur Schwerionenforschung GmbH (DE),Germany,"{'_type': 'ContributionParticipation', '_fossil': 'contributionParticipationMetadata', 'first_name': 'Ana', 'last_name': 'Marin', 'fullName': 'Marin, Ana', 'id': '9385676', 'affiliation': 'GSI - Helmholtzzentrum fur Schwerionenforschung GmbH (DE)', 'emailHash': '506d58ec66f828efb3ae7110dbd7e950', 'db_id': 9385676, 'person_id': 9129453}"
,poster,Bottomonia production and polarization in pp collisions with ALICE,"Lu, Pengzhong",University of Science and  Technology of China (CN),China,"{'_type': 'ContributionParticipation', '_fossil': 'contributionParticipationMetadata', 'first_name': 'Pengzhong', 'last_name': 'Lu', 'fullName': 'Lu, Pengzhong', 'id': '9385672', 'affiliation': 'University of Science and  Technology of China (CN)', 'emailHash': '21f2bdffadc812fd39567ad07424b55e', 'db_id': 9385672, 'person_id': 9129452}"
,poster,Charmonium production in jets and as a function of multiplicity with ALICE,"Arsene, Ionut Cristian",University of Oslo (NO),NO,"{'_type': 'ContributionParticipation', '_fossil': 'contributionParticipationMetadata', 'first_name': 'Ionut Cristian', 'last_name': 'Arsene', 'fullName': 'Arsene, Ionut Cristian', 'id': '9385654', 'affiliation': 'University of Oslo (NO)', 'emailHash': '4cfe2348bf904704c9be2a4be39b90cb', 'db_id': 9385654, 'person_id': 9129433}"
,poster,Quarkonium production in pp collisions at $\sqrt{s}$ = 13.6 TeV with ALICE,"Quaglia, Luca",INFN Torino (IT),Italy,"{'_type': 'ContributionParticipation', '_fossil': 'contributionParticipationMetadata', 'first_name': 'Luca', 'last_name': 'Quaglia', 'fullName': 'Quaglia, Luca', 'id': '9385652', 'affiliation': 'INFN Torino (IT)', 'emailHash': 'd78bec32bb38e16bf2bb2484143c3bbb', 'db_id': 9385652, 'person_id': 9129432}"
,poster,Associated production of quarkonia and open heavy-flavour hadrons in pp collisions with ALICE,"Diab, Batoul",Université Paris-Saclay (FR),Unknown,"{'_type': 'ContributionParticipation', '_fossil': 'contributionParticipationMetadata', 'first_name': 'Batoul', 'last_name': 'Diab', 'fullName': 'Diab, Batoul', 'id': '9385650', 'affiliation': 'Université Paris-Saclay (FR)', 'emailHash': 'dd39e5e1ab7e57cb1cd0d1bc8e1d2388', 'db_id': 9385650, 'person_id': 9129431}"
,poster,Investigating the role of strangeness in charm hadronisation with strange charm-meson production in pp collisions with ALICE,"Aglietta, Luca",Universita e INFN Torino (IT),Unknown,"{'_type': 'ContributionParticipation', '_fossil': 'contributionParticipationMetadata', 'first_name': 'Luca', 'last_name': 'Aglietta', 'fullName': 'Aglietta, Luca', 'id': '9385648', 'affiliation': 'Universita e INFN Torino (IT)', 'emailHash': 'f909b7140f42377e97a00eaea9213c34', 'db_id': 9385648, 'person_id': 9129430}"
,poster,Investigating charm-hadron fragmentation with azimuthal correlation distributions of charm hadron and charged particles in pp collisions with ALICE,"Zhang, Zhen",Central China Normal University  CCNU (CN),China,"{'_type': 'ContributionParticipation', '_fossil': 'contributionParticipationMetadata', 'first_name': 'Zhen', 'last_name': 'Zhang', 'fullName': 'Zhang, Zhen', 'id': '9385647', 'affiliation': 'Central China Normal University  CCNU (CN)', 'emailHash': '5ebe2e8ba9f397fa9122ec4c0d19fedb', 'db_id': 9385647, 'person_id': 9129429}"
,poster,Unveiling the scale of the emergence of non-universal behaviour in the fragmentation into heavy-flavour baryons with ALICE,"Kucera, Vit",Inha University (KR),KR,"{'_type': 'ContributionParticipation', '_fossil': 'contributionParticipationMetadata', 'first_name': 'Vit', 'last_name': 'Kucera', 'fullName': 'Kucera, Vit', 'id': '9385645', 'affiliation': 'Inha University (KR)', 'emailHash': '80f82dc95e543108b938c801816394df', 'db_id': 9385645, 'person_id': 8932018}"
,poster,Measurements of inclusive jet production and jet azimuthal anisotropy at low $p_\rm{T}$ and large $R$ in pp and Pb-Pb collisions with ALICE,"Gruenwald, Nadine Alice",Heidelberg University (DE),Germany,"{'_type': 'ContributionParticipation', '_fossil': 'contributionParticipationMetadata', 'first_name': 'Nadine Alice', 'last_name': 'Gruenwald', 'fullName': 'Gruenwald, Nadine Alice', 'id': '9385642', 'affiliation': 'Heidelberg University (DE)', 'emailHash': '24f667fd19c938469b6aec9e6f817f2b', 'db_id': 9385642, 'person_id': 9129428}"
,poster,Prompt photon measurements in small systems with ALICE,"Jonas, Florian",University of California Berkeley (US),USA,"{'_type': 'ContributionParticipation', '_fossil': 'contributionParticipationMetadata', 'first_name': 'Florian', 'last_name': 'Jonas', 'fullName': 'Jonas, Florian', 'id': '9385640', 'affiliation': 'University of California Berkeley (US)', 'emailHash': '1f3d26f665d216deae2b340d8adf70fd', 'db_id': 9385640, 'person_id': 9032465}"
,poster,Measurement of jet substructure in pp and central Pb-–Pb collisions using semi-inclusive hadron+jet correlations with ALICE,"Norman, Jaime",University of Liverpool (GB),UK,"{'_type': 'ContributionParticipation', '_fossil': 'contributionParticipationMetadata', 'first_name': 'Jaime', 'last_name': 'Norman', 'fullName': 'Norman, Jaime', 'id': '9385639', 'affiliation': 'University of Liverpool (GB)', 'emailHash': '31122f53ce2130f69f5c5adcd3cfae44', 'db_id': 9385639, 'person_id': 9129427}"
,poster,System size dependence of light-flavor hadron production: from the smallest to the largest collision system at the LHC with ALICE,"Schotter, Romain",Stefan Meyer Institute for Subatomic Physics of the Austrian Academy of Sciences (AT),Austria,"{'_type': 'ContributionParticipation', '_fossil': 'contributionParticipationMetadata', 'first_name': 'Romain', 'last_name': 'Schotter', 'fullName': 'Schotter, Romain', 'id': '9385637', 'affiliation': 'Stefan Meyer Institute for Subatomic Physics of the Austrian Academy of Sciences (AT)', 'emailHash': '0397e08f8bf3317256a5b0cbc3813c88', 'db_id': 9385637, 'person_id': 9129426}"
,poster,ALICE explores the dependence of strangeness production on global and local properties of the pp collision,"Jacazio, Nicolò","Universita e INFN, Bologna (IT)",Italy,"{'_type': 'ContributionParticipation', '_fossil': 'contributionParticipationMetadata', 'first_name': 'Nicolò', 'last_name': 'Jacazio', 'fullName': 'Jacazio, Nicolò', 'id': '9385634', 'affiliation': 'Universita e INFN, Bologna (IT)', 'emailHash': 'ad1dc1dc4985dee896444018b2930ec0', 'db_id': 9385634, 'person_id': 8926094}"
