Session,Type,Title,Speaker,Institute,Country,Abstract,Raw_Speaker_Data
Parallel session 17,parallel,EPJ Featured Talk: The collectivity of transverse momentum fluctuations,"Parida, Tribhuban",IISER Berhampur,Unknown,"Event-by-event fluctuations of the transverse momentum per particle $[p_T]$ have been measured in heavy-ion collisions at RHIC and LHC, but this topic has so far received less attention than anisotropic flow. Yet the physical mechanism is identical for both phenomena: A long-range correlation in the initial stages, followed by collective expansion. While the origin of anisotropic flow is a fluctuation in the shape of the fireball, that of $[p_T]$ fluctuations is a fluctuation in the initial temperature. It generates a fluctuation in the fluid velocity, which is carried over to the $p_T$ spectrum of outgoing particles. The same fluctuation is present at all rapidities and generates a long-range correlation. 

We make hydrodynamic predictions for the fluctuation of the spectrum, which is a new observable $v_0(p_T)$ introduced by Schenke, Shen and Teaney [https://arxiv.org/abs/2004.00690] which has not yet been measured, and for which first experimental results will hopefully be shown at this conference. Like anisotropic flow $v_n(p_T)$, $v_0(p_T)$ is predicted to have a strong mass ordering in the $p_T$ range where hydrodymamics applies. We show that our hydrodynamic calculation reproduces precisely the observed dependence of $[p_T]$ fluctuations on $p_T$ cuts which has previously been observed by PHENIX and ATLAS. We argue that the mechanism of quark coalescence should give rise to a splitting between the $v_0(p_T)$ of baryons and mesons at higher $p_T$, similar to that observed for anisotropic flow.

Based on Parida, Samanta, Ollitrault, Phys.Lett.B 857 (2024) 138985 [2407.17313].","{'_type': 'ContributionParticipation', '_fossil': 'contributionParticipationMetadata', 'first_name': 'Tribhuban', 'last_name': 'Parida', 'fullName': 'Parida, Tribhuban', 'id': '9288627', 'affiliation': 'IISER Berhampur', 'emailHash': '78265100fa336297de1f4f8878bc5010', 'db_id': 9288627, 'person_id': 8847429}"
Parallel session 10,parallel,Critical point and Columbia plot from functional QCD,"Fischer, Christian","University of Giessen, Germany",Unknown,"In the past year, results for the location of the critical point from different
approaches seem to converge towards previous predictions from functional QCD. 
We summarise recent theoretical results of the latter approach on the 
Columbia plot [1], the QCD phase diagram and the location of the critical 
point at finite baryon chemical potential [3]. We highlight our efforts to 
systematically gauge the approach by making contact with lattice results 
at zero and imaginary chemical potential [2] in various regions of the Columbia 
plot [1]. We furthermore discuss steps towards making contact with experiment 
via baryon number fluctuations [4].

[1] J. Bernhardt and C. S. Fischer, Phys. Rev. D 108 (2023) no.11, 114018
[2] J. Bernhardt and C. S. Fischer, Eur. Phys. J. A 59  (2023) no.8, 181
[3] P. J. Gunkel and C. S. Fischer, Phys. Rev. D 104 (2021) no.5, 054022
[4] P. Isserstedt, M. Buballa, C. S. Fischer and P. J. Gunkel, Phys. Rev. D 100 (2019) no.7, 074011","{'_type': 'ContributionParticipation', '_fossil': 'contributionParticipationMetadata', 'first_name': 'Christian', 'last_name': 'Fischer', 'fullName': 'Fischer, Christian', 'id': '9288979', 'affiliation': 'University of Giessen, Germany', 'emailHash': '3e9dc8ed318dd23cc5efa20bf3c3e74c', 'db_id': 9288979, 'person_id': 8938646}"
Parallel session 35,parallel,Non-Fluctuational Signature of the QCD Critical Point,"Sogabe, Noriyuki",University of Illinois Chicago,USA,"We study the influence of the QCD critical point on the trajectories describing the evolution of the expanding fireball in heavy-ion collisions. We find that the lines of constant specific entropy (entropy per baryon) on the phase diagram are drawn towards a special point on the coexistence (first-order) line where the specific entropy reaches a maximum [1]. We study the interplay between this feature of the isentropic trajectories and the freezeout curve. If the critical point is located near the freezeout curve, a region inaccessible by isentropic expansion appears on the freezeout curve. This behavior of the isentropes could provide a novel, non-fluctuational signature of the critical point requiring significantly lower statistics than the fluctuational signatures. 

[1] Maneesha Sushama Pradeep, Noriyuki Sogabe, Mikhail Stephanov, and Ho-Ung Yee, Phys. Rev. C **109**, 064905 (2024).","{'_type': 'ContributionParticipation', '_fossil': 'contributionParticipationMetadata', 'first_name': 'Noriyuki', 'last_name': 'Sogabe', 'fullName': 'Sogabe, Noriyuki', 'id': '9288942', 'affiliation': 'University of Illinois Chicago', 'emailHash': 'de1f6b0c94f897f419329f2cbbef3513', 'db_id': 9288942, 'person_id': 8936593}"
Parallel session 23,parallel,Hadron Production in Au+Au Collisions from STAR Fixed-Target Experiment,"Li, Hongcan",Central China Normal University,Unknown,"Hadrons have been suggested as sensitive probes for the medium properties of nuclear matter created in heavy-ion collisions. A dense baryon-rich medium is formed during collisions at center-of-mass energies of a few-GeV. Since (anti-)strange hadrons and anti-protons are produced near or below the threshold, their phase space distribution and yield ratios may provide strong constraints on the equation of state (EoS) of high baryon density matter.



In this presentation, the recent results on $\pi^{\pm}$, $\rm{K}^{\pm}$($\rm{K}^0_S$), $\phi$, $p$($\overline{p}$), $\Lambda (\overline{\Lambda})$ and $\Xi^-(\overline{\Xi}^{+})$  production at $\sqrt{s_{\rm{NN}}}$ = 3.0 - 7.7 GeV in Au + Au collisions with fixed-target mode from the STAR experiment will be presented. The transverse momentum spectra ($p_{\rm T}$), rapidity density distributions (dN/dy) and their yield ratios as a function of centrality and collision energy are able to provide unique information about QCD phase structure. The $p_{\rm T}$ spectra and dN/dy ratios of baryon to anti-baryon will provide important input to differentiate between hadron production via quark coalescence and hadronic scattering. Enhancement of baryon to meson ratio hints at an onset of deconfinement in this energy range. We will also explore the centrality dependence of hadron yields, and the evolution of the chemical and kinetic freeze-out temperature, baryon chemical potential and average radial expansion flow in the reported energy range, which can give insights on the EoS of the created medium. These results will be compared with those from higher collision energies and the physics implications will be studied by comparing to the model calculations.","{'_type': 'ContributionParticipation', '_fossil': 'contributionParticipationMetadata', 'first_name': 'Hongcan', 'last_name': 'Li', 'fullName': 'Li, Hongcan', 'id': '9414324', 'affiliation': '', 'emailHash': 'c37cf12f1fdb81e4de1d15b36249ff3e', 'db_id': 9414324, 'person_id': 9157265}"
Parallel session 29,parallel,Strangeness production and polarization in fixed-target and proton-lead collisions at LHCb,"Manca, Giulia","Universita` degli studi di Cagliari and INFN, Cagliari, IT",France,"With its precise vertex reconstruction and particle identification capabilities, the LHCb detector is ideally suited to study the production and polarization of strange particles. In addition, being the origin of hyperon polarization from unpolarized proton-proton and proton-nucleus collisions not yet fully understood, measurements in different collision systems and kinematic ranges must be provided. In this contribution, recent LHCb measurements of strange hyperon production and polarization in proton-lead collisions are discussed, including their implications for hadronization modification in small collision systems and for transverse-momentum-dependent parton distributions and fragmentation functions.","{'_type': 'ContributionParticipation', '_fossil': 'contributionParticipationMetadata', 'first_name': 'Giulia', 'last_name': 'Manca', 'fullName': 'Manca, Giulia', 'id': '9440937', 'affiliation': 'Universita` degli studi di Cagliari and INFN, Cagliari, IT', 'emailHash': 'de9a97bf5f22f606cf7cc9c4e92491db', 'db_id': 9440937, 'person_id': 9182365}"
Parallel session 8,parallel,Heavy-flavor and exotic hadron production in jets at LHCb,"Lesser, Ezra",CERN,Switzerland,"Jets offer a unique laboratory for studying the production of heavy-flavor hadrons and quarkonia, including exotic hadron candidates. 
With a full range of precision vertexing, tracking, and particle ID capabilities covering forward rapidity, the LHCb experiment is especially well suited to measurements of heavy-flavor and exotic hadron production. This talk will present recent LHCb studies of exotic hadron production in jets, as well as studies of heavy-flavor-jet substructure.","{'_type': 'ContributionParticipation', '_fossil': 'contributionParticipationMetadata', 'first_name': 'Ezra', 'last_name': 'Lesser', 'fullName': 'Lesser, Ezra', 'id': '9396824', 'affiliation': 'CERN', 'emailHash': 'd9e506ca85227c37972300c2eefeb9af', 'db_id': 9396824, 'person_id': 9140854}"
Parallel session 27,parallel,Open charm production from small to large systems at LHCb,"Durham, John Matthew",Los Alamos National Laboratory,USA,"Open charm production is a sensitive probe of both hot and cold nuclear matter effects. Charm meson production provides strong constraints on nuclear parton distributions, while charm baryon and strange charm hadron production can be used to probe strangeness- and baryon-enhancing hot QCD effects, respectively. The LHCb detector is designed to study heavy flavor hadrons at the LHC, providing unique opportunities to study open charm production in heavy-ion collisions. In this contribution, recent LHCb results on open charm production will be discussed, as well as progress on studies of strangeness and baryon enhancement in the heavy flavor sector with 2024 PbPb data.","{'_type': 'ContributionParticipation', '_fossil': 'contributionParticipationMetadata', 'first_name': 'John Matthew', 'last_name': 'Durham', 'fullName': 'Durham, John Matthew', 'id': '9440936', 'affiliation': 'Los Alamos National Laboratory', 'emailHash': '9f7df025a17bd14ff5a7a77daa7f3b5e', 'db_id': 9440936, 'person_id': 9182364}"
Parallel session 27,parallel,Charmonium production measurements from small to large systems at LHCb,"De Angelis, Camilla","Universita e INFN, Cagliari (IT)",Unknown,"Modifications of quarkonia production in hadronic collisions provide an important experimental observable to probe the heavy quark interaction with the nuclear medium. The excited ψ(2S) state, with a relatively low binding energy, is especially sensitive to these effects. In thiscontribution, we will present a new LHCb result on ψ(2s)/J/ψ production in PbPb collisions, along with progress on new measurements with Run 3 data.","{'_type': 'ContributionParticipation', '_fossil': 'contributionParticipationMetadata', 'first_name': 'Camilla', 'last_name': 'De Angelis', 'fullName': 'De Angelis, Camilla', 'id': '9396803', 'affiliation': 'Universita e INFN, Cagliari (IT)', 'emailHash': '5deebf491dbcf9fd8902e18ec40d5516', 'db_id': 9396803, 'person_id': 9140842}"
Parallel session 29,parallel,Deciphering (anti)hypertriton spin from its global polarization in heavy-ion collisions,"Sun, KaiJia","Institute of Modern Physics, Fudan University, Shanghai, China",Unknown,"Understanding the properties of hypernuclei is crucial for constraining the nature of hyperon-nucleon ($Y\text{-}N$) interactions, which plays a key role in determining the inner structure of compact stars. The lightest (anti-)hypernuclei are the hypertriton ($^3_\Lambda\text{H}$), which consists  of a pair of nucleons and  a $\Lambda$ hyperon, and its anti-nucleus (${^3_{\bar{\Lambda}}}\overline{\rm H}$).  Significant knowledge has recently been acquired regarding the mass, lifetime, and binding energy of $^3_\Lambda\text{H}$. However, its exact spin, whether $\frac{1}{2}$ or  $\frac{3}{2}$, remains undetermined in both experimental and theoretical studies. Here, we present a novel method of using the hypertriton global polarization in heavy-ion collisions to decipher not only  its total spin but also its internal spin  structure.  This method is based on the finding that  its three different  spin structures  exhibit distinct beam energy dependence of its global polarization when it is produced in these collisions from the coalescence of proton, neutron and $\Lambda$. Future observations of the (anti-)hypertriton global polarization thus provide the opportunity to unveil the spin structure of (anti-)hypertriton and its production mechanism in heavy-ion collisions.","{'_type': 'ContributionParticipation', '_fossil': 'contributionParticipationMetadata', 'first_name': 'KaiJia', 'last_name': 'Sun', 'fullName': 'Sun, KaiJia', 'id': '9289007', 'affiliation': 'Institute of Modern Physics, Fudan University, Shanghai, China', 'emailHash': '2e132dd95185baf2c04021a64d830f8b', 'db_id': 9289007, 'person_id': 8881904}"
Parallel session 23,parallel,Production of nuclei and hypernuclei in relativistic ion collisions,"Botvina, Alexander","ITP, University of Frankfurt am Main",Unknown,"Production of nuclei and hypernuclei in relativistic ion collisions. 

A. Botvina and M. Bleicher. 

Institute for Theoretical Physics, J. W. Goethe University, 
D-60438 Frankfurt am Main, Germany. 


We investigate the formation of light nuclei and hypernuclei in the 
rapidly expanding nuclear matter after relativistic nucleus-nucleus 
collisions. The primary hadronization phase including the strangeness 
production is described with UrQMD model. It is demonstrated that the 
nucleation process can be explained within the statistical approach by 
applying the local equilibrium concept. We subdivide the expanding 
nuclear system into several parts (clusters) consisting of nucleons and 
hyperons which are close in the phase space. The production of nuclei 
takes place inside these clusters, and it can be described as their 
statistical decay in the coexistence region of the nuclear phase 
transition. The local chemical equilibrium concept explain consistently 
many experimental data which was not possible with the statistical 
models under assumption of global chemical equilibrium [1,2]. This model 
was also successfully applied to describe experimental data on both 
normal nuclei and strange hypernuclei production in the GSI and RHIC-BES 
energy range [3,4]. We predict the production of double hypernuclei up 
to $^4_{\Lambda \Lambda}$H and further intermediate mass nuclei up to 
$^8$Be for Au+Au central collisions at $\sqrt{s_{NN}}$=3 GeV, recently 
explored by the STAR experiments [4]. The production of charmed nuclei 
is discussed too. These new nuclei can be identified by the measurement 
of the correlated particles. 

[1] A. S. Botvina, N. Buyukcizmeci and M. Bleicher, 
Phys. Rev. C {\bf 103}, 064602 (2021). 

[2] A. S. Botvina, N. Buyukcizmeci and M. Bleicher, 
Phys. Rev. C {\bf 106}, 014607 (2022). 

[3] N. Buyukcizmeci, T. Reichert, A.S. Botvina, and M. Bleicher, 
Phys. Rev. C {\bf 108}, 054904 (2023). 

[4] N. Buyukcizmeci, T. Reichert, A.S. Botvina, and M. Bleicher, 
arXiv: 2410.17449 (2024).","{'_type': 'ContributionParticipation', '_fossil': 'contributionParticipationMetadata', 'first_name': 'Alexander', 'last_name': 'Botvina', 'fullName': 'Botvina, Alexander', 'id': '9289005', 'affiliation': 'ITP, University of Frankfurt am Main', 'emailHash': '0bc4e05e7fddf1a0e7bc5a8373c35b30', 'db_id': 9289005, 'person_id': 8937351}"
Parallel session 35,parallel,"The antiproton puzzle, QCD critical point, and fireball properties in heavy-ion collisions","Vovchenko, Volodymyr",University of Houston,Unknown,"We contrast the behavior of ordinary and factorial cumulants of proton number and point out that the latter has numerous advantages over the former, in particular with regards to the critical point search in heavy-ion collisions. The new RHIC BES-II data on factorial cumulants of protons is analyzed, indicating clear deviation of two- and three-particle proton correlations from the non-critical baseline at collision energies below 10 GeV. Multiple scenarios for this deviation are explored, including the possibility of critical fluctuations and the implications for the QCD phase diagram.

We also illustrate that the acceptance dependence of the appropriately scaled factorial cumulants, $\hat{C}_n/(\hat{C}_1)^n$, is flat if all correlations are driven by long-range correlations only, making it a clean probe of short-range correlations. Furthermore, global baryon conservation and volume fluctuations predict identical $\hat C_2/(\hat C_1)^2$ of proton and antiprotons at given collision energy. However, the analysis of RHIC BES-I data reveals a remarkably strong splitting between scaled factorial cumulants of protons and antiprotons, which is at odds with the expectation based on a single-fluid hydrodynamics picture. We argue that such a splitting indicates incomplete equilibration between stopped and produced matter, which can be further probed with upcoming high-statistics data from RHIC BES-II with extended acceptance coverage.","{'_type': 'ContributionParticipation', '_fossil': 'contributionParticipationMetadata', 'first_name': 'Volodymyr', 'last_name': 'Vovchenko', 'fullName': 'Vovchenko, Volodymyr', 'id': '9288828', 'affiliation': 'University of Houston', 'emailHash': 'aac727a4ed7f29c5f8821cc339003226', 'db_id': 9288828, 'person_id': 8877848}"
Parallel session 35,parallel,First order transition region of an equation of state for QCD with a critical point,"Karthein, Jamie",MIT,USA,"In addition to signals for the critical point, evidence for a first order phase transition would indicate a nontrivial structure within the QCD phase diagram. Moreover, while not a direct measurement of the critical point, the presence of a first order transition would imply its existence. This motivates the need to understand signatures of this first order transition in addition to directly studying the effect of a critical point. To this effect, we map the mean-field Ising model equation of state onto the QCD phase diagram, and reconstruct the full coexistence region in the case of a first order phase transition [1]. Beyond the coexistence line, we maintain access to the spinodal region in the phase diagram, thus providing a description of metastable and unstable phases of matter. Thus, we describe the super-heated hadronic phase and the super-cooled quark-gluon plasma, which is useful for hydrodynamic simulations of the fireball created in a heavy-ion collision at low collision energy, where a first order phase transition is expected. We discuss the features of the pressure and other thermodynamic observables as functions of temperature and baryonic chemical potential, in particular their behavior in the coexistence region. Finally, we compare our equation of state to 3D Ising model ones available in the literature.

1. J.M. Karthein, V. Koch, C. Ratti, arXiv:2409.13961, PRD (under review)","{'_type': 'ContributionParticipation', '_fossil': 'contributionParticipationMetadata', 'first_name': 'Jamie', 'last_name': 'Karthein', 'fullName': 'Karthein, Jamie', 'id': '9288801', 'affiliation': 'MIT', 'emailHash': 'd2ad016d0464a6ade7e63e1d8433a210', 'db_id': 9288801, 'person_id': 8896477}"
Parallel session 30,parallel,QCD phase structure at finite isospin chemical potential and smaller-than-physical quark mass,"Chelnokov, Volodymyr",Goethe Universität,Unknown,"Introduction of a nonzero isospin chemical potential in QCD leads to the emergence of a pion condensed phase at sufficiently large $\mu_I$, bounded by a second order transition line. At zero temperature the pion condensate appears at $\mu_I = m_\pi/2$. Recent numerical studies at physical quark masses show that the pion condensation boundary remains vertical up to the meeting point with the chiral crossover line. If this result remains valid when the light quark mass (and the pion mass) goes to zero, then in the chiral limit at temperatures below the chiral transition the pion condensation happens at arbitrary nonzero $\mu_I$. We report on results of a lattice QCD simulation of a 2+1 flavour QCD at nonzero isospin chemical potential, at smaller-than-physical light quark mass, that support this scenario.","{'_type': 'ContributionParticipation', '_fossil': 'contributionParticipationMetadata', 'first_name': 'Volodymyr', 'last_name': 'Chelnokov', 'fullName': 'Chelnokov, Volodymyr', 'id': '9288933', 'affiliation': 'Goethe Universität', 'emailHash': '834141d6e16125250f35449a5536a388', 'db_id': 9288933, 'person_id': 8937046}"
Parallel session 30,parallel,QCD deconfinement transition line up to $\mu_B=400$~MeV from finite volume lattice simulations,"Wong, Chik Him",University of WUppertal,Unknown,"The QCD cross-over line in the temperature ($T$) -- baryo-chemical potential ($\mu_B$) plane has been computed by several lattice groups by calculating the chiral order parameter and its susceptibility at finite values of $\mu_B$. In this work we focus on the deconfinement aspect of the transition between hadronic and Quark Gluon Plasma (QGP) phases. We define the deconfinement temperature as the peak position of the static quark entropy ($S_Q(T,\mu_B)$) in $T$, which is based on the renormalized Polyakov loop. We extrapolate $S_Q(T,\mu_B)$ based on high statistics finite temperature ensembles on a $16^3\times 8$ lattice to finite density by means of a Taylor expansion to eighth order in $\mu_B$ (NNNLO) along the strangeness neutral line. The phase diagram is drawn up to unprecedentedly high chemical potentials. 
Our results for the deconfinement temperature are in rough agreement with phenomenological estimates of the freeze-out curve in relativistic heavy ion collisions. In addition, we show that up to $\mu_B \approx 400$~MeV, the deconfinement transition gets broader at higher densities, disfavoring the existence of a deconfinement critical endpoint in this range. Finally, we examine the transition line without the strangeness neutrality condition and observe a hint for the narrowing of the crossover towards large $\mu_B$.","{'_type': 'ContributionParticipation', '_fossil': 'contributionParticipationMetadata', 'first_name': 'Chik Him', 'last_name': 'Wong', 'fullName': 'Wong, Chik Him', 'id': '9288883', 'affiliation': '', 'emailHash': 'd3c04f035dad75ceb3d151ad7dbb65c2', 'db_id': 9288883, 'person_id': 8931986}"
Parallel session 24,parallel,Universal critical dynamics near the chiral phase transition and the QCD critical point,"Ye, Yunxin",Jena University,Unknown,"We use a novel real-time formulation of the functional renormalization group (FRG), as a valuable tool complementary to classical-statistical simulation, for dynamical systems with reversible mode couplings to study Model H, the conjectured dynamic universality class of the QCD critical point. We emphasize the structural similarities with Model G, conjectured to be the dynamic universality class of the chiral phase transition in the limit of two massless quark flavors. Importantly, our formulation of the real-time FRG preserves all relevant symmetries throughout the FRG flow which, e.g., guarantees the non-renormalization of the reversible mode couplings, as but one exact result. We derive non-perturbative RG flow equations for the kinetic coefficients of both, Model G and H, in parallel, and discuss commonalities and differences in the resulting fixed-point structure and dynamic critical exponents, such as weak scaling relations which hold in either case versus the characteristic strong scaling of Model G which is absent in Model H. For Model G, we also extract a novel dynamic scaling function that describes the universal momentum and temperature dependence of the diffusion coefficient of iso-vector and iso-axial charge densities in the symmetric phase.","{'_type': 'ContributionParticipation', '_fossil': 'contributionParticipationMetadata', 'first_name': 'Yunxin', 'last_name': 'Ye', 'fullName': 'Ye, Yunxin', 'id': '9288980', 'affiliation': '', 'emailHash': 'e54934278d7643ddc7aa42d26d37984b', 'db_id': 9288980, 'person_id': 8915708}"
