Session,Type,Title,Speaker,Institute,Country,Abstract,Raw_Speaker_Data
Parallel session 18,parallel,Comprehensive study of jet substructure using a multi-stage jet evolution framework,"Collaboration, JETSCAPE",Unknown,Unknown,"We present a comprehensive study of jet substructure modifications in heavy-ion collisions using the JETSCAPE framework. Our approach utilizes the multi-stage jet energy loss description, which includes suppression of jet-medium interaction at high virtuality, reflecting the virtuality dependence of the process. The parameters used in our simulations are tuned to reproduce hadron RAA and inclusive jet RAA, particularly in the high-pT region at 5.02 TeV. Using these simulations, we analyze key observables such as Soft Drop observables, jet mass, and fragmentation functions. Our results show good agreement with current experimental data, highlighting the model’s reliability. This study provides a solid baseline for further detailed investigations of jet structures in heavy-ion collisions, offering insights into jet-medium interactions and their effects on jet evolution.","{'_type': 'ContributionParticipation', '_fossil': 'contributionParticipationMetadata', 'first_name': 'JETSCAPE', 'last_name': 'Collaboration', 'fullName': 'Collaboration, JETSCAPE', 'id': '9288824', 'affiliation': '', 'emailHash': None, 'db_id': 9288824, 'person_id': 8917236}"
Parallel session 18,parallel,Modification of the Jet Energy-Energy Correlator in Cold Nuclear Matter,"Fu, Yu",Duke university,USA,"We compute medium corrections to the energy-energy correlator (EEC) for jets in electron-nucleus collisions at leading order in the QCD coupling and the interaction of the jet with the medium. We derive an analytical expression for the modification of the EEC as a function of the opening angle and show that the modification is strongest at large angles within the jet cone. We obtain explicit results for the dependence of the modification on the jet energy, the scattering power of cold nuclear
matter, and the path length within the medium. We extend our calculations to gluon jets in proton-nucleus collisions and compare our results with recent preliminary data for proton-lead collisions at the LHC. We also discuss the role of comovers on the EEC in p+Pb collisions.
Reference: [arXiv:2411.04866][1]


  [1]: https://arxiv.org/abs/2411.04866","{'_type': 'ContributionParticipation', '_fossil': 'contributionParticipationMetadata', 'first_name': 'Yu', 'last_name': 'Fu', 'fullName': 'Fu, Yu', 'id': '9288850', 'affiliation': 'Duke university', 'emailHash': '46b5fc6a35209bc0589d0e568a30f7d7', 'db_id': 9288850, 'person_id': 8913019}"
Parallel session 18,parallel,"Probing jet hadrochemistry modification with measurements of π,  K, and p in jets and the underlying event in pp and Pb–Pb collisions at $\sqrt{s_{\rm NN}}$ = 5.02 TeV with ALICE","Cantway, Sierra",Yale University (US),USA,"Measurements of jet substructure observables in heavy-ion collisions provide powerful constraints on the microscopic mechanisms of interactions between energetic partons and the QGP. Though there has been remarkable progress in measuring inclusive charged-particle jet substructure observables, a complete understanding of the identified particle production inside jets (jet hadrochemistry) and its modification in heavy-ion collisions remains elusive. Jet quenching models predict modifications to jet hadrochemical composition in heavy-ion collisions, arising from both jet-medium interactions and altered particle production in the jet wake. Measurements of identified particles in jets can help discriminate between different proposed jet-medium interaction mechanisms.
Enabled by the excellent PID capabilities of ALICE, we present the first measurements of π, K, and p ratios within jets and in the underlying event as a function of particle transverse momentum in pp and Pb–Pb collisions at $\sqrt{s_{\rm NN}}$ = 5.02 TeV. This study aims to advance our understanding of soft particle production mechanisms and distinguish modified jet fragmentation from bulk medium effects.","{'_type': 'ContributionParticipation', '_fossil': 'contributionParticipationMetadata', 'first_name': 'Sierra', 'last_name': 'Cantway', 'fullName': 'Cantway, Sierra', 'id': '9385576', 'affiliation': 'Yale University (US)', 'emailHash': '5fb675ff019a44d78a25c8c668dfe9cf', 'db_id': 9385576, 'person_id': 9129391}"
Parallel session 18,parallel,Measurements of Baryon-to-Meson Ratios Inside Jets in Au+Au and $p$+$p$ Collisions at $\sqrt{s_{NN}} = 200$ GeV at STAR,"Dale-Gau, Gabe",University of Illinois at Chicago,USA,"Measurements at RHIC and the LHC show strongly enhanced baryon-to-meson yield ratios at intermediate transverse momenta ($p_{\rm{T}}$) in inclusive measurements from high-energy nuclear collisions compared to $p$+$p$ baseline. This enhancement is attributed to strong hydrodynamic flow and parton recombination in the Quark-Gluon Plasma (QGP). 
Jet probes have been used extensively to gain insights into QGP properties, with substantial modifications to jet yields and internal structures seen across multiple measurements. Despite apparent medium-induced changes to jet fragmentation patterns, modification of in-jet hadro-chemistry has not yet been found. To search for such effects with the STAR detector at RHIC, we couple the jet-hadron correlation technique with particle identification to measure in-cone baryon-to-meson yield ratios associated with fully reconstructed jets from Au+Au and $p$+$p$ collisions at $\sqrt{s_{\mathrm{NN}}} = 200$ GeV. These in-jet ratios are studied with jet selections of jet radius, R $= 0.2, 0.3, 0.4$, and jet constituent $p_{\rm{T}}$, $p^{\rm{cons}}_{\rm{T}} > 2.0$, $3.0$ GeV/$c$, to probe jets with different levels of QGP interaction. We present in-jet $p/\pi$ ratios as a function of $p_{T}$ as well as $\Delta R$, alongside jet shapes for identified hadrons, and compare Au+Au and $p$+$p$ measurements to examine QGP effects on hadronization.","{'_type': 'ContributionParticipation', '_fossil': 'contributionParticipationMetadata', 'first_name': 'Gabe', 'last_name': 'Dale-Gau', 'fullName': 'Dale-Gau, Gabe', 'id': '9414309', 'affiliation': 'University of Illinois at Chicago', 'emailHash': '1fa8f7e34411018287592336aec746ca', 'db_id': 9414309, 'person_id': 9157255}"
Parallel session 18,parallel,Studies of jet quenching in O+O collisions at $\sqrt{s_{NN}}$ = 200 GeV by STAR,"Zhang, Sijie",University of Science and Technology of China,Unknown,"Jet quenching — modifications to the energy and substructure of high-energy parton showers in the Quark Gluon Plasma (QGP) — serves as a key experimental tool to probe properties of QGP in relativistic heavy-ion collisions. On one hand, the quenching effect, often quantified through the nuclear modification factor (e.g., $R_{AA}$), is well established in large collision systems, such as Au+Au and Pb+Pb collisions. On the other hand, it is absent in smaller p+A collisions despite the observation of collectivity in these collisions, either because the medium is not formed, or its temperature or lifetime is too low to cause jets to lose much energy. This highlights the need for studying the system size dependence of the jet quenching phenomenon. And O+O collisions provide a great opportunity for such studies as they bridge the gap between these small and large systems.

In this talk, we present the first measurements of the following three observables related to the jet quenching: inclusive charged hadron $R_{AA}$ at high transverse momentum ($p_{T}$), inclusive jet $R_{cp}$, and semi-inclusive hadron+jet $I_{cp}$, using O+O collisions data collected with the STAR detector in 2021 at $\sqrt{s_{NN}} = 200$ GeV. For jet measurements, combinatorial background is subtracted based on the event mixing technique, while background fluctuations and detector effects are corrected via unfolding. These measurements provide a valuable opportunity to explore possible jet quenching effects in O+O collisions. The $p_{T}$ and centrality differential results will be presented and compared to similar measurements in collision systems of various sizes. Such comparisons will also help disentangle the effects of system size and collision geometry.","{'_type': 'ContributionParticipation', '_fossil': 'contributionParticipationMetadata', 'first_name': 'Sijie', 'last_name': 'Zhang', 'fullName': 'Zhang, Sijie', 'id': '9414310', 'affiliation': 'University of Science and Technology of China', 'emailHash': '5ec3b4043c3e9f49e1933b5d7d047089', 'db_id': 9414310, 'person_id': 9157256}"
Parallel session 14,parallel,Measurement of flavor effects in charm-induced jet showers at the perturbative/non-perturbative boundary with ALICE,"Dhankher, Preeti",University of California Berkeley (US),USA,"Jet substructure provides precise tests of Quantum Chromodynamics (QCD) and offers more differential ways to study hadronization mechanisms, compared to measurements of single hadrons. QCD predicts that jet radiation patterns depend on the mass and color charge of the initiating parton. Parton showers, in particular, are sensitive to the different Casimir factors of quarks and gluons, as well as to the mass of partons through the dead-cone effect.

In this talk we present three key charm-tagged jet measurements, using jets tagged with a reconstructed $\rm{D^{0}}$-meson. The first are measurements of the differences between three different axis definitions inside the jets. These different definitions vary in their sensitivity to wide-angle soft radiation and systematically probe the radiation pattern off of charm quarks. Next are the jet angularities, which characterise the weighted angular distribution of the jet constituents. These powerful observables probe the parton shower, with sensitivity to mass and Casimir effects that can be tuned by adjusting the importance of wide-angle radiation. Finally, we present the first measurement of the energy-energy correlator for $\rm{D^{0}}$-meson tagged jets. This observable is defined as the energy-weighted cross section of particle pairs within jets and reveals the detailed structure of QCD radiation from heavy quarks, allowing for a distinction between perturbative and non-perturbative effects in charm showers. Comparisons of all these results to measurements of dominantly gluon-initiated jets, as well as to various event generators, are sensitive to flavor-dependent effects in both the parton shower and hadronization mechanisms. Moreover, comparisons with next-to-leading order calculations emphasize the need for improved theoretical modelling of heavy-quark jets and provide critical insights into the parton-to-hadron transition in QCD.","{'_type': 'ContributionParticipation', '_fossil': 'contributionParticipationMetadata', 'first_name': 'Preeti', 'last_name': 'Dhankher', 'fullName': 'Dhankher, Preeti', 'id': '9385577', 'affiliation': 'University of California Berkeley (US)', 'emailHash': '184c051c94f8207fefa81704e7c391a9', 'db_id': 9385577, 'person_id': 9129392}"
Parallel session 14,parallel,Probing the evolution of the charm-quark dead cone and splitting function with ALICE,"Zardoshti, Nima",CERN,Switzerland,"The flavour dependence of parton showers presents a unique opportunity to explore fundamental properties of QCD interactions. In particular, the substructure of low-energy jets containing heavy-flavour hadrons provides experimental access to both mass effects as well as the impact of Casimir colour factors. Using novel tracing methods, splittings of charm quarks are isolated to measure fundamental properties such as the dead-cone effect and the charm-quark splitting function. By using the new high statistics data samples of Run 3, we present new measurements of the dead-cone effect and splitting function of charm quarks, differentially in the energy of the emitter, through measurements of jets tagged with a reconstructed $\rm{D}^{0}$ meson. At the low energies uniquely accessible to the ALICE experiment, comparisons of these measurements to an inclusive-jet baseline probe the evolution of the dead-cone of charm quarks with unprecedented accuracy. With increasing energy of the emitting charm quark, the dead-cone angle is predicted to get smaller, allowing for the isolation of the impact of Casimir colour factors. Such differential measurements in the charm sector not only illuminate the role of mass and Casimir colour factors when compared to inclusive jets, but also provide a lower mass heavy quark-enriched sample which is crucial for comparisons to measurements in the beauty sector, in order to isolate the mass dependence of the dead-cone effect.","{'_type': 'ContributionParticipation', '_fossil': 'contributionParticipationMetadata', 'first_name': 'Nima', 'last_name': 'Zardoshti', 'fullName': 'Zardoshti, Nima', 'id': '9385579', 'affiliation': 'CERN', 'emailHash': '70b5b1e46f746f7d89856f34404d2890', 'db_id': 9385579, 'person_id': 9129393}"
Parallel session 14,parallel,Color Coherence on Recoils,"Pablos, Daniel","IGFAE, USC",Unknown,"In the last years, it has become clearer that recoiling particles originated due to elastic scatterings between the energetic partons within a jet and the medium constituents within the QGP are of great importance for jet quenching phenomenology. Current implementations in state-of-the-art models consider that the elastic scattering process takes place between an on-shell energetic parton and the medium constituent. Crucially, however, highly energetic partons produced during jet evolution cannot be considered in general as on-shell states coming from infinity, and their correct description is in terms of a collection of color correlated dipoles. In this talk we present the first computation of the properties of the soft recoils produced as a result of perturbative elastic scatterings between a color coherent dipole and a quark medium constituent.

Our findings [1] indicate that the angular phase space of these soft recoiling quarks is tightly constrained by the opening angle of the color coherent dipole, owing to quantum interference effects. In this long wavelength limit, one can effectively consider that interactions take place with each of the legs of the dipole separately, provided that the angular constraints dictated by the corresponding color flow topologies are respected. This is in complete analogy with the case of soft gluon emission in vacuum, where the recoil quark plays the role of the emitted gluon. As a direct phenomenological application we provide the first estimate of the collisional energy loss rate of a color antenna. Importantly, these results indicate the way in which color coherence effects can be implemented in jet quenching models that account for the recoils from elastic scatterings, improving in this way our description of medium response physics.

[1] arXiv:2406.08550v2","{'_type': 'ContributionParticipation', '_fossil': 'contributionParticipationMetadata', 'first_name': 'Daniel', 'last_name': 'Pablos', 'fullName': 'Pablos, Daniel', 'id': '9288815', 'affiliation': 'IGFAE, USC', 'emailHash': 'c63d153f0448a8812b4f5c8669ba794b', 'db_id': 9288815, 'person_id': 8899134}"
Parallel session 14,parallel,3D structure of jet-induced diffusion wake in heavy-ion collisions,"Wang, Xin-Nian",Lawrence Berkeley National Lab. (US),USA,The diffusion wake accompanying the jet-induced Mach cone provides a unique probe of the properties of quark-gluon plasma in high-energy heavy-ion collisions. It can be characterized by a depletion of soft hadrons in the opposite direction of the propagating jet. We explore the 3D structure of the diffusion wake induced by γ-triggered jets in Pb+Pb collisions at the LHC energy within the coupled linear Boltzmann transport and hydro model. We identify a valley structure caused by the diffusion wake on top of a ridge from the initial multiple parton interaction (MPI) in jet-hadron correlation as a function of rapidity and azimuthal angle. This leads to a double-peak structure in the rapidity distribution of soft hadrons in the opposite direction of the jets as an unambiguous signal of the diffusion wake. The diffusion wake valley is found to deepen with the jet energy loss as characterized by the γ-jet asymmetry. Its sensitivity to the equation of state and shear viscosity is also studied.,"{'_type': 'ContributionParticipation', '_fossil': 'contributionParticipationMetadata', 'first_name': 'Xin-Nian', 'last_name': 'Wang', 'fullName': 'Wang, Xin-Nian', 'id': '9288818', 'affiliation': 'Lawrence Berkeley National Lab. (US)', 'emailHash': 'f6585e982442d97782f38b7bebbc23fc', 'db_id': 9288818, 'person_id': 8869659}"
Parallel session 14,parallel,sPHENIX measurement of dijet correlations in p+p collisions over a large kinematic range,"Bailey, Virginia",Georgia State University,USA,"The sPHENIX experiment is a next-generation collider detector at RHIC designed for rare jet and heavy flavor probes of the Quark-Gluon Plasma. The experiment includes large-acceptance, hermetic electromagnetic (EMCal) and hadronic (HCal) calorimeter systems, along with a very high-rate data acquisition plus trigger system. In RHIC Run-24, sPHENIX sampled 107/pb of p+p collision data at 200 GeV using an efficient high-p$_T$ jet trigger. This dataset represents a major increase in the luminosity times acceptance compared to previous measurements for this collision energy, along with the first HCal at mid-rapidity at RHIC. This talk presents a measurement of dijet p$_T$ asymmetries and azimuthal acoplanarities, over a wide range of leading jet p$_T$, performed with the full sPHENIX calorimeter system. These measurements provide the pQCD baseline for measurements of dijet p$_T$ asymmetries and angular decorrelation in future sPHENIX Au+Au data-taking at RHIC. The tighter initial kinematic correlations at RHIC compared to the LHC are expected to greatly increase the sensitivity to physics effects.","{'_type': 'ContributionParticipation', '_fossil': 'contributionParticipationMetadata', 'first_name': 'Virginia', 'last_name': 'Bailey', 'fullName': 'Bailey, Virginia', 'id': '9359295', 'affiliation': 'Georgia State University', 'emailHash': '6a21490fcf8c14b5f8de289eb7e45b1f', 'db_id': 9359295, 'person_id': 8935716}"
Parallel session 5,parallel,Search for jet-induced diffusion wake in heavy ion collisions using photon-jet and di-jet events with the ATLAS detector,"Mohapatra, Soumya",Columbia University (US),USA,"In heavy-ion collisions, hard-scattered partons lose energy as they traverse the medium, which is simultaneously modified by this interaction. One expected medium modification, known as the ""diffusion wake,"" is a particle enhancement in the direction of the parton and a depletion in the opposite direction. Although theoretically predicted, clear experimental evidence of the diffusion wake remains elusive. This talk presents jet-track correlations in photon-jet and di-jet events measured in 5.02 TeV Pb+Pb collisions with the ATLAS detector to search for diffusion wake signals. While photon-jet events do not show a significant signal within current uncertainties, upper limits on the probability are provided, and the results are consistent with CoLBT theory predictions at the 68% confidence level. New measurements from di-jet events are also presented, offering higher statistical precision, though complicated by potential contamination from the convolution of wakes of the jet pair.","{'_type': 'ContributionParticipation', '_fossil': 'contributionParticipationMetadata', 'first_name': 'Soumya', 'last_name': 'Mohapatra', 'fullName': 'Mohapatra, Soumya', 'id': '9457386', 'affiliation': 'Columbia University (US)', 'emailHash': '098f3c097bb6400e64dd2de0d2eee4aa', 'db_id': 9457386, 'person_id': 9197454}"
Parallel session 5,parallel,Measurement of flavor dependence of jet quenching in heavy ion collisions with ATLAS,"Derendarz, Dominik Karol",Polish Academy of Sciences (PL),Poland,"High-energy partons are known to lose energy when passing through the hot and dense medium produced in heavy ion collisions. This energy loss is expected to depend on the mass and flavor of the fragmenting parton. For light partons, energy loss via gluon bremsstrahlung is expected to dominate, while for heavy quarks, collisional energy loss may play a more important role. Comparisons between the suppression observed in the inclusive sample of jets with the suppression of b-tagged jets and jets produced at forward rapidity (quark enhances sample of jets) are needed to understand the impact of parton mass and parton flavor on energy loss. Tagging of the $b$-jets is achieved using neural networks trained on Monte Carlo simulation samples and validated in a data-driven way with an independent approach involving the detection of muons from semileptonic decays of B-hadrons. A detailed quantification of the differences between the $b$-jet $R_\mathrm{AA}$ and the inclusive jet $R_\mathrm{AA}$ is also provided, together with comparisons to theory. The measurements are performed in $pp$ and Pb+Pb collisions at $\sqrt{s_\mathrm{NN}}$ = 5.02 TeV using the ATLAS detector at the LHC.","{'_type': 'ContributionParticipation', '_fossil': 'contributionParticipationMetadata', 'first_name': 'Dominik Karol', 'last_name': 'Derendarz', 'fullName': 'Derendarz, Dominik Karol', 'id': '9457424', 'affiliation': 'Polish Academy of Sciences (PL)', 'emailHash': '11832d8898ef11de86a67bbca886a067', 'db_id': 9457424, 'person_id': 9197492}"
Parallel session 5,parallel,Probing jet modification in the QGP using N-Point Energy Correlators in Pb-Pb collisions with ALICE,"Rai, Ananya",Yale University (US),USA,"In heavy-ion collisions, jets propagating through the quark-gluon plasma undergo interactions with the medium. These interactions modify the internal structure of jets, making jet substructure an invaluable tool for probing the microscopic properties of the QGP. N-point Energy Correlators, defined as energy-weighted N-particle correlations inside jets, have emerged as a novel substructure observable in proton-proton collisions, where they show a clear separation of perturbative and non-perturbative effects. Recent measurements in Pb-Pb and p-Pb collisions show striking modifications of the Energy-Energy Correlators (EECs) compared to vacuum QCD baselines.

In this talk we present a measurement of the EECs in Pb-Pb collisions, presenting results at low jet transverse momentum for the first time. Such a measurement is essential in mapping jet modification across different kinematic regimes in the QGP. In addition we present the first measurements of the 3-point Energy Correlator in Pb-Pb collisions, along with their ratios to the EECs. This higher order correlator is predicted to have an enhanced sensitivity to medium effects such as the medium response and offers unique insights into the interactions of the jet and the plasma.","{'_type': 'ContributionParticipation', '_fossil': 'contributionParticipationMetadata', 'first_name': 'Ananya', 'last_name': 'Rai', 'fullName': 'Rai, Ananya', 'id': '9385572', 'affiliation': 'Yale University (US)', 'emailHash': '099985cd574a51532994d0e8b4fa44f5', 'db_id': 9385572, 'person_id': 8899137}"
Parallel session 5,parallel,Measuring energy-energy correlators in p-Pb collisions at ALICE,"Nambrath, Anjali",University of California Berkeley (US),USA,"Jet substructure is a powerful tool for testing QCD in elementary particle collisions. The two-point energy-energy correlator (EEC), defined as the energy-weighted cross section of particle pairs inside jets, is a novel jet substructure observable probing the correlation of energy flow within jets. In pp collisions, the angular dependence of the EEC cross section shows a distinct separation of the perturbative and non-perturbative regimes, revealing the partonic dynamics of jet formation and the confinement of partons into hadrons. There have been an increasing number of theoretical studies predicting how the presence of a medium modifies the EECs with respect to the vacuum case. In this talk, we present measurements of the EECs for inclusive jets in p-Pb collisions at 5.02 TeV. By comparing our results to a measured pp baseline, we study the modifications of jet evolution caused by interactions with a cold nuclear medium and the presence of a high multiplicity environment. Understanding modifications due to cold nuclear matter effects is vital in interpreting EEC results in Pb$-$Pb collisions and separating hot and cold nuclear effects.","{'_type': 'ContributionParticipation', '_fossil': 'contributionParticipationMetadata', 'first_name': 'Anjali', 'last_name': 'Nambrath', 'fullName': 'Nambrath, Anjali', 'id': '9385574', 'affiliation': 'University of California Berkeley (US)', 'emailHash': '20971ee14d50df866a7836b2dc2d2246', 'db_id': 9385574, 'person_id': 9129390}"
