Session,Type,Title,Speaker,Institute,Country,Abstract,Raw_Speaker_Data
Parallel session 17,parallel,Probing initial state and medium evolution using momentum fluctuations in ATLAS,"Bhatta, Somadutta",Stony Brook University (US),USA,"Constraining the initial conditions of the quark-gluon plasma (QGP) remains a key challenge in the study of heavy-ion collisions. Recent hydrodynamic model studies suggest that event-wise mean transverse momentum ($[p_\mathrm{T}]$) is sensitive to the overlap area, and that fluctuations in nuclear overlap size (geometric component) can be distinguished from other sources (intrinsic component) using higher-order moments of the $[p_\mathrm{T}]$ distribution.

This talk presents precise ATLAS measurements of the mean, variance, skewness, and kurtosis of $[p_\mathrm{T}]$ in Pb+Pb and Xe+Xe collisions, highlighting distinct patterns in ultra-central collisions due to suppression of the geometric component as the overlap area reaches its maximum.New measurements exploring the dependence of these observables on momentum and pseudorapidity ranges are also presented. They probe the decorrelations of radial flow fluctuations in the transverse and longitudinal directions, as well as test the robustness of the extraction of QGP's speed-of-sound. These results offer new insights into the initial conditions and properties of the QGP produced in heavy-ion collisions.","{'_type': 'ContributionParticipation', '_fossil': 'contributionParticipationMetadata', 'first_name': 'Somadutta', 'last_name': 'Bhatta', 'fullName': 'Bhatta, Somadutta', 'id': '9459429', 'affiliation': 'Stony Brook University (US)', 'emailHash': '3f48a935c036f20fc74d145d39711304', 'db_id': 9459429, 'person_id': 8841426}"
Parallel session 17,parallel,New constraints to Chiral Effective Field Theories via Σ$^+$ -p femtoscopy with ALICE,"Heybeck, Benedict",Goethe University Frankfurt (DE),Germany,"Experimental information on the strong interaction between $\Sigma$ hyperons and protons is a crucial input for both the description of the equation of state of neutron stars with hyperon content and theoretical predictions regarding potential $\Sigma$-hypernuclei. Data on this interaction are scarce, solely based on scattering experiments. Since data points are only available at rather high relative momenta and their uncertainties are sizeable, theory calculations are not well constrained. Particularly the characteristics of the interaction in the triplet channel spin configuration are highly uncertain, and it is not yet clear if the interaction in this channel is attractive or repulsive. In this regard, two-particle intensity interferometry (femtoscopy) of $\Sigma$ baryons and nucleons can provide valuable information. 
The reconstruction of the weak decay of $\Sigma^+$ baryons is very challenging. Its decay into a proton and a neutral pion via the weak interaction has a branching ratio of around 50%, with the neutral pion decaying electromagnetically almost exclusively into two photons. In this talk, a novel reconstruction method will be shown which makes use of sophisticated reconstruction algorithms and machine learning techniques to improve the reconstruction efficiency and purity of the $\Sigma^+$ baryons, enabling the measurement of their correlation function with protons for the first time. The obtained correlation function will be discussed and related to latest theoretical calculations using Chiral Effective Field Theories, providing new constraints on the $\Sigma$–nucleon interaction.","{'_type': 'ContributionParticipation', '_fossil': 'contributionParticipationMetadata', 'first_name': 'Benedict', 'last_name': 'Heybeck', 'fullName': 'Heybeck, Benedict', 'id': '9385534', 'affiliation': 'Goethe University Frankfurt (DE)', 'emailHash': '60851502a9f498bb56690c4692eb77ba', 'db_id': 9385534, 'person_id': 9129371}"
Parallel session 6,parallel,Longitudinal dynamics of large and small systems from a 3D Bayesian calibration with RHIC top energy data,"Collaboration, JETSCAPE",Unknown,Unknown,"Over the past several years, significant progress has been made in leveraging rapidity-dependent measurements from colliders to gain insight about the early and late-time dynamics of relativistic nuclear collisions. In this study, we perform a systematic model-to-data comparison using simulations of Au-Au and $d$-Au collisions and a broad range of measurements from the PHENIX, STAR, PHOBOS, and BRAHMS Collaborations spanning nearly two decades of RHIC operations. In particular, we perform fully 3D multi-stage simulations including rapidity-dependent energy deposition with global energy conservation, along with relativistic viscous hydrodynamics and a hadronic afterburner [1]. We calibrate on rapidity- and pT-differential observables–examining the respective constraints on initial state and transport properties–and highlight the tension between them within our model. We quantify the additional constraints provided by rapidity dependent measurements and we emphasize the similarity in posteriors from separate calibrations of large and small systems. We use our calibrated model to make predictions of observables in additional smaller systems in $p$-Au and $^3$He-Au, as well as statistically-sensitive or proposed measurements in the calibrated systems. Furthermore, we predict longitudinal de-correlations, highlighting the dependence of flow measurements on the rapidity of the regions of interest and reference.

[1] C. Shen and B. Schenke, ""Longitudinal dynamics and particle production in relativistic nuclear collisions,"" Phys. Rev. C 105, no.6, 064905 (2022) [arXiv:2203.04685 [nucl-th]]","{'_type': 'ContributionParticipation', '_fossil': 'contributionParticipationMetadata', 'first_name': 'JETSCAPE', 'last_name': 'Collaboration', 'fullName': 'Collaboration, JETSCAPE', 'id': '9288825', 'affiliation': '', 'emailHash': None, 'db_id': 9288825, 'person_id': 8917240}"
Parallel session 6,parallel,sPHENIX measurements of collective behavior in small and large systems,"Jheng, Hao-Ren",Massachusetts Inst. of Technology (US),USA,"sPHENIX is a next-generation collider detector at RHIC which was successfully commissioned in 2023 and 2024 and took physics data in p+p and Au+Au collisions. In addition to its high-p$_T$ jet and heavy flavor physics program, sPHENIX is a general purpose collider detector with excellent capabilities for exploring collective phenomena in small and large systems. This is due to its large pseudorapidity and full-azimuth acceptance, dedicated forward detectors such as the sPHENIX Event Plane Detector (sEPD), and large data samples collected in RHIC Run-24. This talk presents new measurements of collective phenomena in Au+Au collisions using the sEPD, and in p+p collisions through two-particle correlation and cumulant methods. These measurements can help shed light on the nature of collective behavior at RHIC energies, especially in small systems, with a greatly expanded statistical and kinematic reach.","{'_type': 'ContributionParticipation', '_fossil': 'contributionParticipationMetadata', 'first_name': 'Hao-Ren', 'last_name': 'Jheng', 'fullName': 'Jheng, Hao-Ren', 'id': '9359289', 'affiliation': 'Massachusetts Inst. of Technology (US)', 'emailHash': '24af6f47bd3d38e804a4f26ad11378b4', 'db_id': 9359289, 'person_id': 9103967}"
Parallel session 6,parallel,First measurement of high $p_\mathrm{T}$ azimuthal anisotropy using subevent cumulants in small system collisions at CMS,"Singh, Rohit Kumar",Indian Institute of Technology Madras (IN),India,"Measurements at the LHC have provided evidence for collective behavior in high-multiplicity pp and pPb collisions through multiparticle correlation techniques. However, no conclusive evidence of jet quenching—characterized by the energy loss of high-$p_\mathrm{T}$ partons traversing the medium—have been observed in these smaller systems. This paradox raises an intriguing question: How can a medium that exhibits hydrodynamic-like behavior and substantially modifies the distribution of final-state hadrons have little to no effect on high-$p_\mathrm{T}$ particles? To explore this, we present a comprehensive analysis of differential Fourier coefficients ($v_{n}$) as a function of particle transverse momentum ($p_\mathrm{T}$) and event multiplicity in pp and pPb collisions, recorded by CMS at 13 TeV and 8.16 TeV, respectively. In particular, first measurements of $p_\mathrm{T}$-differential multiparticle cumulants using the subevent method are reported, probing an extended phase space region up to high $p_\mathrm{T}$ values. Furthermore, we compare the results across pp, pPb, and PbPb collisions within similar multiplicity ranges. This comparison will help assess similarities and differences in the medium's interaction with high-$p_\mathrm{T}$ particles in these three collision types.","{'_type': 'ContributionParticipation', '_fossil': 'contributionParticipationMetadata', 'first_name': 'Rohit Kumar', 'last_name': 'Singh', 'fullName': 'Singh, Rohit Kumar', 'id': '9381730', 'affiliation': 'Indian Institute of Technology Madras (IN)', 'emailHash': 'f3a264b88192726d88a89688baa74ebf', 'db_id': 9381730, 'person_id': 9125535}"
Parallel session 6,parallel,Probing QCD collectivity at the smallest scales through photonuclear collisions and high-multiplicity jets in pp collisions at CMS,"Liu, Xiaoyu",Rice University (US),USA,"Recent CMS data revealed intriguing long-range correlations within high-multiplicity jets produced in proton-proton collisions, suggesting the potential onset of collective behavior, typically associated with heavy-ion collisions, at much smaller scales. Two-particle correlations in the “jet frame” show a surprising rise in elliptic flow harmonics, v2*, at large pseudorapidity separations (Δη* > 2), in jets with high charged-particle multiplicities, a trend not reproduced by event generators like Pythia and Sherpa. In this talk, we present the transverse momentum and ∆η* dependence of elliptic and triangular flow, across a wide range of jet multiplicity and transverse momentum. We further explore the role of jet substructure in driving the observed long-range azimuthal correlations, examining its potential connection to the geometry of the initial-state jet system. Recent LHC studies also show signs of collectivity in high-multiplicity photonuclear collisions, where a quasi-real photon from one nucleus interacts with the other nucleus. In this talk, we also present new CMS measurements of two- and multi-particle correlations from photonuclear collisions using PbPb data at $\sqrt{s_{NN}} = 5.36$ TeV collected during the LHC Run 3. By leveraging the full detector acceptance, we explore wide pseudorapidity gaps up to 7–8 units, which significantly reduces non-collective contributions and enhances the search for long-range near-side ridge effects. Elliptic and triangular azimuthal anisotropies are extracted as functions of particle transverse momentum and event multiplicity.","{'_type': 'ContributionParticipation', '_fossil': 'contributionParticipationMetadata', 'first_name': 'Xiaoyu', 'last_name': 'Liu', 'fullName': 'Liu, Xiaoyu', 'id': '9381704', 'affiliation': 'Rice University (US)', 'emailHash': '88cb2abe7f4a332b5952effe89bb6f3e', 'db_id': 9381704, 'person_id': 9125505}"
Parallel session 31,parallel,Universality of scaled particle spectra in ultrarelativistic heavy-ion collisions,"Gardim, Fernando",Federal University of Alfenas,Unknown,"We find a remarkable universality in the experimentally observed transverse momentum spectra in ultrarelativistic nuclear collisions, obtained by removing the global scales of total particle number and mean transverse momentum. This scaling behavior breaks down at large transverse momentum and for very small systems, such as those produced in p-p collisions. We further demonstrate that this universal scaling behavior is compatible with hydrodynamic predictions and, thus, may indicate the onset of a hydrodynamic regime. Our results pave the way for further theoretical and experimental investigations of this novel scaling phenomenon to bring to light the collective and non-collective behavior encoded in the transverse particle spectrum of different collision systems.
This presentation is based on 2406.15208.","{'_type': 'ContributionParticipation', '_fossil': 'contributionParticipationMetadata', 'first_name': 'Fernando', 'last_name': 'Gardim', 'fullName': 'Gardim, Fernando', 'id': '9288751', 'affiliation': 'Federal University of Alfenas', 'emailHash': '04242bc5e8f30717b4def13981822852', 'db_id': 9288751, 'person_id': 8888987}"
Parallel session 31,parallel,Fluid dynamics of charm and beauty quarks from large to small systems,"Capellino, Federica",GSI - Helmholtzzentrum fur Schwerionenforschung GmbH (DE),Germany,"Heavy quarks (i.e. charm and beauty) are powerful tools to characterize the quark-gluon plasma (QGP) produced in heavy-ion collisions. Although they are initially produced out of kinetic equilibrium via hard partonic scattering processes, recent measurements of the anisotropic flow of charmed hadrons pose the question regarding the possible thermalization of heavy quarks in the medium. By exploiting a mapping between transport theory and hydrodynamics [1], we developed a fluid-dynamic description of heavy-quark diffusion in the QCD plasma. We will present results for transverse momentum distributions and integrated yields of charm and beauty hadrons obtained with a fluid-dynamic code coupled with the conservation of a heavy-quark - antiquark current in the QGP. We will show that our calculations are in agreement with the experimental measurements in Pb-Pb collisions [2,3] and provide new predictions for Ne-Ne and O-O collisions.
This work is funded via the DFG ISOQUANT Collaborative Research Center (SFB 1225).
[1] Phys.Rev.D 106 (2022) 3, 034021
[2] Phys.Rev.D 108 (2023) 11, 116011
[3] Capellino, Dubla, Facen, Floerchinger, Grossi, Kirchner, Masciocchi, in preparation","{'_type': 'ContributionParticipation', '_fossil': 'contributionParticipationMetadata', 'first_name': 'Federica', 'last_name': 'Capellino', 'fullName': 'Capellino, Federica', 'id': '9288792', 'affiliation': 'GSI - Helmholtzzentrum fur Schwerionenforschung GmbH (DE)', 'emailHash': '128adfe2cb27702f8d4eb42f3c09734a', 'db_id': 9288792, 'person_id': 8893593}"
Parallel session 31,parallel,Flow measurements at LHCb,"Belin, Samuel",Universidade de Santiago de Compostela (ES),Italy,"Particle correlations are powerful tools for studying quantum chromodynamics in hadron collisions. In heavy-ion collisions, azimuthal angular correlations probe collective phenomena in hot, dense, nuclear media, such as QGP. In small collision systems, they could point to final-state effects or potential initial-state correlations. The LHCb experiment has the unique ability to study particle correlations in high-energy hadron collisions at forward rapidity, exploring a unique region with respect to other experiments, where longitudinal expansion becomes more important. In this contribution, recent results on collective flow from the LHCb experiment will be discussed","{'_type': 'ContributionParticipation', '_fossil': 'contributionParticipationMetadata', 'first_name': 'Samuel', 'last_name': 'Belin', 'fullName': 'Belin, Samuel', 'id': '9396765', 'affiliation': 'Universidade de Santiago de Compostela (ES)', 'emailHash': '6ec6fd98a4bb927fbe47eb4cac3a226b', 'db_id': 9396765, 'person_id': 9140813}"
Parallel session 31,parallel,Measurement of Anisotropic Flow for BES-II Energies at RHIC-STAR,"RAV SHARMA, SHARANG ",IISER Tirupati,Unknown,"Anisotropic flow characterizes the shape and direction of expansion of the medium created in heavy-ion collisions. The Fourier coefficients in the expansion of particle azimuthal distribution describe the collective response of the medium to the shape of the initial collision geometry, 
and are sensitive to the equation of state (EOS). A non-monotonic slope in the first-order flow coefficient $v_1$ (directed flow) is proposed as a potential signature of a first-order phase transition between the QGP and hadronic phase. The second-order coefficient $v_2$ (elliptic flow) exhibits NCQ scaling at top RHIC and LHC energies, reflecting partonic collectivity, but this scaling vanishes at $\sqrt{s_{NN}} = 3$ GeV. The third-order coefficient $v_3$ (triangular flow) is typically driven by initial-state fluctuations and is uncorrelated with the reaction plane. However, recent measurements at lower collision energies reveal a correlation between $v_3$ and the first-order event plane angle ($\Psi_{1}$), attributed to collision geometry and the potential in the responsive medium.\\
\indent In this talk, we will report the measurements of $v_1$, $v_2$, and $v_3\{\Psi_{1}\}$ for light, strange, multi-strange, net-particles, and light nuclei in Au+Au collisions. These measurements span energies of $\sqrt{s_{NN}}$ = 3.2 -- 4.5 GeV in fixed-target mode, as well as 7.7 -- 19.6 GeV in collider mode, from the second phase of the Beam Energy Scan (BES-II) program at RHIC-STAR. We will present the precise measurements of $v_2$ for $\phi$ mesons and multi-strange hadrons, along with the energy dependence of NCQ scaling. The presented results aim to shed light on the onset of partonic interactions. Additionally, atomic mass number (A) scaled $v_1$ slope of light nuclei will be presented to understand their production mechanism. The experimental measurements will be compared with transport model calculations to explore the underlying physics mechanisms in the high baryon density region of the QCD phase diagram.","{'_type': 'ContributionParticipation', '_fossil': 'contributionParticipationMetadata', 'first_name': 'SHARANG ', 'last_name': 'RAV SHARMA', 'fullName': 'RAV SHARMA, SHARANG ', 'id': '9414323', 'affiliation': 'IISER Tirupati', 'emailHash': 'c764cec6f20d7b13f7879bb0c289dc22', 'db_id': 9414323, 'person_id': 9157264}"
Parallel session 31,parallel,Constraining the small system collectivity using d+Au and O+O collisions at $\sqrt{s_{NN}}$ = 200 GeV from STAR,"Yan, Zhengxi",Stony Brook University,United States,"The understanding of collectivity in small collision systems must address three key issues related to the initial conditions: (1) the role of nucleon and sub-nucleon fluctuations, (2) nucleon forces and emergent correlations in light ions, such as alpha clustering, and (3) the influence of longitudinal fluctuations and their impact on flow decorrelations. We present two- and four-particle cumulants of $v_2$ and $v_3$ based on new d+Au and O+O datasets collected in the year 2021 with extended forward and midrapidity acceptance of STAR. Notably, we observe a significant enhancement in both $v_2\{2\}$ and $v_2\{4\}$ in d+Au collisions compared to O+O collisions, in the highest-multiplicity events, suggesting markedly different ellipticities in these two systems. Comparisons with model calculations reveal a clear influence of sub-nucleon fluctuations and nuclear structure effects. The $v_n$ measurements are performed using two-particle correlations in rapidity ranges $|\eta|<1.5$ and $2.1<|\eta|<5.1$. The role of flow decorrelations with rapidity is investigated and the findings are compared to previous RHIC measurements and model predictions. These new findings greatly expand our understanding of small system collectivity.","{'_type': 'ContributionParticipation', '_fossil': 'contributionParticipationMetadata', 'first_name': 'Zhengxi', 'last_name': 'Yan', 'fullName': 'Yan, Zhengxi', 'id': '9414358', 'affiliation': '', 'emailHash': 'b904b6ed67918c82f1d2b7c5817f3dfc', 'db_id': 9414358, 'person_id': 8933420}"
Parallel session 16,parallel,BHAC-QGP: three-dimensional MHD simulations of relativistic heavy-ion collisions,"Dash, Ashutosh",Goethe University,Unknown,"We present BHAC-QGP, an advanced numerical code designed to simulate the evolution of quark-gluon plasma (QGP) in heavy-ion collisions with enhanced accuracy in the presence of magnetic field. Building on the foundation of the Black Hole Accretion Code (BHAC), which solves general-relativistic magnetohydrodynamic (GRMHD) equations for astrophysical phenomena, BHAC-QGP adapts these capabilities to the unique challenges of high-energy nuclear collisions. BHAC-QGP leverages Adaptive Mesh Refinement (AMR) to dynamically enhance resolution in regions requiring high precision, enabling detailed tracking of QGP properties over a wide range of length scales. We present applications of BHAC-QGP to gold-gold (Au-Au) collisions at RHIC energies, demonstrating its superior accuracy over existing models and confirming its consistency with established results. These advancements underscore BHAC-QGP's potential as a robust tool for precision studies in relativistic heavy-ion physics.","{'_type': 'ContributionParticipation', '_fossil': 'contributionParticipationMetadata', 'first_name': 'Ashutosh', 'last_name': 'Dash', 'fullName': 'Dash, Ashutosh', 'id': '9288690', 'affiliation': '', 'emailHash': 'b283f4e902f2c224e4de6ab7e01eaf77', 'db_id': 9288690, 'person_id': 8881156}"
Parallel session 16,parallel,Initial momentum and conserved charges to final flow,"William Luzum, Matthew",University of São Paulo,Unknown,"The evolution of a relativistic heavy-ion collision is typically understood as a process that transmutes the initial geometry of the system into the final momentum distribution of observed hadrons, which can be described via a cumulant expansion of the initial distribution of energy density and is represented at leading order as the well-known eccentricity scaling of anisotropic flow. We extend this framework to include the contribution from initial momentum-space properties as encoded in other components of the energy-momentum tensor, as well initial conserved charge densities. We confirm the validity of the framework in state-of-the-art hydrodynamic simulations
 of large and small systems. 
 With this new framework, it is possible to separate the effects of early-time dynamics from those of final-state evolution, even in the case when the distribution of energy does not fully determine subsequent evolution, as for example, in small systems. Specifically, we answer the question of when and how azimuthal correlations from the initial state survive to the final state.

In very small systems such as $p$-$p$, for example, initial momentum degrees of freedom dominate over energy. Thus, even if the system forms a quark-gluon plasma that is well described by hydrodynamics, the usual hydrodynamic picture of the transmutation of initial geometry to final momentum anisotropy is broken.  Nevertheless, we show that the hydrodynamic response to the full energy-momentum tensor can be well understood in a similar manner as larger systems. Additionally, this framework elucidates the generic features of the system's evolution that are responsible for the impressive success of hydrodynamic simulations, but which may still hold even in cases where hydrodynamics is not applicable.

Based on:  arXiv:2405.13600 and work in progress","{'_type': 'ContributionParticipation', '_fossil': 'contributionParticipationMetadata', 'first_name': 'Matthew', 'last_name': 'William Luzum', 'fullName': 'William Luzum, Matthew', 'id': '9288710', 'affiliation': 'University of São Paulo', 'emailHash': 'b964ef68d153c670e1723ae651606490', 'db_id': 9288710, 'person_id': 8885099}"
