Session,Type,Title,Speaker,Institute,Country,Abstract,Raw_Speaker_Data
Parallel session 7,parallel,Testing the QCD formation time with reconstructed parton splittings,"Brewer, Jasmine Therese",University of Oxford (GB),UK,"Heavy ion collisions provide a unique opportunity to access the space-time ordering of parton branching processes, since parton showers interact with a spatially-extended dense medium. However, the challenges of robustly isolating the formation time of a splitting phenomenologically has prevented formation time-dependent modification effects from being accessed experimentally. We address these challenges using heavy flavour, which offers an additional handle on tracing the propagation of individual quarks through the medium. We demonstrate how modified and groomed versions of the Cambridge/Aachen or FlavourCone jet finding algorithms applied on $g \to c\bar{c}$ splittings can be used to reconstruct the kinematics of such splittings with high fidelity using either final state partons or hadrons. We construct the parton formation time distribution, which has characteristic distortions arising from medium effects. This effect can be used to construct ratios of $\tau_f$-distributions in which the sensitivity of parton branching to the QCD formation time becomes experimentally accessible.","{'_type': 'ContributionParticipation', '_fossil': 'contributionParticipationMetadata', 'first_name': 'Jasmine Therese', 'last_name': 'Brewer', 'fullName': 'Brewer, Jasmine Therese', 'id': '9288944', 'affiliation': 'University of Oxford (GB)', 'emailHash': '8594aa18b92a774f4ab1f337c40a8b3b', 'db_id': 9288944, 'person_id': 8937359}"
Parallel session 7,parallel,Pre-equilibrium charm quark dynamics and their impact on D-Meson observables,"Schenke, Bjoern",Brookhaven National Lab,USA,"Charm quarks offer valuable insights into the properties and evolution of the QCD medium as they are generated in the initial moments of energetic heavy-ion collisions at Relativistic Heavy-Ion collider (RHIC) and Large Hadron Collider (LHC). In particular, they can carry signals from the pre-equilibrium stage since the very high energy density of this stage can result in significant charm-medium interaction. Using a hybrid simulation framework that combines the IP-Glasma model for initial-state with viscous hydrodynamic evolution MUSIC to model the medium, we study charm quark propagation through different stages of the collision, from pre-equilibrium to hadronization. Heavy quark initial production is generated using PYTHIA and their interactions within the pre-equilibrium and hydrodynamic medium are modeled through Langevin dynamics in MARTINI. Our results reveal that both the nuclear modification factor and anisotropic flow coefficients of D-mesons in Pb+Pb collisions at $\sqrt{s_{NN}} = 5.02$ TeV are sensitive to the momentum-dependent energy loss of charm quarks in the initial stages. Furthermore, we demonstrate that hadronization mechanisms—specifically fragmentation and coalescence—play a crucial role in shaping the final-state charm observables.","{'_type': 'ContributionParticipation', '_fossil': 'contributionParticipationMetadata', 'first_name': 'Bjoern', 'last_name': 'Schenke', 'fullName': 'Schenke, Bjoern', 'id': '9288918', 'affiliation': 'Brookhaven National Lab', 'emailHash': '4a88eb902ae580760430eaf0464746cf', 'db_id': 9288918, 'person_id': 8858157}"
Parallel session 7,parallel,Investigating Charm Quark Interactions and Hadronization in PbPb Collisions through $\Lambda_c^+$ and $D_s^\pm$ flow Measurements,"Saha, Nihar Ranjan",Indian Institute of Technology Madras (IN),India,"Charm quarks serve as a sensitive probe of the Quark Gluon Plasma providing direct insights into its formation, evolution, and properties. We present the first-ever measurement of the elliptic flow of charm baryons, specifically prompt $\Lambda_c^+$, in lead-lead (PbPb) collisions at a center-of-mass energy of 5.36 TeV, using the CMS experiment. We also present the elliptic and triangular flow of prompt $D_{s}^{\pm}$ mesons with new standard of precision. The broader kinematic coverage and the first-ever $v_3$ measurement of $D_{s}^{\pm}$ mesons provide new insights into charm quark flow generation mechanisms and the impact of hadronization on flow. By comparing the flow of prompt $\Lambda_c^+$ and prompt $D_{s}^{\pm}$ to $D^0$ mesons in the same kinematic range, we investigate charm quark interactions with the medium and hadronization mechanisms. Additionally, we explore the charm quark hadronization mechanism further by measuring the $\Lambda_c^+/D^0$ yield ratio across pp, PbPb, and pPb collisions. These results offer a unique opportunity to explore the influence of initial-state effects on heavy quark dynamics. Additionally, comparison with theoretical models provides critical validation of the underlying physics mechanisms, and provide deeper insights into charm quark dynamics in heavy ion collisions.","{'_type': 'ContributionParticipation', '_fossil': 'contributionParticipationMetadata', 'first_name': 'Nihar Ranjan', 'last_name': 'Saha', 'fullName': 'Saha, Nihar Ranjan', 'id': '9381679', 'affiliation': 'Indian Institute of Technology Madras (IN)', 'emailHash': '1f4b6d737dbbe6175a1ac2ab9bee6dcd', 'db_id': 9381679, 'person_id': 9125482}"
Parallel session 7,parallel,Charm quark and QGP interactions through the spectra and anisotropic flow of D0 over the widest pT interval using Event-Shape Engineering at CMS,"Chandra, Soumik",Purdue University (US),USA,"The charm quark is formed almost exclusively during the initial stages of the collision, and a significant fraction of the charm quarks fragment into the $D^{0}$ meson, the lightest open-charm hadron. We can gain insights into the interactions between the charm quark and the quark-gluon plasma (QGP) medium by studying the production and the flow of $D^{0}$ meson in heavy-ion collisions. We study the effect of the initial shape of the collision system on the elliptic flow ($v_{2}$) of promptly produced $D^{0}$ using event-shape engineering (ESE) in PbPb collisions at 5.02 TeV, at CMS. A correlation between the initial shape anisotropy with the $D^{0}$ $v_{2}$ would suggest that the flow gets driven by the interactions between the charm quark and the QGP and comparison with theoretical predictions allow us to unravel the mechanism behind the generation of $v_{2}$. We also study the anisotropic flow of nonprompt $D^{0}$ produced due to the decay of the bottom quarks and the nuclear modification factor ($\mathrm{R_{AA}}$) for prompt and nonprompt $D^{0}$. These studies provide further insights into the QGP interactions of heavy quarks like charm and bottom in heavy-ion collisions in different $p_{T}$ regions ranging from 1--40 GeV/c, the widest ever performed with ESE, and centralities between 0--50\%.","{'_type': 'ContributionParticipation', '_fossil': 'contributionParticipationMetadata', 'first_name': 'Soumik', 'last_name': 'Chandra', 'fullName': 'Chandra, Soumik', 'id': '9381764', 'affiliation': 'Purdue University (US)', 'emailHash': 'abf6f531962b54419229aba23591ccf2', 'db_id': 9381764, 'person_id': 9125565}"
Parallel session 7,parallel,sPHENIX measurement of the $\Lambda_c$ / $D^0$ ratio in p+p collisions at RHIC,"Osborn, Joe",Brookhaven National Laboratory,USA,"sPHENIX is a next-generation experiment at RHIC for jet and heavy-flavor physics which was fully commissioned during 2023 and 2024. Using its novel streaming-readout-capable, precision tracking system, sPHENIX collected 100 billion unbiased p+p collisions, and a further sample of minimum-bias Au-Au collisions, in Run-24. A key measurement of the sPHENIX heavy flavor physics program is the comparison of $\Lambda_c$ to $D^0$ differential yields in both Au+Au and p+p collisions, which probes questions related to the hadronization of heavy-flavor baryons compared to mesons in the Quark-Gluon Plasma medium and in vacuum. At RHIC energies, there is no previous measurement of the $\Lambda_c$ / $D^0$ baseline in p+p collisions, modern Monte Carlo event generators give widely different predictions, and the ratio in Au+Au is only poorly known. This talk presents a measurement from sPHENIX of the $\Lambda_c$/ $D^0$ ratio in p+p collisions and the status of the measurement in Au+Au collisions.","{'_type': 'ContributionParticipation', '_fossil': 'contributionParticipationMetadata', 'first_name': 'Joe', 'last_name': 'Osborn', 'fullName': 'Osborn, Joe', 'id': '9359291', 'affiliation': 'Brookhaven National Laboratory', 'emailHash': '5635915083c059c97fad0a51465715c3', 'db_id': 9359291, 'person_id': 9103968}"
Parallel session 27,parallel,Quarkonium production in heavy-ion collisions with ALICE,"Lofnes, Ingrid Mckibben",University of Bergen (NO),NO,"Charmonium production has long been identified as one of the golden probes to study the quark­­–gluon plasma (QGP). In fact, the early production of heavy quarks ($c\bar{c}$ and $b\bar{b}$) make charmonia an ideal tool to investigate the evolution of the hot and dense medium produced in ultra-relativistic heavy-ion collisions. Moreover, at LHC energies the recombination of uncorrelated charm quarks pairs, namely (re)generation, was found to significantly affect charmonium observables, in contraposition to the well known suppression mechanism. This aspect makes the production measurements of ground and excited states more and more relevant to discriminate among the scenarios foreseen by the different theoretical models. In addition, the possibility to isolate the non-prompt charmonia, i.e. originating from beauty hadron decays, provides an insight into the energy loss experienced by the ancestor beauty quarks inside the QGP. In this contribution, recently published results by the ALICE collaboration of inclusive charmonia production obtained at central and forward rapidity in Pb--Pb collisions at $\sqrt{s_{\rm NN}}$ = 5.02 TeV will be presented. At midrapidity, the measurements of prompt and non-prompt  J/$\psi$ production will be shown, while at forward rapidity the measurement will be extended to the excited state as the $\psi$(2S). Finally, the first preliminary measurement of the $\psi$(2S)-to-J/$\psi$ ratio obtained with the new data sample collected in Pb--Pb collisions at $\sqrt{s_{\rm NN}}$ = 5.36 TeV will be presented.","{'_type': 'ContributionParticipation', '_fossil': 'contributionParticipationMetadata', 'first_name': 'Ingrid Mckibben', 'last_name': 'Lofnes', 'fullName': 'Lofnes, Ingrid Mckibben', 'id': '9385601', 'affiliation': 'University of Bergen (NO)', 'emailHash': '10f2a9cb24d60d00a03b3133904b12da', 'db_id': 9385601, 'person_id': 9129403}"
Parallel session 27,parallel,Efficiently simulating quarkonium's evolution beyond the dipole approximation,"Escobedo Espinosa, Miguel Angel",Universitat de Barcelona,Unknown,"The open quantum system framework allows one to compute quarkonium's evolution in a medium, keeping track of the needed quantum features. However, computing this evolution is a computationally demanding task. QTRAJ is an efficient code that allows one to simulate the behavior of quarkonium in a medium in the case in which the medium sees quarkonium as a small color dipole $rT\ll 1$. While this limit is accurate for $\Upsilon(1S)$, its applicability to other quarkonium states is unclear.  In this talk, wwe present a generalization of this code that incorporates the regime where $rT \sim 1$ in the one-gluon exchange approximation. In its new version, QTRAJ implements new jump operators connecting different states, which are then expanded in plane waves, giving rise to a variation of the algorithm present in QTRAJ 1.0 where jumps with $\Delta \ell > 1$ are allowed. We will show a review of this approach comparing the $rT\ll 1$ and $rT\sim 1$ cases, and we present preliminary phenomenological results.","{'_type': 'ContributionParticipation', '_fossil': 'contributionParticipationMetadata', 'first_name': 'Miguel Angel', 'last_name': 'Escobedo Espinosa', 'fullName': 'Escobedo Espinosa, Miguel Angel', 'id': '9288865', 'affiliation': 'Universitat de Barcelona', 'emailHash': '059a7d93660a522048bf08631e468c8a', 'db_id': 9288865, 'person_id': 8931630}"
Parallel session 27,parallel,Determination of space diffusion coefficient by heavy flavour $R_{AA}$ and $v_n$ in an event-by-event approach,"Sambataro, Maria Lucia",Università degli Studi di Catania,Unknown,"The strong interaction in the non-perturbative regime typical of the system created in Heavy-Ion collision has been studied in the past years through an effective Quasi-Particle Model ($QPM$): we present an extension to a more realistic model, named $QPMp$, incorporating momentum-dependent parton masses as entailed by QCD asymptotic free dynamics. This model naturally improves the description of quark susceptibilities previously underestimated in the simple $QPM$. Coupling the $QPMp$ modeling to an event-by-event transport approach based on Langevin equations, we evaluate the heavy-flavour $R_{AA}(p_T)$ and $v_{n}(p_T)$ for $D$, $\Lambda_c$, $B$, $\Lambda_b$ hadrons in $PbPb$ as well as for $OO$ at $5$ $ATeV$. In $PbPb$ we find a quite good prediction for both $D$ meson and leptons from $B$ decays at least within current experimental uncertainties; we also discuss the additional information that can be carried by collisions of light $OO$ system. 
A main general result is that for charm quark the extracted space diffusion Ds(T) appears to be significantly larger (about $30-40\%$) wrt the recent lQCD/NREFT results at momentum $p=0$. We propose a novel analysis that point out the crucial role of the momentum dependence of the interaction to draw solid conclusions about the agreement between the phenomenological approach and lQCD calculation as well as to determine the thermalization time of HQ and in particular its mass dependence from charm to bottom quark. We will point out that $\Lambda_c$ production and the $R_{AA}(p_T)$ of D meson at very low momenta ($p_T<1.5$ $GeV$) will allow for a novel and more solid determination of the space diffusion coefficient.


M.L.Sambataro, V. Minissale, S. Plumari and V. Greco, Phys.Lett.B 849 (2024) 138480.

M. L. Sambataro, V. Greco, G. Parisi and S. Plumari, Eur.Phys.J.C 84 (2024) 9, 881.

M.L.Sambataro et al., in preparation.","{'_type': 'ContributionParticipation', '_fossil': 'contributionParticipationMetadata', 'first_name': 'Maria Lucia', 'last_name': 'Sambataro', 'fullName': 'Sambataro, Maria Lucia', 'id': '9288874', 'affiliation': 'Università degli Studi di Catania', 'emailHash': '794d73cacd8229eef1619b132263a6bf', 'db_id': 9288874, 'person_id': 8931693}"
Parallel session 27,parallel,Unscreened potential and quarkonium width in QGP,"Larsen, Rasmus",Stony Brook University,United States,"Screening of the heavy quark anti-quark potential was suggested as the cause of quarkonium melting in quark gluon plasma (QGP). Perturbative QCD calculations within potential non-relativistic QCD (pNRQCD) on the other hand do not lead to a screened potential in general and the thermal correction to the potential also has an imaginary part. We determine the complex potential in QGP using lattice calculations on lattices with large temporal extent $N_{\tau}=16-36$. The complex potential is extracted from the Wilson line correlators and physically motivated forms of the corresponding spectral functions [1,2]. We find that the real part of the complex potential is not screened in QGP independently of the detailed form of the spectral functions. We also estimate the imaginary part of the potential using prior information from various theoretical calculations [2].

Lattice calculations also find that the wave function of bottomonium states does not change much across the QCD transition [3]. This is consistent with the observation of the unscreened potential. Therefore, we use the vacuum wave function of different quarkonium states and the imaginary part of the potential obtained by us on the lattice to estimate the size of in-medium widths of $J/\psi$, $\psi(2S)$, $\chi_c(1P)$, $\Upsilon(1S)$, $\Upsilon(1S)$, $\Upsilon(1S)$ and $\chi_b(1P)$ and $\chi_b(2P)$ states
in QGP [2] and compare to lattice NRQCD results [3].

[1] Alexei Bazavov, Daniel Hoying, Rasmus N. Larsen, Swagato Mukherjee, Peter Petreczky, Alexander Rothkopf, Johannes Heinrich Weber, Phys. Rev. D 109 (2024) 074504

[2] Rasmus N. Larsen, Swagato Mukherjee, Peter Petreczky, Johannes Heinrich Weber, work in progress

[3] Rasmus N. Larsen, Stefan Meinel, Swagato Mukherjee, Peter Petreczky, Phys. Rev. D 102 (2020) 114508","{'_type': 'ContributionParticipation', '_fossil': 'contributionParticipationMetadata', 'first_name': 'Rasmus', 'last_name': 'Larsen', 'fullName': 'Larsen, Rasmus', 'id': '9288913', 'affiliation': '', 'emailHash': 'c6f9161614ff97dbff2a3cdd80359d36', 'db_id': 9288913, 'person_id': 8935829}"
Parallel session 13,parallel,Studying charm-quark hadronization via charm-baryon production measurements in pp at the LHC with ALICE,"Sharma, Himanshu","Universita e INFN, Padova (IT)",Italy,"Charm-baryon production measurements in proton-proton (pp) collisions at the LHC are fundamental to investigate the charm-quark hadronization, and to test perturbative QCD-based calculations. Recent measurements in pp collisions show baryon-to-meson ratios significantly higher than those in $\mathrm{e^+e^-}$ collisions, challenging the validity of theoretical calculations based on the factorisation approach and assuming universal fragmentation functions across collision systems. Several QCD-inspired effective models (e.g. Catania, POWLANG, QCM) and Monte Carlo generators (e.g. PYTHIA 8, EPOS 4) take different approaches to describe the charm-quark hadronization, and to explain the observed baryon production at the LHC. However, most of them do not manage to describe simultaneously the production of strange and non-strange charm baryons. Precise measurements of strange and non-strange charm-baryon production are crucial to put constraints on model calculations, and to understand the mechanisms governing the charm-quark hadronization in pp collisions at the LHC.

In this contribution, the first measurement of strange ($\Xi_\mathrm{c}^{0,+}$) and non-strange ($\Lambda_\mathrm{c}^+$, $\Sigma_\mathrm{c}^{0,++}(2455)$, $\Sigma_\mathrm{c}^{0,++}(2520)$) charm-baryon production utilising the large data sample of pp collisions at $\sqrt{s} = 13.6$ TeV harvested from the start of LHC Run 3 are presented, and the comparison with model predictions are discussed.","{'_type': 'ContributionParticipation', '_fossil': 'contributionParticipationMetadata', 'first_name': 'Himanshu', 'last_name': 'Sharma', 'fullName': 'Sharma, Himanshu', 'id': '9385590', 'affiliation': 'Universita e INFN, Padova (IT)', 'emailHash': '1c0a12d722adf3b758d97d0df8d031a9', 'db_id': 9385590, 'person_id': 8896597}"
Parallel session 13,parallel,Prompt/Non-prompt J/ψ production in pp collisions at forward and midrapidity with ALICE,"Acharya, Shreyasi","Universita e INFN, Bari (IT)",Italy,"Quarkonium production in high-energy hadronic collisions is sensitive to both perturbative and non-perturbative aspects of quantum chromodynamics (QCD) calculations. Charmonium cross section can be split into prompt and non-prompt components, the first corresponding to directly produced  charm-anticharm pairs, the second originating from the decay of beauty hadrons. Both components are relevant for the investigation of the properties of the quark–gluon plasma (QGP), with the latter allowing a study the mass dependence of heavy-quarks in-medium energy-loss mechanism. In this contribution the recent measurement of prompt and non-prompt $\rm{J}/\psi$ carried out by the ALICE Collaboration in pp and Pb–Pb collisions at midrapidity (|y| < 0.8) will be shown, including the newest results from LHC Run 3. Moreover, thanks to the installation of the new muon forward tracker (MFT), prompt/non-prompt charmonium separation is now possible in LHC Run 3 at forward rapidity (2.5 < y < 3.6). Using pp collisions at $\sqrt{s} = 13.6$ TeV, performances for the prompt and non-prompt $\rm{J}/\psi$ separation at forward rapidity will be discussed. For the first time, preliminary results on the prompt/non-prompt $\rm{J}/\psi$ fraction will be presented.","{'_type': 'ContributionParticipation', '_fossil': 'contributionParticipationMetadata', 'first_name': 'Shreyasi', 'last_name': 'Acharya', 'fullName': 'Acharya, Shreyasi', 'id': '9385597', 'affiliation': 'Universita e INFN, Bari (IT)', 'emailHash': 'b2d93f75f2942a2839049f75f8fe9292', 'db_id': 9385597, 'person_id': 9129401}"
Parallel session 13,parallel,A comprehensive study of open heavy flavor transport and hadronization in heavy-ion collisions,"Fu, Yu",Duke university,USA,"Heavy quarks serve as a clean probe of the quark-gluon plasma (QGP) produced in high-energy nuclear collisions. They are primarily generated from early-stage hard scatterings and retain information about the entire evolution of the QGP fireball. We have developed a state-of-the-art model to provide a comprehensive description of the heavy quark evolution in a realistic QGP medium from the heavy quark's production in the initial stages of the collision all the way to hadronic freeze-out. 

The transport of heavy quarks in the QGP medium is described by a Langevin-based transport model that has been augmented to incorporate medium-induced radiation. This transport model is coupled to a bulk evolution model based on 2+1D relativistic viscous fluid dynamics. The heavy quark transport coefficients are derived from non-perturbative T-matrix calculations, which account for resonant correlations near the QGP transition temperature.  Hadronization of the heavy quark is described by a fragmentation plus coalescence model. We utilize the resonance recombination model that satisfies energy conservation and provides an equilibrium mapping between quark and meson distributions. The recombination probabilities are derived from resonant heavy-quark scattering rates. 

We report on key observables in open heavy flavor physics, including the nuclear modification factor, elliptic flow, baryon-to-meson ratio, as well as D-Dbar angular correlations and compare our results to experimental data from the ALICE collaboration in Pb-Pb collisions at 5 TeV.","{'_type': 'ContributionParticipation', '_fossil': 'contributionParticipationMetadata', 'first_name': 'Yu', 'last_name': 'Fu', 'fullName': 'Fu, Yu', 'id': '9293832', 'affiliation': 'Duke university', 'emailHash': '46b5fc6a35209bc0589d0e568a30f7d7', 'db_id': 9293832, 'person_id': 8913019}"
Parallel session 13,parallel,Heavy flavor correlations and Quarkonia production in high energy proton-proton collisions in the EPOS4HQ framework,"Zhao, Jiaxing",Subatech,Unknown,"A  heavy quark-antiquark ($Q\bar Q$) pair can be produced in several pQCD processes, which impose different correlations between the $Q$ and $\bar Q$. Employing  the recently advanced EPOS4HQ event generator, which contains these processes,  we show  that they explain the measured $D$$\bar D$  and $DD$ correlations and how they influence the $p_T$ distributions of open heavy flavor mesons in pp and AA collisions. It turns out that this influence is different for D and B mesons.  

These correlations have also an influence on hidden heavy flavour mesons produced in pp collisions. To explore them we present a model of quarkonia formation based on the convolution between the Wigner densities, associated to the quarkonia eigenstates (excited states up to 3S states),  and the Wigner density of  the two-body $Q \bar Q$  pairs produced those collisions. This model allows to predict quantitatively the rapidity and $p_T$ distribution of ground states and excited states of charmonia as well as of bottomonia in pp collisions. We compare the results with experiments and identify the influence of the correlations. Finally, we  extend the density matrix approach to study the production of $B_c$ mesons and compare our results with experimental data.","{'_type': 'ContributionParticipation', '_fossil': 'contributionParticipationMetadata', 'first_name': 'Jiaxing', 'last_name': 'Zhao', 'fullName': 'Zhao, Jiaxing', 'id': '9288829', 'affiliation': 'Subatech', 'emailHash': 'f0ff00f886a09ebae2b656e82d41e98c', 'db_id': 9288829, 'person_id': 8918479}"
