Session,Type,Title,Speaker,Institute,Country,Abstract,Raw_Speaker_Data
Poster Session,poster,D0-meson production as a function of event transverse spherocity in pp collisions at √s = 7 TeV with ALICE at the LHC,"Jadhav, Manoj Bhanudas",IIT- Indian Institute of Technology (IN),Unknown,"Multiplicity and event-shape variables like spherocity can be used to select events according to their topology. They provide a powerful tool to study soft-QCD processes (low Q$^{2}$), such as multiple parton interactions (MPI) and colour reconnection (CR) mechanisms which are expected to produce more isotropic events with respect to events dominated by jet production.

At the Large Hadron Collider (LHC) energies, heavy quarks are produced in hard scattering processes and their production can be described using perturbative quantum chromodynamics (pQCD). The measurements of open heavy-flavour hadrons as a function of spherocity and charged-particle multiplicity could improve the theoretical understanding of the production mechanisms, and the interplay between hard and soft processes.

In this contribution, recent results of the production of prompt D$^{0}$-meson as a function of event transverse spherocity (S$_{\rm O}$) in minimum bias pp collisions at $\sqrt{s}$ = 7 TeV will be presented. The results will be compared to predictions obtained with PYTHIA event generator.","{'_type': 'ContributionParticipation', '_fossil': 'contributionParticipationMetadata', 'first_name': 'Manoj Bhanudas', 'last_name': 'Jadhav', 'fullName': 'Jadhav, Manoj Bhanudas', 'id': '3513799', 'affiliation': 'IIT- Indian Institute of Technology (IN)', 'emailHash': '097ee2a8dfb200c5108b9bdc3055966b', 'db_id': 3513799, 'person_id': 3632417}"
Poster Session,poster,Production of electrons from heavy-flavour hadron decays in proton-proton and Xe-Xe collisions with ALICE at the LHC,"Hornung, Sebastian",GSI - Helmholtzzentrum fur Schwerionenforschung GmbH (DE),Germany,"At the LHC energies,  heavy quarks (i.e. charm and beauty) are produced in proton-proton (pp) collisions mainly via hard partonic scattering processes. They provide an essential testing ground for perturbative QCD calculations. In heavy-ion collisions, heavy quarks are produced in a shorter timescale than the quark-gluon plasma. Therefore, they experience the full collision history carrying unique information on the medium properties. On this regard, heavy-flavour measurements in pp collisions serve as a baseline for the heavy-ion measurements. 
In this poster we will show the status of measurements of the production of electrons from heavy-flavour hadron decays in pp collisions at different collision energies. The nuclear modification factor ($R_{\rm AA}$) of electrons from heavy-flavour hadron decays in Xe-Xe collisions will be also discussed. The comparison with Pb-Pb data allows us to investigate the influence of different system geometry and size at similar energy densities. The analysis procedure employed for measuring the spectra of electrons from the heavy-flavour hadron decays will be discussed, including the most recent data-driven method used to subtract the large electron background component  from photon conversion and Dalitz decay. Comparisons with model calculations including the interaction of heavy quarks with the hot, dense, and deconfined medium will be presented.","{'_type': 'ContributionParticipation', '_fossil': 'contributionParticipationMetadata', 'first_name': 'Sebastian', 'last_name': 'Hornung', 'fullName': 'Hornung, Sebastian', 'id': '3513798', 'affiliation': 'GSI - Helmholtzzentrum fur Schwerionenforschung GmbH (DE)', 'emailHash': '9e0a33dc8354b4e4b28cde5d7dd74893', 'db_id': 3513798, 'person_id': 3641416}"
Poster Session,poster,Event shape engineering for the D-meson elliptic flow in Pb-Pb collisions at sqrt{s_NN}=5.02 TeV with ALICE at the LHC,"Festanti, Andrea",CERN,Switzerland,"Heavy-flavor mesons are effective tools to study the properties of the Quark-Gluon Plasma (QGP) created in ultra-relativistic heavy-ion collisions. Charm and beauty quarks are produced in hard scattering processes on timescales shorter than the QGP formation time due to their large masses and, thus, they experience the entire evolution of the medium interacting with its constituents via in-medium gluon radiation and collisional processes. The measurement of D-meson azimuthal anisotropy, quantified in terms of the elliptic flow $v_2$, allows one to study whether low-momentum charm quarks, interacting with the medium constituents, participate in the collective expansion of the system. At high transverse momentum, the path length dependence of parton energy loss mechanisms can be tested. The dynamics of heavy quarks in the QGP can be further investigated through the Event Shape Engineering (ESE) analysis. Measuring the D-meson $v_2$ in classes of events defined on the basis of the average flow in a given centrality class allows to evaluate the correlation between the elliptic flow of soft hadrons and D mesons. Furthermore, it provides information about the effect of initial state fluctuations on the energy loss experienced by the heavy quark propagating in the QGP.

The measurement of the D-meson $v_2$ in Pb-Pb collisions at $\sqrt{s_{\rm NN}}=5.02$ TeV with ALICE performing an ESE analysis based on the selection of events according to the magnitude of the so-called reduced flow vector will be presented. The D mesons are reconstructed via their hadronic decay channels at mid-rapidity in the centrality classes 10-30% and 30-50%. The ratios of the D-meson yields measured in events with large and small average elliptic flow will be shown as well.","{'_type': 'ContributionParticipation', '_fossil': 'contributionParticipationMetadata', 'first_name': 'Andrea', 'last_name': 'Festanti', 'fullName': 'Festanti, Andrea', 'id': '3513791', 'affiliation': 'CERN', 'emailHash': '18cdfaa58b9b0e724eb6928daef350f0', 'db_id': 3513791, 'person_id': 3640342}"
Poster Session,poster,Measurement of D+ -meson production in pp and p-Pb collisions with ALICE at the LHC,"Bala, Renu",University of Jammu (IN),India,"Heavy quarks (charm and beauty) are sensitive probes to study the properties of the Quark-Gluon Plasma (QGP) produced in high-energy heavy-ion collisions. Due to their large masses, charm and beauty quarks are produced in the initial stages of the collisions in hard-scattering processes and  they explore the entire evolution of the system
The measurement of charm production in pp collisions is important to test perturbative Quantum Chromodynamics (QCD) calculations and provides an essential baseline for the studies in heavy-ion collisions. Charm production measurements in p--Pb collisions allow us to disentangle the influence on particle production of cold nuclear matter effects from those related to the formation of a QGP in Pb--Pb collisions.
In ALICE, charm production is studied through the reconstruction of D-meson hadronic decays at midrapidity. In this contribution, we will present the measurement of the production cross section of D^{+} -mesons in pp collisions at $\sqrt{s}$ = 5.02, 7, 8 and 13 TeV with the ALICE detector. The D^{+} meson nuclear modification factor measured in p--Pb collisions at $\sqrt{s_{NN}}$ = 5.02 TeV will also be presented.","{'_type': 'ContributionParticipation', '_fossil': 'contributionParticipationMetadata', 'first_name': 'Renu', 'last_name': 'Bala', 'fullName': 'Bala, Renu', 'id': '3513790', 'affiliation': 'University of Jammu (IN)', 'emailHash': 'fafc14e52e7a9bb755c5bed038e613b7', 'db_id': 3513790, 'person_id': 3636330}"
Poster Session,poster,Influence of final-state radiation on heavy-flavour observables in pp collisions,"Vermunt, Luuk",Utrecht University (NL),Unknown,"Initial- and final-state radiation are important processes for the physical interpretation of high-energy collisions at the Large Hadron Collider. Calculations of these perturbative QCD corrections are, however, limited to probabilistic approximations using parton shower approaches in event generators. Although this Monte-Carlo DGLAP description is nowadays state-of-the-art, there still exist significant differences on the quantitative level. To address these open questions, it is important to investigate final-state radiation processes experimentally by identifying sensitive observables.

In this study, a new transverse momentum correlation observable, the momentum imbalance between D and Dbar mesons, is identified as a sensitive tool to study final-state radiation. This is shown by using simulations with the EPOS3+HQ model and the event generator Pythia 6. The presented results will focus on heavy-flavour particles only because these are most likely pair-produced in the initial stages of the collision. With the upcoming detector upgrades for LHC Run-3, statistically significant correlation measurements of these heavy-flavour particles will become feasible. In the end, this method can be extended to pA and AA data to study several aspects of energy loss in heavy-ion collisions.","{'_type': 'ContributionParticipation', '_fossil': 'contributionParticipationMetadata', 'first_name': 'Luuk', 'last_name': 'Vermunt', 'fullName': 'Vermunt, Luuk', 'id': '3513786', 'affiliation': 'Utrecht University (NL)', 'emailHash': '2426ecb9ade24c17b55c08681540a9b9', 'db_id': 3513786, 'person_id': 3642258}"
Poster Session,poster,Production of heavy-flavour hadron decay electrons in pp collisions at √s = 13 TeV as a function of charged-particle multiplicity with ALICE,"Acharya, Shreyasi",Variable Energy Cyclotron Centre (IN),Italy,"The study of heavy flavours in pp collisions as a function of the charged particle multiplicity gives an insight into the particle production mechanisms. Moreover, the multiplicity dependence of the heavy flavour yield in pp collisions is sensitive to the large amounts of gluon radiation and the contribution of Multiple Parton Interactions (MPI) in the collisions. 

In this contribution, we present the measurement of the yield of heavy-flavour hadron decay electrons at mid-rapidity ($|\eta| <$ 0.8) as a function of transverse momentum and charged particle multiplicity in pp collisions at $\sqrt{s} =$ 13 TeV. Electron identification is done within 0.5 $< p_\mathrm{T}<$ 4.5 GeV/$c$ with the Time Projection Chamber (TPC) and the Time of Flight (TOF) detectors of the ALICE apparatus. The measurement of electrons from heavy-flavour hadron decay is expressed in terms of the ratio of the yield in a particular multiplicity interval to the multiplicity integrated yield (self-normalized yield). The result is given as a function of the relative charged particle pseudorapidity density within $|\eta| <$ 1.","{'_type': 'ContributionParticipation', '_fossil': 'contributionParticipationMetadata', 'first_name': 'Shreyasi', 'last_name': 'Acharya', 'fullName': 'Acharya, Shreyasi', 'id': '3513777', 'affiliation': 'Variable Energy Cyclotron Centre (IN)', 'emailHash': 'b2d93f75f2942a2839049f75f8fe9292', 'db_id': 3513777, 'person_id': 3640443}"
Poster Session,poster,Measurement of low transverse momentum electrons from heavy-flavour hadron decays in Pb-Pb collisions at 5 TeV with ALICE,"Faggin, Mattia","Universita e INFN, Padova (IT)",Italy,"Due to their high masses ($m_{\text{c}}\approx 1.5\text{ GeV}/c^2$, $m_{\text{b}}\approx 4.8\text{ GeV}/c^2$), charm and beauty quarks are mostly produced in the initial hard scattering processes, happening immediately after the lead nuclei collide. This process has typical time scales shorter than the Quark-Gluon Plasma formation time, therefore by studying the kinematic properties of heavy-flavour particles, the medium can be investigated. In particular, it is important to understand how these quarks lose energy by traversing the medium and to test shadowing, hadronization and flow mechanisms. 

In this poster the status and progresses on the results concerning open heavy-flavour detection through semi-electronic decay channels in Pb-Pb collisions at the centre of mass energy per nucleon pair of $\sqrt{s_{\text{NN}}}=5.02\text{ TeV}$ registered by ALICE will be shown. Electrons are identified using the information provided by the central barrel detectors (Inner Tracking System, Time Projection Chamber, Time Of Flight). Most of the electrons come from background sources, such as photon conversions 
in the detector material and Dalitz decays of light mesons, 
which are tagged with an invariant mass technique. 
After their subtraction, the $p_{\text{T}}$ spectrum of electrons from heavy-flavour hadron decays 
in the transverse momentum region $0.5\text{ GeV}/c\leq p_{\text{T}}\leq 6\text{ GeV}/c$ can be obtained and the nuclear modification factor $R_{\text{AA}}$ can be computed.","{'_type': 'ContributionParticipation', '_fossil': 'contributionParticipationMetadata', 'first_name': 'Mattia', 'last_name': 'Faggin', 'fullName': 'Faggin, Mattia', 'id': '3513774', 'affiliation': 'Universita e INFN, Padova (IT)', 'emailHash': 'e35b2ddef3ed66a1dfe31f8aaca9a827', 'db_id': 3513774, 'person_id': 3641547}"
Poster Session,poster,Measurements of heavy-flavour production and study of heavy-flavour jets via electrons in heavy-ion collisions with ALICE,"Sakai, Shingo",University of Tsukuba (JP),UK,"In relativistic heavy-ion collisions, heavy quarks (charm and beauty) are ideal probes to investigate the properties of the hot and dense colour-deconfined QCD matter, so called Quark-Gluon-Plasma (QGP). Heavy quarks are produced in initial hard partonic interactions, and they propagate through the QGP.A strong suppression of heavy-flavour hadron production has been observed in the most central heavy-ion collisions with respect to the expectation from binary-scaled pp collisions at intermediate and high $p_{\rm{T}}$. This is ascribed to energy loss of heavy flavours via radiative and collisional processes in the dense matter. In addition, the positive $v_{2}$ (elliptic flow) observed at low $p_{\rm{T}}$ in semi-central heavy-ion collisions suggests that heavy quarks participate to the collective motion of the system. These results indicate strong interaction of heavy quarks in the medium. Further information of the interaction of heavy quarks in the QGP is obtained by measuring their production in different collisions energies. Measuring heavy-flavour jets allows for a more direct access to the initial parton kinematics and therefore provides an additional information on the energy loss and hadronisation of heavy quarks in the medium. The study of jets allows also to address the spatial distribution and kinematic properties of the radiative energy. 

In this poster, recent ALICE measurements of the $R_{\rm{AA}}$ of electrons from heavy-flavour hadron decays in Pb--Pb collisions at $\sqrt{s_{\rm{NN}}}$ = 5.02 TeV is shown. The result is compared with the $R_{\rm{AA}}$ measured at $\sqrt{s_{\rm{NN}}}$ = 2.76 TeV for discussing the energy dependence of the suppression and with theoretical predictions. In addition, we will present studies of heavy-flavour jets tagged with electrons from heavy-flavour hadron decays in p--Pb collisions, as an outlook for further study of QGP with heavy quarks.","{'_type': 'ContributionParticipation', '_fossil': 'contributionParticipationMetadata', 'first_name': 'Shingo', 'last_name': 'Sakai', 'fullName': 'Sakai, Shingo', 'id': '3513760', 'affiliation': 'University of Tsukuba (JP)', 'emailHash': 'db7ae66936fbd51e31851e7073600441', 'db_id': 3513760, 'person_id': 3643479}"
Poster Session,poster,Multiparticle femtoscopy with marginal distributions,"Bilandzic, Ante",Technische Universitaet Muenchen (DE),Unknown,"The usage of multiparticle correlation techniques for the study of genuine three-body and even higher-order interactions between hyperons and nucleons, which are relevant for instance for the description of equation of state of a neutron star, is plagued by difficulties in estimating consistently the background contribution to all terms (which are in general of different order) in the corresponding multiparticle cumulant expansion. In two-particle femtoscopy the background can be estimated with the mixed-event technique, but this approach appears to be impossible to reconcile with the standard cumulant formalism for the case of more than two particles. 

We demonstrate how the mixed-event technique can be replaced with marginal distributions, which unifies multiparticle femtoscopy with the standard cumulant formalism. We discuss in detail whether the resulting new formalism satisfies the standard physical requirements (frame-independence, invariance to projection onto a single relative momentum variable, etc.).","{'_type': 'ContributionParticipation', '_fossil': 'contributionParticipationMetadata', 'first_name': 'Ante', 'last_name': 'Bilandzic', 'fullName': 'Bilandzic, Ante', 'id': '3513694', 'affiliation': 'Technische Universitaet Muenchen (DE)', 'emailHash': '65e58f83f1ec1a2bc937d4fa18424a31', 'db_id': 3513694, 'person_id': 3643513}"
Poster Session,poster,Computation of the Berry curvature in lattice QCD,"Yamamoto, Arata",Unknown,Unknown,"The Berry curvature is a fundamental quantity to describe the chiral magnetic effect and chiral kinetic theory. While it can be analytically tractable in non-interacting systems, numerical simulations are necessary in interacting systems. We formulated the lattice simulation to calculate the Berry curvature in interacting systems. We present the first result in quenched lattice QCD.","{'_type': 'ContributionParticipation', '_fossil': 'contributionParticipationMetadata', 'first_name': 'Arata', 'last_name': 'Yamamoto', 'fullName': 'Yamamoto, Arata', 'id': '3513688', 'affiliation': '', 'emailHash': '19e8e58fc4b068de5ca6d2cd20e9c49b', 'db_id': 3513688, 'person_id': 3639209}"
Poster Session,poster,﻿Rivet as an Experiment-Theory Interface for the Heavy-Ion Community,"Karczmarczyk, Przemyslaw",Warsaw University of Technology (PL),Unknown,"The comparison of experimental data and theoretical predictions is crucial for our understanding of the mechanisms for particle production in hadron collisions at the LHC. The Rivet (Robust Independent Validation of Experiment and Theory) framework was developed to this purpose and is used as a generator-independent system for event generator validation and tuning. It provides a large set of experimental analysis algorithms together with the published data. Thus, Rivet allows a direct comparison of different generators and experimental data, as well as the preservation of the analysis algorithms used.

Originally developed for validation and tuning of models in high energy physics, Rivet does not fulfil the requirements of many of the heavy-ion analyses, which usually require calibration steps, comparisons of AA and pp collisions, and/or binning in global event observables. This contribution will show extensions made to the Rivet framework in order to adapt to the needs of the heavy-ion analyses. We will show a first prototype of the experiment-theory interface for the ALICE experiment, intended to be used by the whole heavy-ion community.","{'_type': 'ContributionParticipation', '_fossil': 'contributionParticipationMetadata', 'first_name': 'Przemyslaw', 'last_name': 'Karczmarczyk', 'fullName': 'Karczmarczyk, Przemyslaw', 'id': '3513687', 'affiliation': 'Warsaw University of Technology (PL)', 'emailHash': '4237cc9630d4eb8bb4ef474a04800168', 'db_id': 3513687, 'person_id': 3645062}"
Poster Session,poster,Measurement of Neutral Mesons and Direct Photons in pp collisions with the ALICE EMCal detector at the LHC,"Muhlheim, Daniel Michael",Westfaelische Wilhelms-Universitaet Muenster (DE),Germany,"ALICE has measured the invariant cross sections for the production of $\pi^{0}$ and $\eta$ mesons in proton-proton collisions at center of mass energies of $\sqrt{s}$ = 0.9 TeV, 2.76 TeV, 7 TeV and most recently 8 TeV. 
Neutral mesons are reconstructed via their two photon decay channels by means of an invariant mass analysis.
Photons are detected with three different systems; using the central barrel tracking detectors of ALICE in order to reconstruct photon conversions (PCM) and the two available calorimeters in the experiment, namely the Photon Spectrometer (PHOS) and the Electromagnetic Calorimeter (EMCal).
The reported measurements are carried out as well using a 'hybrid' system which reconstructs meson candidates by combining one EMCal photon with one PCM photon.
Thus, this 'hybrid' system serves as an important cross-check for the single measurements and additionally measures an almost independent set of meson candidates.
The EMCal is a sampling calorimeter with good acceptance and high reconstruction efficiency, enabling measurements of $\pi^{0}$ and $\eta$ mesons up to highest transverse momenta due to its excellent triggering capabilities.
In addition to these results on neutral meson production, the corresponding $\eta/\pi^0$-ratios will be shown to test scaling laws for particle production. 
All obtained results will be compared with different Monte Carlo generators as well as recent NLO pQCD predictions.

Based on the obtained results, inclusive direct photon measurements are being carried out, for which the most recent status will be presented.
A novel method using the 'hybrid' PCM-EMCal system is followed in addition to tag $\pi^{0}$ candidates and extract the direct photon signal, which will be shortly illustrated.","{'_type': 'ContributionParticipation', '_fossil': 'contributionParticipationMetadata', 'first_name': 'Daniel Michael', 'last_name': 'Muhlheim', 'fullName': 'Muhlheim, Daniel Michael', 'id': '3513651', 'affiliation': 'Westfaelische Wilhelms-Universitaet Muenster (DE)', 'emailHash': 'a559500e706ba5579c2379e7229e82bc', 'db_id': 3513651, 'person_id': 3638921}"
Poster Session,poster,Production of strange particles in jets and the underlying event in pp collisions at $\sqrt{s}=13$ TeV with ALICE at the LHC,"Cui, Pengyao",Central China Normal University  CCNU (CN),China,"The $p_{\rm T}$ dependence of the baryon-to-meson yield ratio in hadronic and nuclear collisions is sensitive to the collective expansion of the system, the partonic recombination into hadrons, the jet fragmentation and hadronization. In the region $2< p_{\rm T} < 6$ GeV/$c$, this ratio for inclusive yields is significantly enhanced at high multiplicity in small collision systems, such as pp and p-Pb collisions, relative to that at lower multiplicity. However, the origin of the enhancement still remains an open question.
In this contribution, we explore the connection between the baryon-to-meson ratio enhancement and jet production via the measurement of the $p_{\rm T}$-differential spectrum of strange and multi-strange particles (${\rm K}_{\rm S}^{0}$,  $\Lambda$ and $\Xi$) in pp collisions at $\sqrt{s}=13$ TeV, both inclusively and within energetic jets. The results will set new constraints on the particle production mechanisms in jets, and will provide new insight in the understanding of the origin of flow-like correlations observed in small systems.","{'_type': 'ContributionParticipation', '_fossil': 'contributionParticipationMetadata', 'first_name': 'Pengyao', 'last_name': 'Cui', 'fullName': 'Cui, Pengyao', 'id': '3513649', 'affiliation': 'Central China Normal University  CCNU (CN)', 'emailHash': 'fccb40cf2dc2684941c45128c544e2f2', 'db_id': 3513649, 'person_id': 3640646}"
Poster Session,poster,Corona effect in AA collisions at LHC and RHIC,"Pantuev, Vladislav","INR, RAS",Unknown,"Following our earlier finding based on RHIC data about the dominant jet production from nucleus corona region, we reconsider this effect in nucleus-nucleus collisions at LHC energy. Our hypothesis was based on the experimental data, which raised  the idea of a finite formation time for the produced medium.  At RHIC energy and in low density corona region this time reaches about 2~fm/c. In the center of interaction region it's about 0.7 fm/c. All observed high $p_t$ particles are produced in the corona region and have a chance to escape during this 2~fm/c. After that, the formed high density matter absorbs all jets. Following this hypothesis, the nuclear modification factor $R_{AA}$ should be independent on particle momentum and be flat versus $p_t$. At the same time, we can describe at RHIC the finite azimuthal anisotropy of high $p_t$ particles, $v_2$. A separate prediction held that,  at LHC energy, the formation time in the corona region should be two times smaller, about 1~fm/c.  New data at LHC show that $R_{AA}$ is not flat and is rising with $p_t$. We add to our original hypothesis an assumption that a fast parton  traversing the produced medium loses the fixed portion of its energy. A shift of about 7~GeV from the original power law $p^{-6}$ production cross section in $pp$  explains well all the observed  $R_{AA}$ dependencies at all centrality. The shift of about 7~GeV is also valid at RHIC energy, where  the cross section follows a power law with about $p^{-8}$  and this shift explains a very slow rise of $R_{AA}$ seen for neutral pions with $p_t$ above  15~GeV/c. We also show that the observed at LHC dependence  of $v_2$ at high $p_t$ and our previous predictions agree. It is very attractive to call this value of 7 GeV as a parton binding energy.","{'_type': 'ContributionParticipation', '_fossil': 'contributionParticipationMetadata', 'first_name': 'Vladislav', 'last_name': 'Pantuev', 'fullName': 'Pantuev, Vladislav', 'id': '3513640', 'affiliation': 'INR, RAS', 'emailHash': '5e1827442814e233bbbc6a8eaa4058ba', 'db_id': 3513640, 'person_id': 3643982}"
