Session,Type,Title,Speaker,Institute,Country,Abstract,Raw_Speaker_Data
Poster Session,poster,Forward instrumentation for the ALICE Upgrade: the Fast Interaction Trigger and the FoCal proposal,"Bearden, Ian Gardner",University of Copenhagen (DK),DK,"Two additions to the forward instrumentation of ALICE will be described: the new Fast Interaction Trigger (FIT) and the Forward Calorimeter (FoCal). The former will be installed during the Long Shutdown 2 (2019/2020), while the latter is proposed for Long Shutdown 3 (2024-2026).
 
The FIT detector provides a fast trigger, a precise collision time measurement for time-of-flight based particle identification, and will be the main ALICE luminometer. FIT will measure an unbiased multiplicity distribution in the forward direction needed for the determination of the centrality and of the event plane in heavy-ion collisions. FIT is composed of two Cherenkov detector arrays (T0+) with a time resolution in the 20-50 ps range and a large, sectored scintillator ring (V0+). The T0+ arrays surround the beam pipe on both sides of the IP at a distance of 82 cm on the side of the muon arm, and 330 cm on the opposite side. In total, FIT will produce 208 Cherenkov signals and 48 scintillator signals, respectively.
 
The main goal of the FoCal proposal is to measure forward ($3.5 < y < 5$) direct photons in pp, and p--Pb collisions to obtain unique experimental constraints on proton and nuclear PDFs in a new region of low $x$ ($10^{-5} - 10^{-6}$). In addition it provides measurements of neutral mesons, two particle correlations, and jets in p+p, p--Pb and (partially) in Pb--Pb. The direct photon measurement requires a new electromagnetic calorimeter with extremely high granularity. The design principle of the high-resolution SiW sandwich calorimeter will be presented and results from the ongoing R$\&$D program with test beams will be shown. The detector will be instrumented with Si-pad sensors with analog readout and a MAPS-based digital pixel readout. The test beam results include linearity and energy resolution measurement, but also three-dimensional shower distributions on the sub-millimeter scale and the corresponding excellent position resolution.","{'_type': 'ContributionParticipation', '_fossil': 'contributionParticipationMetadata', 'first_name': 'Ian Gardner', 'last_name': 'Bearden', 'fullName': 'Bearden, Ian Gardner', 'id': '3553810', 'affiliation': 'University of Copenhagen (DK)', 'emailHash': '73281c999b22d7ef2db9b9622dc842a9', 'db_id': 3553810, 'person_id': 3737701}"
Poster Session,poster,Measurements of D0 Production in p+Au and d+Au Collisions at √sNN = 200 GeV by the STAR Experiment,"Kramarik, Lukas",Czech Technical University (CZ),CZ,"Charm quarks possess large masses, and thus can serve as penetrating probes to study the intrinsic properties of the hot medium created in heavy-ion collisions. However, Cold Nuclear Matter (CNM) effects, such as the change in the parton distribution function between a free nucleon and a nucleus, also affect the charm quark production in nuclear collisions with respect to p+p collisions. These effects can be measured in small systems such as p+A and d+A collisions, where only the CNM effects are present. Furthermore, a sizable azimuthal anisotropy ($v_2$) has been observed in both nucleus-nucleus collisions and small-system collisions of high multiplicities. To better understand the origin of the flow-like signal in small-system collisions, it is important to study charm quark azimuthal anisotropy in these systems.

In this presentation, we will report on the first measurements of $\text{D}^{0}$ production in p+Au collisions, and the $\text{D}^{0}$ transverse momentum spectrum and $v_2$ with the Heavy Flavor Tracker in d+Au collisions, all at $\sqrt{s_{\text{NN}}}=200$ GeV. The nuclear modification factors of $\text{D}^{0}$ meson will be extracted to quantify the CNM effects, and a comparison will be made to those of electrons from open heavy flavor hadron decays in p+Au collisions. Different cuts on the pseudo-rapidity gap between $\text{D}^{0}$ candidates and tracks used for event plane reconstruction, as well as different techniques, such as event plane and two-particle correlation methods, will be explored to help understand different physics mechanisms contributing to the azimuthal anisotropy.","{'_type': 'ContributionParticipation', '_fossil': 'contributionParticipationMetadata', 'first_name': 'Lukas', 'last_name': 'Kramarik', 'fullName': 'Kramarik, Lukas', 'id': '3582449', 'affiliation': 'Czech Technical University (CZ)', 'emailHash': '470c252ce4d3978c795e157efd341239', 'db_id': 3582449, 'person_id': 3765372}"
Poster Session,poster,Impact of CMS dijets on EPPS16 nuclear PDFs with non-quadratic reweighting,"Paakkinen, Petja",University of Jyväskylä,Unknown,"The CMS measurement of the dijet pseudorapidity and transverse momentum distributions in pPb versus pp collisions at 5.02 TeV provides a direct constraint on nuclear gluon PDFs in a wide range of $x$ and $Q^2$ [CMS-PAS-HIN-16-003]. We report on the impact of these data on the EPPS16 nuclear PDFs [Eur.Phys.J. C77, 163]. For this, we have devised a non-quadratic extension of the Hessian PDF reweighting method [JHEP 1412, 100], which now more accurately reflects the impact of a dataset on PDFs. Based on the (preliminary) CMS data on the pPb/pp ratios of normalized dijet cross sections, we predict that the uncertainty in the nuclear gluon modification can be significantly reduced especially in the antishadowing region.","{'_type': 'ContributionParticipation', '_fossil': 'contributionParticipationMetadata', 'first_name': 'Petja', 'last_name': 'Paakkinen', 'fullName': 'Paakkinen, Petja', 'id': '3530831', 'affiliation': 'University of Jyväskylä', 'emailHash': '06a86c1dc75811a9f0713b885478db58', 'db_id': 3530831, 'person_id': 3641173}"
Poster Session,poster,Fast hydrodynamization with bulk viscosity,"Casalderrey Solana, Jorge",University of Oxford,UK,"Ever since the discovery of the quark-gluon plasma the understanding of its fas thermalization has been a topic of intense research.  We use the gauge/gravity duality to model the out-of-equilibrium first stage of a heavy ion collision through the collision of gravitational shockwaves in numerical relativity. This investigation of collisions of sheets of energy density in a non-conformal theory with a gravity dual is the first non-conformal holographic simulation of a heavy ion collision. We demonstrate new non-conformal physics that arises (as compared to the much simpler conformal case) such as a new plasma relaxation channel, the equilibration of the conformal symmetry breaking scalar condensate and the presence of a sizeable bulk viscosity. These ingredients are crucial to make contact of the fast hydrodynamization process of hot plasmas with real-world QCD deconfinement matter.","{'_type': 'ContributionParticipation', '_fossil': 'contributionParticipationMetadata', 'first_name': 'Jorge', 'last_name': 'Casalderrey Solana', 'fullName': 'Casalderrey Solana, Jorge', 'id': '3530834', 'affiliation': 'University of Oxford', 'emailHash': '25132a4548b475c091bcede6cdddf9c1', 'db_id': 3530834, 'person_id': 3640341}"
Poster Session,poster,Linearly polarized gluons and axial charge fluctuations in the Glasma,"Schlichting, Soeren",University of Washington,USA,"We calculate energy deposition and axial charge production from color flux tubes at early times in a heavy-ion collision. Based on analytic expressions for the space-time dependent fluctuations of the axial charge and energy density distributions in terms of the unpolarized and linearly polarized gluon distributions of the nuclei, we develop a phenomenological model for the initial state, which can be used as an input to anomalous hydrodynamic simulations. Besides fluctuations of the axial charge density, we also calculate fluctuations of the energy density and discuss how our results can be used to consistently include fluctuations of the energy density on sub-nucleonic scale into simple initial state models, such as for example the MC-Glauber model.","{'_type': 'ContributionParticipation', '_fossil': 'contributionParticipationMetadata', 'first_name': 'Soeren', 'last_name': 'Schlichting', 'fullName': 'Schlichting, Soeren', 'id': '3530841', 'affiliation': 'University of Washington', 'emailHash': '2df846371aa4de69b3cac2067b108d08', 'db_id': 3530841, 'person_id': 3639953}"
Poster Session,poster,Observation of the top quark in proton-nucleus collisions with the CMS experiment at the LHC,"Krintiras, Georgios",Universite Catholique de Louvain (UCL) (BE),UK,"The first observation of top quark production in proton-nucleus collisions is reported using proton-lead data collected by the CMS experiment at the CERN LHC at a nucleon-nucleon center-of-mass energy of $\sqrt{s_\text{NN}}$ = 8.16 TeV. The measurement is performed using events with exactly one isolated electron or muon candidate and at least four jets. The data sample corresponds to an integrated luminosity of 174 nb$^-1$ .The significance of the $t\bar{t}$ signal against the background-only hypothesis is above five standard deviations. The measured cross section is $\sigma($t\bar{t}$) = 45 \pm 8$ nb, consistent with predictions from perturbative quantum chromodynamics.","{'_type': 'ContributionParticipation', '_fossil': 'contributionParticipationMetadata', 'first_name': 'Georgios', 'last_name': 'Krintiras', 'fullName': 'Krintiras, Georgios', 'id': '3597705', 'affiliation': 'Universite Catholique de Louvain (UCL) (BE)', 'emailHash': 'f7eddf81697f6505e5b1015141380142', 'db_id': 3597705, 'person_id': 3781502}"
Poster Session,poster,Far-from-equilibrium dynamics near a critical point,"Critelli, Renato",University of Sao Paulo - Institute of Physics,Unknown,"We employ the AdS/CFT correspondence and numerical relativity techniques to investigate the far-from-equilibrium dynamics of a strongly coupled non-Abelian plasma with a critical point [1] in the temperature and chemical potential phase diagram. In the case of an out-of-equilibrium homogeneous medium [2], isotropization happens before the system thermalizes and the behavior of the pressure anisotropy changes qualitatively as the chemical potential is increased towards the critical point. These results are then generalized [3] to consider the case of an expanding plasma undergoing Bjorken flow in the vicinity of the critical point, which allows us to determine for the first time how the presence of a critical point affects the emergence of hydrodynamic behavior (hydrodynamization) in a strongly coupled plasma similar to the Quark-Gluon Plasma formed in the RHIC beam energy scan. The interplay between critical phenomena and non-equilibrium hydrodynamic attractor solutions in Bjorken flow [3] will be also discussed.

[1] S.I.Finazzo, R.Rougemont, M.Zaniboni, R.Critelli and J. Noronha, ""Critical behavior of non-hydrodynamic quasinormal modes in a strongly coupled plasma,"" **JHEP** **1701**, 137 (2017).

[2] R.Critelli, R. Rougemont and J. Noronha,""Homogeneous isotropization and equilibration of a strongly coupled plasma with a critical point,"" **JHEP 1712**, 029 (2017).

[3] R. Critelli, R. Rougemont and J. Noronha, to appear.","{'_type': 'ContributionParticipation', '_fossil': 'contributionParticipationMetadata', 'first_name': 'Renato', 'last_name': 'Critelli', 'fullName': 'Critelli, Renato', 'id': '3530855', 'affiliation': 'University of Sao Paulo - Institute of Physics', 'emailHash': '3648ee454d1695c206c16c6beeb7a0d9', 'db_id': 3530855, 'person_id': 3640553}"
Poster Session,poster,Dynamical Thermalization in the Quark-Meson Model,"Shen, Linda","Institute for Theoretical Physics, Heidelberg University",Unknown,"Understanding the early out-of-equilibrium dynamics of heavy-ion collisions (HIC) remains one
of the biggest theory challenges. So far, there are no first principle calculations for the equilibration
process of the quark gluon plasma and the dynamics close to the phase transition. In particular
describing the behavior close to the conjectured critical point, where critical slowing down leads
to off-equilibrium dynamics, poses difficulties.
Here we study the initial stages of a HIC using a low-energy effective theory of QCD, the
quark-meson model, in order to gain insight into the thermalization process. This model manifests
a central and physically relevant feature of QCD: chiral symmetry breaking in vacuum and its
restoration at finite temperature and density. At the critical endpoint this model is expected to
be in the same universality class as QCD and hence a viable model to explore dynamical critical
phenomena.
We solve the non-perturbative real-time quantum equations of motions for the quark and meson
fields in the two-particle irreducible effective action framework. Similar to a HIC, our system is
prepared in a high-energy initial state and suddenly quenched out of equilibrium, evolving towards
a thermal final state in the chirally broken phase.
In a first step, we investigate the time-evolution of both bulk and spectral properties of this
system, which provides us with insight into the approach of thermalization over time and the
properties of the relevant degrees of freedom dominating the real-time dynamics. For the thermal
final state, this implies information about the mass spectrum and the thermalization temperature.
Finally, the prospects of generalizing the simulations to finite baryon density and the approach to
the critical point are discussed.","{'_type': 'ContributionParticipation', '_fossil': 'contributionParticipationMetadata', 'first_name': 'Linda', 'last_name': 'Shen', 'fullName': 'Shen, Linda', 'id': '3530872', 'affiliation': 'Institute for Theoretical Physics, Heidelberg University', 'emailHash': 'e9bac60d51dd58ad2bd33259269e9a68', 'db_id': 3530872, 'person_id': 3644545}"
Poster Session,poster,Dynamical quenching weights in an expanding medium,"Adhya, Souvik Priyam",Department of Atomic Energy (IN),Unknown,"In this work, we extend the resummation of multiple medium-induced emissions to apply to dynamically expanding media. This is done by recasting the quenching weight as the solution of a rate equation with medium-induced partonic splitting functions that are sensitive to the expansion. We perform the calculations in the framework of Baier-Dokshitzer-Mueller-Peigne-Schiff-Zakharov (BDMPSZ) formalism for multiple soft scatterings with a time-dependent transport coefficient. Furthermore, we discuss the validity of a dynamical scaling law that relates the spectrum in an expanding medium to the equivalent static case with rescaled medium parameters [1] and test the size of energy loss fluctuations in a realistic medium.

References:
[1] Carlos A. Salgado and Urs Achim Wiedemann ""A Dynamical Scaling Law for Jet Tomography"", Phys. Rev. Lett. 89, 092303.","{'_type': 'ContributionParticipation', '_fossil': 'contributionParticipationMetadata', 'first_name': 'Souvik Priyam', 'last_name': 'Adhya', 'fullName': 'Adhya, Souvik Priyam', 'id': '3530885', 'affiliation': 'Department of Atomic Energy (IN)', 'emailHash': '0425552c68d9fe901e30a9b57b347bf7', 'db_id': 3530885, 'person_id': 3645181}"
Poster Session,poster,Jet energy loss in a flowing plasma,"van der Schee, Wilke",MIT,USA,"We present new results on the energy loss of light partons traversing a highly dynamical strongly coupled quark-gluon plasma. As QGP has large gradients in both temperature and the fluid velocity, it is crucial to study energy loss without assuming a homogeneous plasma, especially as it is known that energy loss depends on the plasma evolution in a non-local way. In a holographic description, we consider several subsequent improvements of the hydrodynamic background by keeping increasing orders in the gradient expansion. Already for varying temperature and velocity profiles and ideal hydrodynamics, the energy loss is considerably modified. However, this description is limited to very small gradients and it is hence necessary to include viscous corrections. We present a numerical analysis of jet energy loss in a boost-invariant and transversely-expanding droplet of QGP. We find that depending on the direction of the fluid flow, the velocity gradients can change the distance a parton can travel by a factor of two, which would correspond to changing the coupling constant by a factor of more than fifty.","{'_type': 'ContributionParticipation', '_fossil': 'contributionParticipationMetadata', 'first_name': 'Wilke', 'last_name': 'van der Schee', 'fullName': 'van der Schee, Wilke', 'id': '3530900', 'affiliation': 'MIT', 'emailHash': '66afd64e8cf68b02dbd409a401b873bf', 'db_id': 3530900, 'person_id': 3647316}"
Poster Session,poster,Interpreting jet quenching measurements and charmonia suppression,"Spousta, Martin",Charles University,Unknown,"Understanding the energy loss of partons traversing the strongly interacting matter created in heavy ion collisions is one of key goals of the heavy ion physics program. In this talk we present results of phenomenological analyses of various recent jet quenching data. The core of the model used in these analyses is based on the shift formalism which allows for an extraction of the magnitude of parton energy loss from the data with minimal assumptions on the underlying physics mechanisms. The model is capable of describing the full $p_{T}$, rapidity, and centrality dependence of the measured jet $R_{AA}$ using three effective parameters. The analysis done using this simple model can explain the shape of the modification of fragmentation functions observed in the data as well as the relation between the magnitude of the jet $R_{AA}$ and the $R_{AA}$ of charged particles. The analysis of recent data on  splitting functions and fragmentation functions allows for further constrains on the role of coherence effects in the parton energy loss. Further, the analysis of charmonia suppression using this model points to a remarkable similarity between the quenching of light-quark-initiated jets and the prompt charmonia suppression. In this talk, we also discuss possible explanations of intriguing features seen in the recently published dijet asymmetry measurement by ATLAS and differences in how fragmentation patterns are modified for inclusive jets compared to those in the gamma-jet system.","{'_type': 'ContributionParticipation', '_fossil': 'contributionParticipationMetadata', 'first_name': 'Martin', 'last_name': 'Spousta', 'fullName': 'Spousta, Martin', 'id': '3530913', 'affiliation': 'Charles University', 'emailHash': '5a941a99be92c66d16d5afd0a19d03d6', 'db_id': 3530913, 'person_id': 3645179}"
Poster Session,poster,Resolution Effects in the Hybrid Strong/Weak Coupling Model,"Hulcher, Zachary",Cambridge University,UK,"Within a hybrid strong/weak coupling model of jet quenching, plasma produced in a heavy ion collision cannot resolve the substructure of a collimated parton shower propagating through it with arbitrarily fine spatial resolution. We introduce a screening length parameter, $L_{res}$, proportional to the inverse of the local temperature in the plasma, estimating a range for the value of the proportionality constant via comparing weakly coupled QCD calculations and holographic calculations appropriate in strongly coupled plasma. When a parton in a jet splits, its two offspring are initially unresolved and suffer the energy loss of the original parton until they are separated by $L_{res}$. This delays the quenching of partons with intermediate energy, resulting in the survival of more hadrons in the final state with $p_T$ in the several GeV range. Introducing a nonzero $L_{res}$ results in modifications to the jet shapes and jet fragmentations functions, as it makes it more probable for particles carrying a small fraction of the jet energy at larger angles from the jet axis to survive their passage through the quark-gluon plasma. These effects are small in magnitude, which we confirm via checking for effects on missing-$p_T$ observables.","{'_type': 'ContributionParticipation', '_fossil': 'contributionParticipationMetadata', 'first_name': 'Zachary', 'last_name': 'Hulcher', 'fullName': 'Hulcher, Zachary', 'id': '3530917', 'affiliation': 'Cambridge University', 'emailHash': '6d3d0d97012a346ef520bcbc24a9ce80', 'db_id': 3530917, 'person_id': 3640339}"
Poster Session,poster,New Jet-quenching model for Heavy Ion Monte Carlo Generators,"Papp, Gábor",Eötvös University,Unknown,"The Gyulassy-Lévay-Vitev jet quenching [1] has been implemented for Monte Carlo particle event generators, especially for the HIJING$^{++}$[2]. With this new extension, one is able to perform calculations taking into account the geometry and opacity of the colliding nuclei. 

We analyzed the old and recent heavy ion data from RHIC to LHC in comparison of the opacity parameter values extracted in Ref [3]. We made predictions for the upcoming Xe+Xe collisions at $\sqrt{s}=5.44$ TeV energy in the HIJING$^{++}$ and kTpQCD_v20 frameworks.


References:
[1] M. Gyulassy, P. Lévai, I. Vitev, Phys.Lett. B538 (2002) 282-288
    and Nucl.Phys. B594 (2001) 371-419
[2] G.G. Barnaföldi et al. Nucl.Part.Phys.Proc. 289-290 (2017) 373
[3] J. Albacete et al, Int.J.Mod.Phys. E22 (2013) 1330007
[4] G.G. Barnaföldi et al Eur.Phys.J. C49 (2007) 333-338","{'_type': 'ContributionParticipation', '_fossil': 'contributionParticipationMetadata', 'first_name': 'Gábor', 'last_name': 'Papp', 'fullName': 'Papp, Gábor', 'id': '3530947', 'affiliation': 'Eötvös University', 'emailHash': '51092b60acb1fe8a2c9a2d6b79dddc89', 'db_id': 3530947, 'person_id': 3645368}"
Poster Session,poster,Pythia8 is ready for heavy-ion physics,"Shah, Harsh",Lund University,Unknown,"We have formulated a new model for collisions with nuclei, called Angantyr, which is now included in the Pythia8 event generator. The model is inspired by the old Fritiof model, but includes also effects of hard partonic interactions. It uses the Glauber model to calculate the number of wounded nucleons, but includes fluctuations in the NN interaction to separate absorbed and diffractively excited nucleons. The MC simulates final states without assuming a thermalized plasma. Hence, in this manner we are providing an event generator to be used to simulate events from pp to AA with the same underlying physics approach. Collective effects due to high string density are not included in the present version, but will be added in future work.","{'_type': 'ContributionParticipation', '_fossil': 'contributionParticipationMetadata', 'first_name': 'Harsh', 'last_name': 'Shah', 'fullName': 'Shah, Harsh', 'id': '3530975', 'affiliation': 'Lund University', 'emailHash': '7bf15b6455788ac4791a2f72d0a479b1', 'db_id': 3530975, 'person_id': 3646729}"
Poster Session,poster,Inverting the mass hierarchy of jet quenching with b-jet substructure,"Vitev, Ivan",Los Alamos National Laboratory,USA,"The two-prong substructure of the leading subjets inside a reconstructed jet opens new windows on precision constraints on the in-medium modification of parton showers. We present the first resumed calculation of the groomed soft-dropped subjet momentum sharing distribution in heavy ion collisions, and demonstrate that both the STAR data at RHIC and the CMS results at LHC can be understood in the unified framework of soft-collinear effective theory with Glauber gluon interactions. Recent advances in understanding mass effects on the QCD splitting functions enable us to apply this method for the first time to heavy flavor tagged jets, the main topic of this presentation. Theoretical predictions for the momentum sharing distribution modification of jets tagged by single and two in-jet heavy mesons will be presented. We find that in the kinematic region that will be accessed by sPHENIX in the future, or by studying jets of lower transverse momenta than currently explored at the LHC, there is a unique reversal of the mass hierarchy of jet quenching effects. Namely, the momentum sharing distribution of b-tagged jets is more strongly modified in comparison to the one for light jets. This unique feature provides a handle on mass corrections that are at present difficult to constraint using inclusive heavy meson production.","{'_type': 'ContributionParticipation', '_fossil': 'contributionParticipationMetadata', 'first_name': 'Ivan', 'last_name': 'Vitev', 'fullName': 'Vitev, Ivan', 'id': '3650121', 'affiliation': 'Los Alamos National Laboratory', 'emailHash': None, 'db_id': 3650121, 'person_id': 3634913}"
