Session,Type,Title,Speaker,Institute,Country,Abstract,Raw_Speaker_Data
Poster Session,poster,From Debye screening to regeneration and jet quenching: charmonium production in pp and PbPb collisions with the CMS detector,"Chapon, Émilien",CERN,Switzerland,"The understanding of charmonium production in PbPb collisions requires the inclusion of many phenomena such as dissociation in the QGP, partonic energy loss, statistical recombination, on top of cold nuclear matter effects (modifications of nPDFs, initial-state energy loss, nuclear break-up). In this talk, final results on prompt J/$\psi$ and $\psi(2S)$ production, based on the pp and PbPb data collected at 5.02 TeV by CMS in 2015, are reported. The prompt J/$\psi$ results in PbPb collisions, including the cross section and the nuclear modification factor R$_{\mathrm{AA}}$, are presented single- and double-differentially over a wide kinematic and centrality range ($3< p_T<50$ GeV /c, |y|<2.4, and fine event-centrality intervals). The results are compared to those obtained at 2.76 TeV over a similar kinematic range. Final prompt $\psi(2S)$ R$_{\mathrm{AA}}$ results at 5.02 TeV are also presented, showing a stronger suppression of the excited state as compared to the ground state in all measured bins. Finally, exploratory studies of jets containing J/$\psi$ mesons are shown.","{'_type': 'ContributionParticipation', '_fossil': 'contributionParticipationMetadata', 'first_name': 'Émilien', 'last_name': 'Chapon', 'fullName': 'Chapon, Émilien', 'id': '3586941', 'affiliation': 'CERN', 'emailHash': '3b079887dfa41b7b92831bbff9553fe0', 'db_id': 3586941, 'person_id': 3769731}"
Poster Session,poster,Transport coefficient of quark matter,"Harutyunyan, Arusyak",Unknown,Unknown,"The transport coefficients of quark matter at non-zero chemical potential and temperature are computed within the two-flavor Nambu--Jona-Lasinio model. We apply the Kubo formalism to obtain the thermal and electrical conductivities as well as the shear and bulk viscosity by evaluating the corresponding equilibrium two-point correlation functions to leading order in the 1/N_c expansion. The Dirac structure of the self-energies and spectral functions is taken into account as these are evaluated from the meson-exchange Fock diagrams for on-mass-shell quarks [1,2]. I will also discuss the same transport coefficients in dense color superconducting quark matter [3] on the basis of the Boltzmann equation. 

[1] Phys. Rev. D 95, 114021 (2017) 
[2] Phys. Rev. D 96, 034006 (2017)
[3] Phys. Rev. C 90, 055205 (2014)","{'_type': 'ContributionParticipation', '_fossil': 'contributionParticipationMetadata', 'first_name': 'Arusyak', 'last_name': 'Harutyunyan', 'fullName': 'Harutyunyan, Arusyak', 'id': '3530821', 'affiliation': '', 'emailHash': 'c2f2f4b4f7fa589a1cd4875cd088c184', 'db_id': 3530821, 'person_id': 3645666}"
Poster Session,poster,The curvature of the pseudocritical line from lattice QCD: Taylor expansion and Analytic continuation compared,"Negro, Francesco",INFN - Sezione di Pisa,Unknown,"The $T-\mu$ phase diagram of QCD is, both theoretically
and experimentally, still largely unknown.
On the theoretical side, lattice QCD is the only reliable
tool to investigate the region close to the $\mu=0$ axis.
I will present our determinations of the curvature of the chiral
pseudocritical line from $N_f=2+1$ lattice QCD at the physical point
as obtained by adopting different approaches.
I will directly compare the method of the analytic continuation
from imaginary chemical potential with the method of Taylor expansion.","{'_type': 'ContributionParticipation', '_fossil': 'contributionParticipationMetadata', 'first_name': 'Francesco', 'last_name': 'Negro', 'fullName': 'Negro, Francesco', 'id': '3531069', 'affiliation': 'INFN - Sezione di Pisa', 'emailHash': '580969d5111a1f699f483961e6ac6720', 'db_id': 3531069, 'person_id': 3647010}"
Poster Session,poster,Light and heavy flavor jet quenching at RHIC and the LHC energies,"Qin, Guang-You",Central China Normal University,Unknown,"The study of hard jets and their interactions with the traversed medium provides a very improtant tool to probe the quark-gluon plasma produced in relativistic heavy-ion collisions. In this work [1], we study both light and heavy flavor jet quenching on the same footing utilizing a Boltzmann transport model including both elastic and inelastic parton-medium interactions within perturbative QCD. The dynamical evolution of the QGP medium that hard jets probe is simulated with relativistic hydrodynamics that has been tuned to describe the soft hadron production at RHIC and the LHC. Our numerical results can simultaneously describe the experimental data on both light and heavy flavor hadron suppressions for different centralities at both RHIC and the LHC heavy-ion collisions. Detailed analysis show that the initial parton spectra, the details of the energy loss mechanism, and the shapes of fragmentation functions all play important role in understanding the difference between the nuclear modifications of light and heavy flavor hadrons. The temperature, flavor and energy dependences of the jet quenching parameter $\hat{q}$ are quantitatively extracted. We further study the correlations between light and heavy flavor hadrons.

[1] S. Cao, T. Luo, G.-Y. Qin, X.-N. Wang, arXiv:1703.00822, Phys.Lett. B, in press; arXiv:1605.06447, Phys.Rev. C94 (2016) no.1, 014909.","{'_type': 'ContributionParticipation', '_fossil': 'contributionParticipationMetadata', 'first_name': 'Guang-You', 'last_name': 'Qin', 'fullName': 'Qin, Guang-You', 'id': '3530932', 'affiliation': 'Central China Normal University', 'emailHash': '07d521d0766c2824bed3b66cdef7109a', 'db_id': 3530932, 'person_id': 3640647}"
Poster Session,poster,Divergence of the gradient and slow-roll expansions in Bjorken and Gubser flow,"Denicol, Gabriel",McGill University,Unknown,"Relativistic hydrodynamics has played a key role in our understanding of the novel properties of quark-gluon plasma. However, the validity of hydrodynamical models in describing the extreme conditions produced in heavy ion collisions has still not been properly justified theoretically. Even more, the gradient expansion, commonly used to derive hydrodynamics from microscopic theory, has been recently shown to diverge for conformal fluids or relativistic gases undergoing Bjorken flow [1,2], putting under question the definition of hydrodynamics itself. Alternative derivation of the hydrodynamic series have been proposed recently, such as the slow-roll expansion [1], and can be promising candidates to define hydrodynamics.

In this contribution, we present general analytical and semi-analytical solutions of the hydrodynamic attractor of Israel-Stewart theory [2] and kinetic theory for Bjorken and Gubser expanding fluids. We show that the gradient expansion diverges in both cases. For Israel-Stewart theory, we show for the first time that even the slow-roll expansion, a commonly used approach to characterize the attractor, diverges. Finally, we construct the slow-roll expansion for a general flow scenario and find the effective shear viscosity [3] and relaxation time that are able to describe a more general hydrodynamic regime. 

[1] M. P. Heller and M. Spalinski, ""Hydrodynamics Beyond the Gradient Expansion: Resurgence and Resummation,"" Phys. Rev. Lett.  115, no. 7, 072501 (2015).                       
[2] G. S. Denicol and J. Noronha, ""Analytical attractor and the divergence of the slow-roll expansion in relativistic hydrodynamics,'' arXiv:1711.01657 [nucl-th].                                       
[3] P. Romatschke, ""Relativistic Hydrodynamic Attractors with Broken Symmetries: Non-Conformal and Non-Homogeneous,'' arXiv:1710.03234 [hep-th].","{'_type': 'ContributionParticipation', '_fossil': 'contributionParticipationMetadata', 'first_name': 'Gabriel', 'last_name': 'Denicol', 'fullName': 'Denicol, Gabriel', 'id': '3530978', 'affiliation': 'McGill University', 'emailHash': 'c18223bf7c6c79f49ae9316ecea9dfbc', 'db_id': 3530978, 'person_id': 3643184}"
Poster Session,poster,PHENIX beam energy and centrality dependence of direct   photon emission in heavy ion collisions,"Drees, Axel",Stony Brook University,United States,"Direct photon measurements provide a unique tool to study the strongly
coupled QGP produced in heavy ion collisions and its evolution to hadron resonance matter. PHENIX has observed that a large number of direct photons are radiated during the evolution of the system created in Au+Au collision at 200 GeV, and that the photons are emitted with a large azimuthal anisotropy. The theoretical models of thermal radiation are qualitatively consistent with the data, but the simultaneous observation of large yield and flow strength are difficult to reconcile quantitatively.

In order to provide new insights, PHENIX is analyzing new data from 39, 62.4, 
and 200 GeV Au+Au collisions and from Cu+Cu collisions at 200 GeV. We find a new scaling behavior, the photon yield $dN^{\gamma}/d\eta$ is proportional to 
$(dN_{ch}/d\eta)^{\alpha}$. The scaling holds for beam energies measured at RHIC and LHC, for centrality selected samples, as well as for different collision systems. In this talk we will discuss these new results and their implications. We will also show updated results on direct photon yields and azimuthal anisotropies $v_2$ and $v_3$ from high statistics Au+Au data at 200 GeV.","{'_type': 'ContributionParticipation', '_fossil': 'contributionParticipationMetadata', 'first_name': 'Axel', 'last_name': 'Drees', 'fullName': 'Drees, Axel', 'id': '3658678', 'affiliation': '', 'emailHash': 'c37408438f63cc57fcdb78d1b0074558', 'db_id': 3658678, 'person_id': 3837542}"
Poster Session,poster,PHENIX results on collectivity in d+Au collisions from 200 to 19.6 GeV,"Shigaki, Kenta",Hiroshima University (JP),Japan,"Small system (p+p, p+A, d/He+A) collisions at RHIC and LHC exhibit interesting 
azimuthal anisotropies, with explanations varying from geometry coupled to final
state interactions to glasma diagrams to color recombination. The PHENIX 
experiment has extended many of these observables to even lower energies with the d+Au beam energy scan at 19.6, 39.0, 62.4, and 200 GeV.

We present results on $v_2$ anisotropies as a function of transverse momentum and pseudorapidity for various centrality selections. We also study multi-particle cumulants ($v_2\{2\}, v_2\{4\}, v_2\{6\})$ that provide additional information about flow, non-flow and event-by-event fluctuations.  We compare the results with calculations within the framework of viscous hydrodynamics and parton scattering models (with and without final state interactions). The results provide key evidence for collectivity from the lowest RHIC energies to the highest LHC energies.","{'_type': 'ContributionParticipation', '_fossil': 'contributionParticipationMetadata', 'first_name': 'Kenta', 'last_name': 'Shigaki', 'fullName': 'Shigaki, Kenta', 'id': '3552572', 'affiliation': 'Hiroshima University (JP)', 'emailHash': 'cefa3e4954125a6bdcf153763c19b7d0', 'db_id': 3552572, 'person_id': 3736371}"
Poster Session,poster,Azimuthal anisotropy of high $p_T$ hadrons via long-range two particle  correlations in d+Au and p+p collisions by PHENIX,"Fadem, Brett",Muhlenberg College,Unknown,"PHENIX measured two-particle angular correlations between high  $p_T$ ($2 < p_T
< 11 $ GeV/c) $\pi^{0}$ at midrapidity  $|\eta| < 0.3 $   and hadrons emitted at
forward $(3.1<\eta<3.9)$  or backward $(-3.7<\eta<-3.1)$ rapidity in 200 GeV 
p+p and d+Au collisions at $\sqrt{s_{NN}}$=200 GeV.  In the Au-going direction the azimuthal correlations of these particle pairs with this large rapidity gap exhibit a ridge-like structure.  This structure persists up to  $p_{T} \approx 6$ GeV/c and strongly depends on collision centrality. It is reminiscent of collective behavior in A+A collisions.  The ridge-like structure is absent in the d-going direction as well as in p+p collisions.

We present the final results of two particle correlations with a large rapidity
gap in 200 GeV d+Au and p+p collisions and discuss the physics implication of 
the results.","{'_type': 'ContributionParticipation', '_fossil': 'contributionParticipationMetadata', 'first_name': 'Brett', 'last_name': 'Fadem', 'fullName': 'Fadem, Brett', 'id': '3552573', 'affiliation': '', 'emailHash': '592ccc822ef3cff8bb884bbd74827b96', 'db_id': 3552573, 'person_id': 3736372}"
Poster Session,poster,Temperature dependence of SU(3)-gluodynamics bulk and shear viscosities within lattice simulation,"Astrakhantsev, Nikita",Unknown,Unknown,"This talk is devoted to the study of $SU(3)$-gluodynamics bulk and shear viscosities temperature dependence. We measured the correlation functions of the Energy-Momentum Tensor for a set of temperatures in the region $T/T_c \in [0.9, 1.5]$. To extract the values of bulk and shear viscosities from correlation functions we applied various parametrical and non-parametrical approaches which give consistent results. Observed temperature dependence agrees with the recent experimental data. We notice a peak of bulk viscosity in the vicinity of phase transition, as for shear viscosity, there is a slight rise with the temperature at $T > T_c$. The analysis of our data confirms that the quark-gluon plasma behaves as a strongly-interacting system.","{'_type': 'ContributionParticipation', '_fossil': 'contributionParticipationMetadata', 'first_name': 'Nikita', 'last_name': 'Astrakhantsev', 'fullName': 'Astrakhantsev, Nikita', 'id': '3531067', 'affiliation': '', 'emailHash': '9dcd16c0ed21111f2065994518c0bab3', 'db_id': 3531067, 'person_id': 3645206}"
Poster Session,poster,Relaxation Time for the Chiral Vortical Effect and Spin Polarization in Strongly Coupled Plasma,"Li , Shiyong",University of Illinois at Chicago,USA,"Anomalous transport phenomena arising from chiral anomaly such as the Chiral Magnetic Effect have recently attracted much attention. One such phenomenon, the Chiral Vortical Effect, that is an induced current along fluid vorticity, is somewhat special because it is related to chiral anomaly on one hand, while on the other hand its microscopic origin is the spin polarization of chiral quarks in the fluid vorticity, whose physics is more general and applicable even for massive spinful particles such as Lambda baryon. In theoretical understanding of recently measured Lambda polarization in off-central heavy-ion collisions at RHIC, it is vitally important to know the dynamical time scale of this spin polarization, that is, the relaxation time it takes to achieve the equilibrium with Lambda spins polarized in a finite fluid vorticity. Therefore, by studying the relaxation time of the Chiral Vortical Effect in massless chiral limit, we can get a useful proxy for this time scale for Lambda spin polarization.
We first derive the correct Kubo formula for the relaxation time of the Chiral Vortical Effect from the energy-momentum and current two point functions, pointing out that some of the previous claims for a zero relaxation time of the Chiral Vortical Effect is due to an incorrect identification of the Kubo formula for the relaxation time of the Chiral Vortical Effect. Using our Kubo formula, we compute the correct and finite relaxation time of the Chiral Vortical Effect for the first time in strongly coupled plasma using the AdS/CFT correspondence.","{'_type': 'ContributionParticipation', '_fossil': 'contributionParticipationMetadata', 'first_name': 'Shiyong', 'last_name': 'Li ', 'fullName': 'Li , Shiyong', 'id': '3545644', 'affiliation': 'University of Illinois at Chicago', 'emailHash': 'b005ffd278a81432b5f8fc854ef4a7a0', 'db_id': 3545644, 'person_id': 3639026}"
Poster Session,poster,An Experimental Handle on the Magnetic Field from Spectator Protons in A+A Collisions,"Huang, Huan Zhong","Key Laboratory for Nuclear Physics and Ion-Beam Applications (MOE) and Institute of Modern Physics, Fudan University, Shanghai, China, Department of Physics and Astronomy, University of California, Los Angeles, CA 90095, USA.",USA,"The chiral magnetic effect (CME) and the chiral magnetic wave (CMW) have been predicted to arise from the coupling of domains with quark chirality imbalances in the quark-gluon plasma (QGP) and the strong magnetic field produced by energetic spectator protons. Searches for these quark chirality effects in nucleus-nucleus collisions have been performed at RHIC and the LHC as major scientific goals. For example, the RHIC 2018 run will be devoted to the isobaric collisions of $^{96}$Ru+$^{96}$Ru and $^{96}$Zr+$^{96}$Zr at √s$_{NN}$ = 200 GeV, where one may expect an up-to-20% difference in the experimental observables related to the magnetic-field-induced effects. 
Current data indicate that the experimental sensitivity to the chirality effects also depends on the beam energy and the colliding system size, presumably owing to variations in the magnetic field and/or the size of the QGP droplets. Therefore, another venue to enhance the experimental sensitivity could be Au+Au collisions at lower beam energies. We will demonstrate with the AMPT simulations that the number of net protons (N$_{\mathrm{net-p}}$) at mid-rapidity is anti-correlated with the number of spectator protons, and hence provides an excellent handle on the magnetic field from spectator protons in Au+Au collisions at lower RHIC beam energies. Equipped with the event-shape engineering technique [1], the search for chirality effects by varying N$_{\mathrm{net-p}}$ in Au+Au collisions at lower energies (with √s$_{NN}$ still higher than 10 GeV) will complement the isobaric collision data. The future RHIC Beam Energy Scan II program will facilitate the application of our method and discern the true contribution due to the quark chirality effects.

[1] F. Wen et al., Chinese Phys C 42(1) (2018) 014001 [arXiv:1608.03205].","{'_type': 'ContributionParticipation', '_fossil': 'contributionParticipationMetadata', 'first_name': 'Huan Zhong', 'last_name': 'Huang', 'fullName': 'Huang, Huan Zhong', 'id': '3545664', 'affiliation': 'Key Laboratory for Nuclear Physics and Ion-Beam Applications (MOE) and Institute of Modern Physics, Fudan University, Shanghai, China, Department of Physics and Astronomy, University of California, Los Angeles, CA 90095, USA.', 'emailHash': '1539347a40431c08b66972c8d3227dc7', 'db_id': 3545664, 'person_id': 3642357}"
Poster Session,poster,Vorticity generation and  transmission to polarisation in heavy-ion collisions,"Sorin, Alexander",Joint Institute for  Nuclear Research (RU),UK,We systematically compare the different mechanisms of generation and transmission of vorticity to hyperons polarisation in heavy-ion collisions. The special attention is payed to anomalous mechanism. The transverse and longitudinal components of polarisation are considered. The effects of pionic superfluidity and the emerged quantized vortices is analyzed. The role of polarisation as a probe of properties of quark-gluon matter is studied. The energy dependence of polarisation in the various combination of vorticity generation and transmission mechanisms is addressed.,"{'_type': 'ContributionParticipation', '_fossil': 'contributionParticipationMetadata', 'first_name': 'Alexander', 'last_name': 'Sorin', 'fullName': 'Sorin, Alexander', 'id': '3545692', 'affiliation': 'Joint Institute for  Nuclear Research (RU)', 'emailHash': '2d50c91c9db0bdeaee26cb6e8012bbfb', 'db_id': 3545692, 'person_id': 3639237}"
Poster Session,poster,Thermal fluctuations in relativistic heavy-ion collisions,"Pal, Subrata","Tata Institute of Fundamental Research, Mumbai, India",Unknown,"Fluctuation-dissipation theorem indicates the presence of hydrodynamic (local thermal) fluctuations in otherwise deterministic theory of viscous hydrodynamics. We have formulated a general theory of thermal fluctuations within causal second-order viscous hydrodynamic evolution of matter formed in relativistic heavy ion collisions. The fluctuation is treated perturbatively on top of boost-invariant longitudinal expansion [(0+1)-dim] as well as for realistic (1+1)-dim expansion. A numerical model simulation was developed for hydrodynamic evolution in (1+1)-dim which was tested to reproduce the analytic results for the Riemann solutions of expansion of matter in vacuum at early times, and the Landau-Khalatnikov wave propagation inside the medium for later times. Numerical simulation of thermal noise is performed for various second-order dissipative evolution equations using lattice QCD equation of state. Phenomenological effects of thermal fluctuations for the two-particle rapidity correlations showed that viscous damping of the correlation is at most ~20%.Further, significant damping was found at small rapidity separations when second-order dissipative hydrodynamics was employed instead of first-order Navier-Stokes theory. As compared to the conformal equation of state, the softer lattice QCD EOS causes reduced propagation of the fluctuations and leads to a pronounced peak in 
the rapidity correlations. In contrast to Bjorken flow, enhanced velocity gradients at large rapidities induce quite large fluctuations and thereby larger rapidity correlations.","{'_type': 'ContributionParticipation', '_fossil': 'contributionParticipationMetadata', 'first_name': 'Subrata', 'last_name': 'Pal', 'fullName': 'Pal, Subrata', 'id': '3545770', 'affiliation': 'Tata Institute of Fundamental Research, Mumbai, India', 'emailHash': '44dc31326acd7d7e9e7644e2895876f9', 'db_id': 3545770, 'person_id': 3633450}"
Poster Session,poster,Soft-gluon approximation in calculating radiative energy loss of high $p_T$ particles - is it well-founded?,"Blagojevic, Bojana","Institute of Physics Belgrade, University of Belgrade",Unknown,"The soft-gluon approximation, which implies that radiated gluon carries away a small fraction of initial parton's energy, is a commonly used assumption in calculating radiative energy loss of high momentum partons traversing the dense QCD medium, created in ultra-relativistic heavy ion collisions at RHIC and LHC. While soft-gluon approximation is convenient, doubts have been raised over its validity, especially since different theoretical approaches reported significant radiative energy loss of high $p_T$ partons, which implies that this approximation is not applicable in such calculations.

To address this issue, we relaxed the soft-gluon approximation within DGLV formalism [1], and discuss generalizing this relaxation in the dynamical QCD medium. Although the obtained results are quite distinct compared to the soft-gluon case, numerically both cases lead to nearly overlapping predictions for the first order in opacity fractional energy loss. The fractional number of radiated gluons is also barely affected. The effect on these two variables runs in opposite directions, which when combined results in negligible suppression change. Therefore, we unexpectedly conclude that soft-gluon approximation works surprisingly well in energy loss calculations, and that there is no need to go beyond the soft-gluon approximation in energy loss based models of parton suppression.

[1] B. Blagojevic, M. Djordjevic and M. Djordjevic, to be submitted (2017).","{'_type': 'ContributionParticipation', '_fossil': 'contributionParticipationMetadata', 'first_name': 'Bojana', 'last_name': 'Blagojevic', 'fullName': 'Blagojevic, Bojana', 'id': '3545849', 'affiliation': 'Institute of Physics Belgrade, University of Belgrade', 'emailHash': '9858e8d1f6ee7b9d22b8329425b2a92c', 'db_id': 3545849, 'person_id': 3642285}"
