Session,Type,Title,Speaker,Institute,Country,Abstract,Raw_Speaker_Data
Poster Session,poster,Bjorken expansion with gradual freeze out via HBT,"Borrell Martinez, Marc",Unknown,Unknown,"For Bjorken models with gradual freeze out, the resulting post freeze out momentum distribution practically does not depend on the layer thickness. Using such a model we calculate the pion correlation function produced in Pb+ Pb central collisions The correlation function is in qualitative agreement with other publications but our model allows us to perform a more detailed study of how this affects the final observables. We also find a good agreement with experimental data from ALICE and we deduce that long freeze out averaged correlation functions are more similar to experimental data than sharp freeze out.","{'_type': 'ContributionParticipation', '_fossil': 'contributionParticipationMetadata', 'first_name': 'Marc', 'last_name': 'Borrell Martinez', 'fullName': 'Borrell Martinez, Marc', 'id': '3513408', 'affiliation': '', 'emailHash': 'abfefabb288b1acf08e4e437c3224995', 'db_id': 3513408, 'person_id': 3644588}"
Poster Session,poster,The Azimuthal Angle Dependence of Lambda (anti-Lambda) Polarization in Au+Au Collisions from STAR,"Tu, Biao",Central China Normal University and Brookhaven National Laboratory,USA,"The STAR experiment at RHIC has observed for the first time a significant alignment between the angular momentum of the medium produced in non-central collisions [1] and the spin of $\Lambda$($\overline{\Lambda}$) hyperons ($J$$=$1/2), revealing that the matter produced in heavy-ion collisions is by far the most vortical system ever observed. Such vorticity is expected to be maximal at the equator, and due to the low viscosity of the system, the vorticity may not be propagated efficiently to the poles. This may lead to a larger in-plane than out-of-plane polarization for $\Lambda$ hyperons.

In this poster, we will present the azimuthal angle (with respect to the reaction plane) dependence of $\Lambda$ and $\overline{\Lambda}$ polarization in 20-50% central Au+Au collisions at $\sqrt{s_{NN}}$ = 200 GeV. The implications of our results will be discussed.

Reference
[1] L. Adamczyk et al. (STAR Collaboration), Nature 548, 62 (2017).","{'_type': 'ContributionParticipation', '_fossil': 'contributionParticipationMetadata', 'first_name': 'Biao', 'last_name': 'Tu', 'fullName': 'Tu, Biao', 'id': '3592129', 'affiliation': 'Central China Normal University and Brookhaven National Laboratory', 'emailHash': '9dd716170278c94cfcc5e3b71287d62c', 'db_id': 3592129, 'person_id': 3775556}"
Poster Session,poster,Jet reconstruction and measurements of jet substructure in heavy ion collisions with CMS,"Lee, Yen-Jie",Massachusetts Inst. of Technology (US),USA,"Measurements of jet substructure are useful tools for the understanding of the mechanism of jet quenching. Using those multi-scale probes, the results of jet fragmentation functions, jet shape and jet spectra could be used to search for possible medium response and to quantify the properties of the Quark-Gluon Plasma within the theoretical models. In this poster, jet reconstruction, background subtraction, and jet substructure extraction methods used in CMS analyses are presented. The results are compared to theoretical model calculations and implications from various jet substructure measurements using electroweak bosons, hadrons and jets are also summarized.","{'_type': 'ContributionParticipation', '_fossil': 'contributionParticipationMetadata', 'first_name': 'Yen-Jie', 'last_name': 'Lee', 'fullName': 'Lee, Yen-Jie', 'id': '3586946', 'affiliation': 'Massachusetts Inst. of Technology (US)', 'emailHash': '8037f2f5eb66457d78bbe8b4f5515d4d', 'db_id': 3586946, 'person_id': 3642930}"
Poster Session,poster,Factorization of two-particle probability distributions in  Pb--Pb collisions at $\sqrt{s_{NN}} = 5.02$ TeV with ALICE,"Bourjau, Christian",University of Copenhagen (DK),DK,"The flow coefficients $v_n$ are commonly extracted from multi-particle distributions where the properties of one or several particles are averaged over a large range in pseudorapidity $\eta$ or transverse momentum $p_{\text{T}}$.
  Such approaches assume that the observed multi-particle distributions can be factorized into a product of single-particle distributions.
  However, it is known that this condition is violated even in ideal hydrodynamics due to initial state fluctuations or the presence of non-flow.
  Detailed studies of a possible violation of this factorization assumption can therefore be used to constrain the size of such fluctuations as well as to identify possible non-flow contributions.
  A factorization breakdown can be measured directly in multi-particle probability distributions.
  This poster presents an explicit approach to the $\eta$-dependent factorization of two-particle probability distributions within $-3.4 \leq \eta \leq 5$ in the latest $\sqrt{s_{NN}} = 5.02$ TeV Pb--Pb data measured with ALICE.
  A factorizing phase-space region is identified by varying the minimal $\Delta\eta$ separation between particles; the factorization breakdown for small separations is attributed to non-flow and detector effects.
  The analysis yields the well known $v_n$ coefficients as the result of the factorization process.
  These flow coefficients are compared to similar results measured with the Q-cumulant method.
  All findings are also compared to model calculations and previous studies at $\sqrt{s_{NN}} = 2.76$ TeV.","{'_type': 'ContributionParticipation', '_fossil': 'contributionParticipationMetadata', 'first_name': 'Christian', 'last_name': 'Bourjau', 'fullName': 'Bourjau, Christian', 'id': '3513399', 'affiliation': 'University of Copenhagen (DK)', 'emailHash': 'de946d1d58a6c747e0f614ba412913ba', 'db_id': 3513399, 'person_id': 3644285}"
Poster Session,poster,Higher harmonics and flow at FAIR energies,"Argintaru, Danut","Constanta Maritime University, Romania",Unknown,"In this presentation we make comparisons between hydrodynamic behavior in UrQMD/CASCADE [1], UrQMD/HYDRO, AMPT and Chaos Many-Body Engine [2]  Au+Au simulated events at CBM-FAIR energies. We analyze the properties of different flow streams classes [1] and of the Fourier coefficients in the mentioned interaction models as a function of incident energy, rapidity and impact parameter.
[1] Danut Argintaru, Calin Besliu, Alexandru Jipa, Tiberiu Esanu, Valerica Baban, Madalin Cherciu, and Valeriu Grossu, Flow shapes and higher harmonics in anisotropic transverse collective flow, Eur. Phys. J. A (2017) 53: 6;
[2] I.V. Grossu, C.Besliu, D.Felea, , Al.Jipa, High precision framework for Chaos Many-Body Engine, March 2013 Computer Physics Communications 185(4)","{'_type': 'ContributionParticipation', '_fossil': 'contributionParticipationMetadata', 'first_name': 'Danut', 'last_name': 'Argintaru', 'fullName': 'Argintaru, Danut', 'id': '3513415', 'affiliation': 'Constanta Maritime University, Romania', 'emailHash': '15da2c97df4f5f16a687dad40f5e28f9', 'db_id': 3513415, 'person_id': 3643037}"
Poster Session,poster,D^{0}-meson Elliptic Flow Measurement in Au+Au Collisions at $\sqrt{s_{NN}}$ = 200 GeV from STAR,"Liang, Yue",Kent State Univesrsity & Lawrence Berkeley National Laboratory ,USA,"A recent result from the STAR experiment shows that in 10-40% central Au+Au collisions at the top RHIC energy the elliptic flow ($v_2$) of the $D^0$-meson follows the Number-of-Constituent-Quark scaling in the same way as it does for light flavor hadrons. This suggests that charm quarks have gained sufficiently large collectivity through their interactions with the Quark-Gluon Plasma (QGP). It is of great interest to see whether this scaling holds in more peripheral collisions, which will shed more lights on how charm quarks interact with the QGP and gain collectivity.

In this poster, we present the centrality and transverse momentum dependences of the $D^0$-meson $v_{2}$ measured in Au+Au collisions at $\sqrt{s_{\mathrm{NN}}}$ = 200 GeV by the STAR experiment. The measurement is based on the combined datasets recorded in 2014 and 2016, which yield about a factor of 3 times of the statistics compared to the previously published results. In order to better understand the non-flow contribution in peripheral collisions, the azimuthal anisotropy parameter $v_{2}$ is measured as a function of the pseudo-rapidity gap between the $D^0$-meson and tracks used for reconstructing the event plane. The results will be compared to those of light hadrons in various centrality intervals and physics implications will be discussed.","{'_type': 'ContributionParticipation', '_fossil': 'contributionParticipationMetadata', 'first_name': 'Yue', 'last_name': 'Liang', 'fullName': 'Liang, Yue', 'id': '3597219', 'affiliation': 'Kent State Univesrsity & Lawrence Berkeley National Laboratory ', 'emailHash': '690d6342aee2760306d6684f8015d4fa', 'db_id': 3597219, 'person_id': 3780986}"
Poster Session,poster,PHENIX measurements of charged hadron and heavy flavor v2 at forward/backward rapidity in d+Au collisions at sqrt{s}=200 GeV,"McGlinchey, Darren",Los Alamos National Laboratory,USA,Recent measurements at both RHIC and the LHC continue to indicate that particles produced in small collision systems exhibit collective behavior similar to those observed in large collision systems. The PHENIX experiment has measured substantial elliptic ($v_2$) flow coefficients for charged hadrons at midrapidity in a suite of small collision systems over a range of collision energies. We extend these results with new measurements of charged hadron $v_2(p_T)$ at forward and backward rapidities in $d+$Au collisions at $\sqrt{s_{_{NN}}}=200$ GeV in order to better constrain the rapidity extent of these correlations. To further investigate the origins of these correlations we also present the status of the $v_2$ of heavy flavor decay muons at forward and backward rapidities in the same collision system.​,"{'_type': 'ContributionParticipation', '_fossil': 'contributionParticipationMetadata', 'first_name': 'Darren', 'last_name': 'McGlinchey', 'fullName': 'McGlinchey, Darren', 'id': '3513437', 'affiliation': 'Los Alamos National Laboratory', 'emailHash': '99c3bc2dab98d31c6f9e86847c934152', 'db_id': 3513437, 'person_id': 3646733}"
Poster Session,poster,Predictions for  event-by-event flow harmonic distributions at RHIC,"Barbosa, Leonardo",Instituto de Física da Universidade de São Paulo,Unknown,"Hydrodynamical models must be able to reproduce data not only in average for a given centrality class but for each event. In particular they must reproduce the scaled $v_n$ distributions obtained by ATLAS [1,2] and ALICE [3]. These distributions are independent of medium properties such as viscosity, and so directly probe the initial conditions.  

They in fact provide a strong test for initial condition models:  many models   (e.g. Glauber and MC-KLN) can be ruled out and so far only two models  lead to satisfactory results [4,5]. In this work, we show that NeXus initial conditions also provide reasonable results for scaled $v_n$ distributions at LHC energies and make predictions for RHIC top energy.

References: 
[1] ATLAS Collaboration Nucl. Phys. A 904-905 421c (2013)
[2] ATLAS Collaboration JHEP 1311 183 (2013)
[3] ALICE Collaboration J. Phys. Conf. Ser. 446 012031 (2013)
[4] C. Gale, S. Jeon, B. Schenke, P. Tribedy, and R. Venugopalan, Phys. Rev. Lett. 110, 012302 (2013),
[5] H. Niemi, K. J. Eskola, and R. Paatelainen, Phys. Rev. C 93, 024907 (2016)","{'_type': 'ContributionParticipation', '_fossil': 'contributionParticipationMetadata', 'first_name': 'Leonardo', 'last_name': 'Barbosa', 'fullName': 'Barbosa, Leonardo', 'id': '3513431', 'affiliation': 'Instituto de Física da Universidade de São Paulo', 'emailHash': '6338e9ce1e1e7095b9f717bdced71f27', 'db_id': 3513431, 'person_id': 3647465}"
Poster Session,poster,Pseudorapidity dependence of anisotropic flow in Pb-Pb collisions measured with ALICE,"Thoresen, Freja",The Niels Bohr Institute,DK,"Anisotropic flow coefficients $v_n$ are used to study the properties of the quark-gluon plasma created in heavy-ion collisions. 
In this poster we will present $v_n$ measured for a wide range of pseudorapidity -$3.4 < \eta < 5$ in Pb-Pb collisions at $\sqrt{s_{NN}} = 5.02$ TeV. 
 
These new results will be compared to measurements at lower energies as well as model calculations. The presented results help to constrain the longitudinal profile of the initial conditions and the parameters of the 3D hydrodynamical modelling of relativistic heavy-ion collisions.","{'_type': 'ContributionParticipation', '_fossil': 'contributionParticipationMetadata', 'first_name': 'Freja', 'last_name': 'Thoresen', 'fullName': 'Thoresen, Freja', 'id': '3513436', 'affiliation': 'The Niels Bohr Institute', 'emailHash': 'cddd7a575dc8da2e3e71863157467799', 'db_id': 3513436, 'person_id': 3641247}"
Poster Session,poster,Multiplicity dependence of strangeness production in proton-proton collisions at $\sqrt{s}$ = 5.02 TeV with ALICE at the LHC,"Tropp, Lukas",Pavol Jozef Safarik University,Unknown,"Recent measurements performed in high-multiplicity proton-proton and proton-lead collisions at the LHC have shown features that are reminiscent of those observed in lead-lead collisions. Results on (multi-)strange hadron production in proton-proton collisions at $\sqrt{s}$= 5.02 TeV will be shown, based on the analysis of a data sample collected in 2015 with the ALICE detector. This sample is complemented by a large sample of minimum bias triggered events collected at the end of 2017. The first results on (multi)strange production in this collision system constitute an important reference for measurements in lead-lead collisions at the same energy.","{'_type': 'ContributionParticipation', '_fossil': 'contributionParticipationMetadata', 'first_name': 'Lukas', 'last_name': 'Tropp', 'fullName': 'Tropp, Lukas', 'id': '3513441', 'affiliation': 'Pavol Jozef Safarik University', 'emailHash': 'b0984da3a892fd26c8ba818e2f5c8eee', 'db_id': 3513441, 'person_id': 3641343}"
Poster Session,poster,Measurement of (anti-)$^{3}\mathrm{He}$ production in p--Pb collisions and of (anti-)$^{3}\mathrm{He}$ elliptic flow in Pb--Pb collisions with ALICE at the LHC,"Calivà, Alberto",GSI,Germany,"The formation of light nuclei and their antiparticles in high-energy hadronic and heavy-ion collisions can be described by two phenomenological models: the statistical hadronization model and the coalescence approach. The former assumes that light nuclei, as well as other hadrons, are produced thermally at the phase boundary in heavy-ion collisions, while the latter describes the light nuclei formation as the result of coalescence of nucleons which are close in the phase space.
\newline \indent
In this poster, results on the production yields of (anti-)$^{3}\mathrm{He}$ in p--Pb collisions at $\sqrt{s_{\mathrm{NN}}}$ =  5.02 TeV and elliptic flow measured in Pb--Pb collisions at $\sqrt{s_{\mathrm{NN}}}$ = 2.76 and $\sqrt{s_{\mathrm{NN}}}$ =  5.02 TeV for different centrality classes are presented.
\newline \indent
The attempt is to provide additional constraints to the coalescence model, thus contributing to an improved understanding of the process of formation of light nuclei in high-energy collisions. Integral part of this effort is the comparison of results in different collision systems such as p--Pb and Pb--Pb. 
The measurement of the elliptic flow of (anti-)$^{3}\mathrm{He}$ in Pb--Pb collisions complements the picture obtained from the elliptic flow measurements of (anti-)protons and (anti-)deuterons.","{'_type': 'ContributionParticipation', '_fossil': 'contributionParticipationMetadata', 'first_name': 'Alberto', 'last_name': 'Calivà', 'fullName': 'Calivà, Alberto', 'id': '3513440', 'affiliation': 'GSI', 'emailHash': 'f3ff60b9d3fc9ff277f1c207d67deb58', 'db_id': 3513440, 'person_id': 3642336}"
Poster Session,poster,Strange and multi-strange particle production in pp collisions at √s = 13 TeV with ALICE at the LHC,"Kalinak, Peter",Slovak Academy of Sciences (SK),SK,"Strangeness production plays a crucial role in the understanding of the formation and the evolution of a fireball created in heavy-ion collisions. To better understand the effects of the collectivity and their interplay with the particle production mechanisms it is also necessary to study pp and p–Pb collisions. We report the measurements of the production of KS0 mesons and Λ, Ξ and Ω hyperons with the ALICE detector at the LHC energy √s = 13 TeV for minimum bias pp collisions. The results include Λ∕KS0 spectra ratio, pT-differential yields, ⟨pT⟩ and particle yield ratios compared to the measurements at lower energies. The results showcase the excellent tracking capabilities of the ALICE detector and of the particle identification methods using the topology of weakly decaying hadrons and serve as the support for the multiplicity dependent measurements.","{'_type': 'ContributionParticipation', '_fossil': 'contributionParticipationMetadata', 'first_name': 'Peter', 'last_name': 'Kalinak', 'fullName': 'Kalinak, Peter', 'id': '3513442', 'affiliation': 'Slovak Academy of Sciences (SK)', 'emailHash': 'c17616aad59e9f770dce76a08710f960', 'db_id': 3513442, 'person_id': 3645266}"
Poster Session,poster,PHENIX measurements of elliptic and triangular flow in $d$+Au collisions,"Greene, Victoria",Vanderbilt University (US),USA,"Results on azimuthal anisotropies in the particle production from $p+p$ and $p/d/^{3}$He+A at LHC and RHIC have raised the question of how small a system can be while still exhibiting collective behavior. In 2016, RHIC operations included $d$+Au collisions at $\sqrt{s_{NN}}=$ 200, 62.4, 39, and 19.6 GeV. In this poster we present results on elliptic and triangular flow at midrapidity as a function of transverse momentum in $d$+Au collisions. We compare these results with several theoretical predictions in scenarios including viscous hydrodynamic flow, partonic scattering, and purely hadronic scattering in order to assess the origin of collectivity in the smallest systems.","{'_type': 'ContributionParticipation', '_fossil': 'contributionParticipationMetadata', 'first_name': 'Victoria', 'last_name': 'Greene', 'fullName': 'Greene, Victoria', 'id': '3552576', 'affiliation': 'Vanderbilt University (US)', 'emailHash': '4521a3617647ad45ee10a9b6d37f76f4', 'db_id': 3552576, 'person_id': 3736374}"
Poster Session,poster,Measurement of the underlying event in the presence of high pileup at  ATLAS,"Milov, Alexander",Weizmann Institute of Science (IL),Unknown,"In meaurements of bulk charged-particle production, the kinematic characteristics of  produced hadrons and correlation between them in the presence of the hard scattering signatures is a very interesting topic for understanding the physics processes relevant in small collision systems. Extensive data samples  have been accumulated by the LHC experiments experiments to conduct these studies in $pp$ collisions. These measurements, however, are complicated by the presence of many pileup vertices in each bunch crossing which contaminate direct studies of the characteristics of the underlying event. This problem is addressed in the ATLAS detector using an event mixing technique which allows to correct for the presence of the pileup on a statistical basis. The implementation, result and limitations of the techniques are presented in this poster. The results use $\sqrt{s} = 8$ and 13 TeV data samples with a combined integrated luminosity exceeding 50 fb$^{-1}$.","{'_type': 'ContributionParticipation', '_fossil': 'contributionParticipationMetadata', 'first_name': 'Alexander', 'last_name': 'Milov', 'fullName': 'Milov, Alexander', 'id': '3524969', 'affiliation': 'Weizmann Institute of Science (IL)', 'emailHash': 'dabec4a547e4b7726bba1e938754840e', 'db_id': 3524969, 'person_id': 3712472}"
Poster Session,poster,Femtoscopy with identified charged pions in $p$+Pb collisions at $\sqrt{s_{NN}}=5.02$ TeV with the ATLAS detector,"Cole, Brian",Columbia University (US),USA,"Hanbury Brown and Twiss (HBT) radii are measured as a function of centrality, transverse momentum, rapidity, and azimuthal angle with respect to the second-order event plane in central $p$+Pb collisions at $\sqrt{s_{NN}} = 5.02$ TeV with the ATLAS detector at the LHC. A total integrated luminosity of 28 nb$^{-1}$ is sampled. The radii are presented as a function of the local density dN/dy$^\star$ and the rapidity-dependence is shown to depend directly on the density. The radii and their relative azimuthal modulation are presented as a function of the magnitude of the flow vector $|q_2|$ measured in the ATLAS calorimeters in the lead-going direction, with pseudorapidity $\eta<-2.5$. Modulations of the transverse HBT radii are observed with the same orientation as in ion--ion collisions, in which they are attributed to hydrodynamic evolution from an elliptic initial geometry. This modulation is consistent with a hydrodynamic evolution of a short-lived medium.","{'_type': 'ContributionParticipation', '_fossil': 'contributionParticipationMetadata', 'first_name': 'Brian', 'last_name': 'Cole', 'fullName': 'Cole, Brian', 'id': '3604873', 'affiliation': 'Columbia University (US)', 'emailHash': '5ac89c43538af2f10d3ef24f9575e165', 'db_id': 3604873, 'person_id': 3645180}"
Poster Session,poster,Kaon Isospin Fluctuation in Pb-Pb collisions at $\sqrt{s_{NN}}$ = 2.76 TeV with ALICE at LHC,"Nayak, Ranjit",IIT Bombay,India,"The first measurement of isospin fluctuations in the kaon sector is reported in Pb-Pb collisions at $\sqrt{s_{NN}}=$ 2.76 TeV, recorded with the ALICE detector. A robust statistical observable $\nu_{dyn}$ was used to extract the novel isospin fluctuations from the distributions of neutral and charged kaons as a function of collision centrality. The results show a significant variation in the behaviour of $\nu_{dyn}$ in data when compared to existing Monte-Carlo models such as HIJING and AMPT. The details of the analysis and systematic studies in the extraction of $\nu_{dyn}$ and its centrality dependence in both data and Monte-Carlo models are reported.","{'_type': 'ContributionParticipation', '_fossil': 'contributionParticipationMetadata', 'first_name': 'Ranjit', 'last_name': 'Nayak', 'fullName': 'Nayak, Ranjit', 'id': '3513474', 'affiliation': 'IIT Bombay', 'emailHash': '3a990fe0636867d9610f2cd25f2d3cfa', 'db_id': 3513474, 'person_id': 3641830}"
Poster Session,poster,"Production of pions, kaons and protons in p-Pb collisions at~$~\sqrt[]{s_{NN}}=$~8.16 TeV with ALICE at the LHC","Pisano, Silvia",INFN e Laboratori Nazionali di  Frascati (IT),Italy,"At the end of 2016 the ALICE detector, installed at the LHC, collected p-Pb data at a center of mass energy equal to $\sqrt[]{s_\textrm{\tiny{NN}}} =$~8.16 TeV.
These data represent an important chance to test the emergence of possible initial state effects, by comparing the spectra of identified light hadrons extracted in this dataset to the ones measured in previous pp and Pb-Pb data in a wide transverse momentum range.
In this poster, the first results on transverse momentum spectra for identified $\pi$, $K$ and p at $\sqrt[]{s_\textrm{\tiny{NN}}}=$~8.16 TeV measured through the capabilities of the ALICE \textrm{ITS}, \textrm{TPC} and \textrm{TOF} systems will be presented.
This analysis has been performed at midrapidity over a wide transverse-momenta range (100~MeV/$c$~$<$~\ensuremath{p_{\rm T}}~$<$~20~GeV/$c$) for different multiplicity classes ranging from central to peripheral ones.","{'_type': 'ContributionParticipation', '_fossil': 'contributionParticipationMetadata', 'first_name': 'Silvia', 'last_name': 'Pisano', 'fullName': 'Pisano, Silvia', 'id': '3513449', 'affiliation': 'INFN e Laboratori Nazionali di  Frascati (IT)', 'emailHash': '258f23b2d72b5a400d3d39248bfcdc3c', 'db_id': 3513449, 'person_id': 3645549}"
Poster Session,poster,STAR Measurements of Elliptic Flow in Small Collision Systems,"Sergeeva, Maria",UCLA,USA,"The coefficient of the second harmonic in azimuthal anisotropy ($v_2$) of produced particles gives insight to bulk properties of the medium being created in high-energy heavy-ion collisions. These measurements have provided important evidence of the partonic collective motion in the quark-gluon plasma (QGP). In recent years, the study of collective motion in small systems has gained increased attention. These studies aim to answer the questions of how small a QGP droplet can be and what is the boundary between a confined and deconfined medium. However, non-flow correlations, especially due to jets and di-jets, can influence the observed flow and may tend to dominate in small systems. Therefore, special care has to be taken to differentiate collectivity from non-flow contributions.

In this poster, we present the STAR measurements of charged-hadron elliptic flow, $v_2$, in p+Au collisions at $\sqrt{s_{NN}} = 200$ GeV, and in d+Au collisions at 200, 62.4, 39 and 19.6 GeV. Data analysis is done with the event plane method, and with 2-particle and 4-particle cumulants. The results will be shown as a function of multiplicity which provides control of the system size. This will be compared with peripheral Au+Au collisions with similar multiplicities at the same center of mass energies to determine whether or where the onset of the QGP exists in these small systems.","{'_type': 'ContributionParticipation', '_fossil': 'contributionParticipationMetadata', 'first_name': 'Maria', 'last_name': 'Sergeeva', 'fullName': 'Sergeeva, Maria', 'id': '3613328', 'affiliation': 'UCLA', 'emailHash': 'b7923dad4af669d349cabe6fce48e302', 'db_id': 3613328, 'person_id': 3796276}"
